username;date;retweets;favorites;text;geo;mentions;hashtags;id;permalink
HennesseyCast;2016-08-31 10:49;0;2;"ADDITIONAL CASTING - LIVE TV FASHION SHOW FOR GIRLS AGE 13-16! HALIFAX NS- http:// eepurl.com/cdGupL";;;;"770981914853474304";https://twitter.com/HennesseyCast/status/770981914853474304
cheeseheadeddie;2016-08-31 09:00;0;1;"I am jealous, that show they played in Halifax way back when is one of my fav concerts ever";;;;"770954425980579840";https://twitter.com/cheeseheadeddie/status/770954425980579840
nabokovtheatre;2016-08-31 08:48;1;1;"@CreativeCalder We're bringing our show SLUG to Halifax on Friday! Storytelling, live music & beatbox! http://www. squarechapel.co.uk/whats-on/slug/ Please RT!";;@CreativeCalder;;"770951409584005121";https://twitter.com/nabokovtheatre/status/770951409584005121
nabokovtheatre;2016-08-31 07:45;2;2;"@choltheatre Bringing our show #Slug to Halifax Friday! Live Music, Spoken Word & beatbox! Supported by local acts! http:// bit.ly/2bBfDMV";;@choltheatre;#Slug;"770935649285312512";https://twitter.com/nabokovtheatre/status/770935649285312512
novascotiadoug;2016-08-30 20:59;1;5;"https:// youtu.be/Yik5P7Gcf2c @OpieRadio Hey Op this may me a nice opener for your show tomorrow really cool band from Halifax great new song";;@OpieRadio;;"770772915302326272";https://twitter.com/novascotiadoug/status/770772915302326272
GuyBabin;2016-08-30 19:52;0;0;"If you're not watching the sunset right now #Halifax you're missing a great show . #NSwx pic.twitter.com/8mv5j147so";;;#Halifax #NSwx;"770756055211110401";https://twitter.com/GuyBabin/status/770756055211110401
katiemengler;2016-08-30 16:39;0;0;"I was really excited to go to halifax in november but it's 9.5 hours away from the show the day before and 11.5 from the show after";;;;"770707580519940096";https://twitter.com/katiemengler/status/770707580519940096
MidCanSocClub;2016-08-30 16:00;0;0;"#middleton #heywood Thailand: Officials Look To Relax Drug Laws As New Poll Shows 80% Want... http:// bit.ly/2byyhGw #halifax #rochdale";;;#middleton #heywood #halifax #rochdale;"770697726371639296";https://twitter.com/MidCanSocClub/status/770697726371639296
natjarvis;2016-08-30 15:58;0;0;"Did you see @frankturner at The Marquee in Halifax a few months back? Fantastic show .";;@frankturner;;"770697206642970624";https://twitter.com/natjarvis/status/770697206642970624
kikihtweet;2016-08-30 11:39;0;3;"Is @hfxtransit the worst transit system on earth? Quite probably!! The 20 downtown is a no show AGAIN! #Halifax #transit #bus #worst";;@hfxtransit;#Halifax #transit #bus #worst;"770632006837428224";https://twitter.com/kikihtweet/status/770632006837428224
BDiamondProd;2016-08-30 10:13;0;0;"A FAN FAVOURITE! The Barra MacNeils are bringing their famous Christmas show to #Halifax on December 19 at 7:30... http:// fb.me/2jM5xxlm7";;;#Halifax;"770610331655610369";https://twitter.com/BDiamondProd/status/770610331655610369
TheRickHoweShow;2016-08-30 08:45;0;0;"Good morning Nova Scotia! Here is what we have lined up for today's show : http://www. news957.com/the-rick-howe- show/ … #Halifax #NS";;;#Halifax #NS;"770588285219528704";https://twitter.com/TheRickHoweShow/status/770588285219528704
BJessomePR;2016-08-30 08:32;0;4;"someday's I wish I had a dashboard camera so I could show the world what it's like to drive in Halifax .";;;;"770584986185527296";https://twitter.com/BJessomePR/status/770584986185527296
SusSuidae;2016-08-29 22:38;1;0;">> Below-par Pakistan hope to show spine in must-win game: … after Pakistan had been redu... http:// bit.ly/2c5YAzI #rochdale #halifax";;;#rochdale #halifax;"770435547143647232";https://twitter.com/SusSuidae/status/770435547143647232
kilhassin;2016-08-29 20:52;0;2;"Let @TheDanocracy show you the best of #Halifax #likeatourist http://www. huffingtonpost.ca/2016/07/26/wha t-to-do-in-halifax-like-a-tourist_n_11199496.html … #via @HPCaTravel";;@TheDanocracy @HPCaTravel;#Halifax #likeatourist #via;"770408718940958720";https://twitter.com/kilhassin/status/770408718940958720
LabonBull;2016-08-29 18:09;0;0;"i really want everyone to come visit me in NS bc I want to show everyone Peggies Cove and Halifax";;;;"770367670411603968";https://twitter.com/LabonBull/status/770367670411603968
StephenFax;2016-08-29 17:59;0;0;"Big well done to the @Halifax _RLFC players & coaching staff for today's win. The young players on show did very well. #WinAwayWinAway";;@Halifax;#WinAwayWinAway;"770365299245903872";https://twitter.com/StephenFax/status/770365299245903872
LucasOickle;2016-08-29 17:41;1;4;"Final show tonight, 7pm at St. Matthew's in Halifax : @NSYOrchestra dir. by @WijeratneWorks feat. @NadinaMackJack pic.twitter.com/hGPm2AGy5I";;@NSYOrchestra @WijeratneWorks @NadinaMackJack;;"770360809918574592";https://twitter.com/LucasOickle/status/770360809918574592
thewantedoutlaw;2016-08-29 13:42;0;0;"@IMPACTWRESTLING Tour Canada. Halifax ,Sydney,NFLD,PEI Indys r selling more tickets in Sydney than any US show with 1 -2 Legends The Maritimes";;@IMPACTWRESTLING;;"770300578257833984";https://twitter.com/thewantedoutlaw/status/770300578257833984
TheRickHoweShow;2016-08-29 12:18;0;1;"We end the show with another #Halifax history moment, featuring local historian, author and tour guide, Blair Beed!";;;#Halifax;"770279488097771522";https://twitter.com/TheRickHoweShow/status/770279488097771522
TheUPSStore71;2016-08-29 12:01;1;1;"We're preparing for the fall trade show season. Are you? Let us print your bcards, flyers and more! #halifax pic.twitter.com/Rm4GuR4Px6";;;#halifax;"770275305466523648";https://twitter.com/TheUPSStore71/status/770275305466523648
HennesseyCast;2016-08-29 11:46;0;1;"LIVE TV FASHION SHOW FOR KIDS age 4-10! HALIFAX NS - http:// eepurl.com/cdl7Gf";;;;"770271336765788161";https://twitter.com/HennesseyCast/status/770271336765788161
halifaxnoise;2016-08-29 10:41;1;0;"TONIGHT at GUS' From @avcomedy2049 — Amazing comedy show tonight #Halifax at Gus' Pub. 8:3… http:// ift.tt/2bQGG58 pic.twitter.com/uqJoMiJ0ZS";;@avcomedy2049;#Halifax;"770255158412451840";https://twitter.com/halifaxnoise/status/770255158412451840
andyhfxneedham;2016-08-29 10:41;2;1;"Thanks to @globalhalifax and @Andrea_Dion for having me on the show to discuss the campaign: http:// globalnews.ca/video/2904932/ halifax-needham-by-election-pc-candiate-andy-arsenault … #nspoli #Halifax";;@globalhalifax @Andrea_Dion;#nspoli #Halifax;"770254936894562304";https://twitter.com/andyhfxneedham/status/770254936894562304
LivOnShoestring;2016-08-29 09:52;0;1;"yes, I'm from Halifax ! I've been living in London for two years now! It's great :) Are you playing any shows here?";;;;"770242721307062272";https://twitter.com/LivOnShoestring/status/770242721307062272
andrewavaughan;2016-08-29 09:37;0;1;"Awesome comedy show #Halifax tonight @GusPub 8:30 start time. Amazing lineup. #comedy #standup #HRM pic.twitter.com/tkj2oU0WYH";;@GusPub;#Halifax #comedy #standup #HRM;"770238991736115200";https://twitter.com/andrewavaughan/status/770238991736115200
TheRickHoweShow;2016-08-29 08:33;0;0;"Good morning Nova Scotia! Hope you had a great weekend. Here is what we have planned for today's show : http://www. news957.com/the-rick-howe- show/ … #NS #Halifax";;;#NS #Halifax;"770222876414926848";https://twitter.com/TheRickHoweShow/status/770222876414926848
sarahwarn;2016-08-29 00:22;0;2;"yes, both seasons. Great show ! Sarah Lancashire is a terrific actress (in Last Tango in Halifax too)";;;;"770099321178034177";https://twitter.com/sarahwarn/status/770099321178034177
HiImInABand;2016-08-28 21:59;0;4;"Haven't tweeted in a while! Touring the east coast with my band! In Halifax tonight playing a show . Let's do this! #Halifax #poppunk";;;#Halifax #poppunk;"770063167590465538";https://twitter.com/HiImInABand/status/770063167590465538
TrenchMonster;2016-08-28 21:16;0;1;"HEY!! @mtrench remember this show !? #halifax pic.twitter.com/GK6um2Pcly";;@mtrench;#halifax;"770052414816780288";https://twitter.com/TrenchMonster/status/770052414816780288
wastedbogle;2016-08-28 21:15;0;0;"thoughts on playing shows in Halifax";;;;"770052252342124545";https://twitter.com/wastedbogle/status/770052252342124545
KooKooKangaRoo;2016-08-28 21:00;10;22;"Canada we're coming your way for a bunch of headline shows in October. Halifax 2 Vancouver http:// kookookangaroo.com/shows/ pic.twitter.com/TpVgq30z0J";;;;"770048562654744576";https://twitter.com/KooKooKangaRoo/status/770048562654744576
EmilyDave;2016-08-28 20:06;0;0;"@steveaustinBSR - I'm from Halifax and saw the show when you were allowed to drink again and swam in beer. Love the podcast thank you";;@steveaustinBSR;;"770034798681288704";https://twitter.com/EmilyDave/status/770034798681288704
tempestb_;2016-08-28 18:52;0;0;"Post show ! Hungry! And Room Service trippin' as usual!!! @Port Halifax , Nova Scotia, Canada https://www. instagram.com/p/BJqwvf5BDSK/";;@Port;;"770016318313627648";https://twitter.com/tempestb_/status/770016318313627648
big_islandtrio;2016-08-28 17:01;0;2;"Thanks to Fantasie Music of Halifax For Sponsoring Today's Waterfront Show pic.twitter.com/8pXUwBwfwa";;;;"769988339340632067";https://twitter.com/big_islandtrio/status/769988339340632067
TA_Stephenson;2016-08-28 16:02;0;1;"Welcome to the Jared MacIsaac show Halifax . Enjoy. #Mooseheads #QMJHL pic.twitter.com/MSLchfpcMU";;;#Mooseheads #QMJHL;"769973444402438144";https://twitter.com/TA_Stephenson/status/769973444402438144
roycegretzky;2016-08-28 11:38;0;0;"@rory_macdonald Hey Rory, please bring a @BellatorMMA show to Halifax .";;@rory_macdonald @BellatorMMA;;"769906946048663552";https://twitter.com/roycegretzky/status/769906946048663552
NikiJabbour;2016-08-28 11:33;0;2;"Talking to @Highbury2009 on @NEWS957 who has a garden show in Digby Co - http://www. jardinonsensante.podomatic.com #halifax";;@Highbury2009 @NEWS957;#halifax;"769905659978604548";https://twitter.com/NikiJabbour/status/769905659978604548
acadiaPCA;2016-08-28 10:45;4;6;"Wax on, wax off! We're headed to the Royal NS Yacht Squadron for our 2016 Show & Shine. #Porsche #Halifax pic.twitter.com/ppXTG2RyyE";;;#Porsche #Halifax;"769893787791396864";https://twitter.com/acadiaPCA/status/769893787791396864
marksultan;2016-08-28 08:25;1;3;"HALIFAX , NS tonight!! at Menz and Mollys last show of the tour. the Maritimes are beeyutiful";;;;"769858526332223488";https://twitter.com/marksultan/status/769858526332223488
Suzanne_Rent;2016-08-28 07:53;0;0;"@StreetPastors are coming to #Halifax . I talk with Gerry Leet about the program 7pm on my show @CIOE975 http://www. communityradio.ca";;@StreetPastors @CIOE975;#Halifax;"769850298261245952";https://twitter.com/Suzanne_Rent/status/769850298261245952
Stanwyn;2016-08-28 02:37;0;1;"What's happening #Halifax ? Isn't the show grooving tonight? I love you!!!";;;#Halifax;"769770926783115264";https://twitter.com/Stanwyn/status/769770926783115264
charlieann_83;2016-08-28 02:16;0;0;"@sueperkins gutted I can't get to your Halifax show (post honeymoon http:// v.cash poor!) but Spectacles is HILARIOUS! Enjoy t' show";;@sueperkins;;"769765502776254465";https://twitter.com/charlieann_83/status/769765502776254465
myhalevents;2016-08-27 22:05;1;1;"RT @mattmeusic : It's our last show at @pacificobar tonight so come make it a good send off! Starts at 11pm #Halifax pic.twitter.com/pDTHPurreV";;@mattmeusic @pacificobar;#Halifax;"769702305683890176";https://twitter.com/myhalevents/status/769702305683890176
IneffectiveMath;2016-08-27 21:49;0;0;"that is most unfortunate for you. Next time you're in Halifax come round and I'll show you.";;;;"769698362048311296";https://twitter.com/IneffectiveMath/status/769698362048311296
unlovedmusicsis;2016-08-27 21:19;0;0;"Have a Great Show Brett Love from Shanyn in Halifax";;;;"769690903132987392";https://twitter.com/unlovedmusicsis/status/769690903132987392
toriisu;2016-08-27 20:34;0;1;"Give me music/ show /movie reccs!! I won't have Internet when I'm in Halifax for a bit, so give me your reccs to download!";;;;"769679390686994432";https://twitter.com/toriisu/status/769679390686994432
HogansBeard;2016-08-27 20:08;0;0;"I'm supposed to head back to halifax for a show tonight. I will not be. Can't deal with another 1hr+ trip";;;;"769672882943328256";https://twitter.com/HogansBeard/status/769672882943328256
Signaturecake;2016-08-27 18:14;0;0;"I posted 5 photos on Facebook in the album " Halifax Agricultural Show 2016" http:// fb.me/53ykefyPJ";;;;"769644158168563718";https://twitter.com/Signaturecake/status/769644158168563718
I_Am_Halifax;2016-08-27 17:55;1;5;"We are LIVE http://www. twitch.tv/halifaxafilah ! I am sick but the show must go on <3 つ ◕_◕ ༽つ TWITCH GIVE ME ENERGY ༼ つ ◕_◕ ༽つ pic.twitter.com/ZmIGX8xR8X";;;;"769639395548917760";https://twitter.com/I_Am_Halifax/status/769639395548917760
DannoLeafs;2016-08-27 13:04;0;1;"hey what about Dmytro Timoshov kid? Could he make the team ? Hope he puts on a show in Halifax";;;;"769566221226352640";https://twitter.com/DannoLeafs/status/769566221226352640
Ryan__Patrick;2016-08-27 10:19;0;12;"Hey @wintersleep how about a Halifax Halloween show dressed as Kary some year?";;@wintersleep;;"769524660501417984";https://twitter.com/Ryan__Patrick/status/769524660501417984
AlexDLibrary;2016-08-27 08:43;0;1;"Halifax 's poet laureate uses poetry to call out concert-goers for wearing redface at A Tribe Called Red show http://www. cbc.ca/1.3735392";;;;"769500491608944640";https://twitter.com/AlexDLibrary/status/769500491608944640
ButterscotchPal;2016-08-27 08:34;0;0;"Butterscotch Palace will be performed @AtlanticFringe from Sept. 1-11. We'll have 6 shows . We'd love for you to come see our show . #Halifax";;@AtlanticFringe;#Halifax;"769498322822393860";https://twitter.com/ButterscotchPal/status/769498322822393860
sfemonster;2016-08-27 01:07;0;8;"“Do people still listen to Sloan?” I ask, googling Sloan and discovering a) they do not show up on a “sloan” search b) THEY’RE FROM HALIFAX ?";;;;"769385858579431428";https://twitter.com/sfemonster/status/769385858579431428
blackdogpat;2016-08-26 23:16;0;0;"this is the best reality show man!";;;;"769357883834335232";https://twitter.com/blackdogpat/status/769357883834335232
JustinPEI;2016-08-26 23:09;0;0;"Knew @fluffyguy was playing Halifax and Moncton. Got tix to Hali show and then found out he's in Ch'town too. Surprised it wasn't promoted.";;@fluffyguy;;"769356050491437056";https://twitter.com/JustinPEI/status/769356050491437056
myhalevents;2016-08-26 19:49;0;0;"Towers of Tease Burlesque Show - Halifax w/Special Guest Kay Licious http:// halevents.ca/halifax-dartmo uth-bedford-sackville-ns-events/2021/towers-of-tease-burlesque-show-halifax-wspecial-guest-kay-licious/?utm_source=dlvr.it&utm_medium=twitter … #halevents #halifax pic.twitter.com/YF4ROeP8Ly";;;#halevents #halifax;"769305707661307904";https://twitter.com/myhalevents/status/769305707661307904
FreemansPizza;2016-08-26 17:31;0;1;"Happy National Dog Day! Show some luv, tweet a pic of your pup for a chance to #WIN a Med PIZZA! #Halifax #Sackville pic.twitter.com/Mw56UWyIDB";;;#WIN #Halifax #Sackville;"769271020242993153";https://twitter.com/FreemansPizza/status/769271020242993153
wipeoutbeat;2016-08-26 17:04;0;1;"Second last show of the tour tonight in Halifax with @nameofmoon and Century Egg! This one should be a right ripper. https://www. facebook.com/events/8817201 95261669/ …";;@nameofmoon;;"769264395704602624";https://twitter.com/wipeoutbeat/status/769264395704602624
NeilBRoberts;2016-08-26 15:02;0;0;"So unfair! Saw you in AAA on last day at festival so couldn't stop for your full show . Are you touring it? Will you be near Halifax ?";;;;"769233594007031808";https://twitter.com/NeilBRoberts/status/769233594007031808
JRamsaysDarling;2016-08-26 13:31;0;0;"but I might be going to visit her in Nova Scotia this November so we would be going to the Monkton and halifax shows";;;;"769210789534298112";https://twitter.com/JRamsaysDarling/status/769210789534298112
MidCanSocClub;2016-08-26 13:30;0;0;"#middleton #heywood New Study: Sativex Shows Promise As Potential Therapy for Treatment Re... http:// bit.ly/2blMild #halifax #rochdale";;;#middleton #heywood #halifax #rochdale;"769210486059438080";https://twitter.com/MidCanSocClub/status/769210486059438080
TwistedWillowHx;2016-08-26 12:38;1;4;"Our designer whipped this up #orchids #hydrangea we just had to show you ! #flowers #halifax pic.twitter.com/Uq27ssKl5Y";;;#orchids #hydrangea #flowers #halifax;"769197353538613252";https://twitter.com/TwistedWillowHx/status/769197353538613252
spectrasonic;2016-08-26 12:04;1;0;"NEW SHOW ! Halifax rocker @AdamaBaldwin returns to @Zaphods_Ottawa Friday Sept 30, tickets on sale NOW! https://www. facebook.com/events/1783528 691926676/ …";;@AdamaBaldwin @Zaphods_Ottawa;;"769188838027714561";https://twitter.com/spectrasonic/status/769188838027714561
DPurcell17;2016-08-26 11:05;0;1;"I can't wait to see who shows up at the Halifax pre season game. Paid $175 for 2 tickets!";;;;"769173864681177089";https://twitter.com/DPurcell17/status/769173864681177089
MAYHEMINGWAYS;2016-08-26 09:08;2;4;"Tonight we're in Guelph ON. At Fion McCool's. @hillsburnband from Halifax will also be there. Free show .";;@hillsburnband;;"769144543426056192";https://twitter.com/MAYHEMINGWAYS/status/769144543426056192
zeptepe;2016-08-26 08:47;0;0;"Be sure to check out the #Halifax Circus show "Nautica: a Circus Sea Journey" during the Fringe Festival. http:// atlanticfringe.tickethalifax.com/events/3601830 7/nautica-a-circus-sea-journey …";;;#Halifax;"769139137995767808";https://twitter.com/zeptepe/status/769139137995767808
webbtj;2016-08-25 20:49;0;0;"or just send them back to Halifax for a show , I'm starting to wonder if they exist";;;;"768958427586494466";https://twitter.com/webbtj/status/768958427586494466
neilsmiles;2016-08-25 19:10;0;8;"Thousands of films & TV shows available at my fingertips and I'm watching The Hit Man & Her from The Coliseum Halifax (1989)";;;;"768933553790971904";https://twitter.com/neilsmiles/status/768933553790971904
EasternViolet;2016-08-25 18:48;0;2;"really. I'm counting on them announcing a show in Halifax . Because that would be the best thing ever!";;;;"768927986703818752";https://twitter.com/EasternViolet/status/768927986703818752
HannesRead;2016-08-25 18:24;0;0;"it's great non-league football is getting national coverage. But would BBC air a show on the revival of Darlo, Halifax , Chester?";;;;"768921919341129728";https://twitter.com/HannesRead/status/768921919341129728
rob1166;2016-08-25 17:41;0;0;"Halifax 's poet laureate uses poetry to call out concert-goers for wearing redface at A Tribe Called Red show http://www. cbc.ca/1.3735392";;;;"768911277393518592";https://twitter.com/rob1166/status/768911277393518592
kilmoreband;2016-08-25 16:23;1;4;"Hey all! Just wanted to post about our upcoming show with Bloody Diamonds at Black Buffalo Records in Halifax . We... http:// fb.me/5nTV63a0d";;;;"768891667554283521";https://twitter.com/kilmoreband/status/768891667554283521
TheGameCaller;2016-08-25 15:21;4;13;"Glenn Morrison is expecting the same: "It’s going to be a tough one. I'm looking for the players to show the kind of commitment v Halifax ."";;;;"768875941791760384";https://twitter.com/TheGameCaller/status/768875941791760384
NightTimePod;2016-08-25 15:12;1;2;"@discoverhalifax my #Halifax based show on @bizarrepedia best crime podcasts list, despite only covering AtlCanada! https://www. bizarrepedia.com/podcasts/";;@discoverhalifax @bizarrepedia;#Halifax;"768873637361229825";https://twitter.com/NightTimePod/status/768873637361229825
TraskAlyssa;2016-08-25 14:08;8;78;"So excited for the show tonight in Halifax !! #BigTicketSummer who's ready?";;;#BigTicketSummer;"768857684313575425";https://twitter.com/TraskAlyssa/status/768857684313575425
kayleighem_;2016-08-25 14:05;2;2;"Want your show on stage? @Eastern_Front wants submissions for #Stages2017 : http://www. easternfronttheatre.com/STAGES/stages- theatre-festival/ … Deadline OCT 1. #Halifax #theatre #arts";;@Eastern_Front;#Stages2017 #Halifax #theatre #arts;"768856895583031297";https://twitter.com/kayleighem_/status/768856895583031297
MB20Exiles;2016-08-25 13:01;0;4;"Next show is at #vinniespub at Mount Saint Vincent University in Halifax on Sept 8 at 10pm. Welcome Back Pub! pic.twitter.com/KLbH21UfQ0";;;#vinniespub;"768840766353473536";https://twitter.com/MB20Exiles/status/768840766353473536
MatthiessenNQ;2016-08-25 12:58;0;5;"Last night was rock and roll Loving this light show they've put together for us! Excited for Halifax tonight! pic.twitter.com/lvFbCInbKv";;;;"768839965618933760";https://twitter.com/MatthiessenNQ/status/768839965618933760
f_fiallos;2016-08-25 12:00;2;2;"#Halifax ! @Dalnews ! @smuhalifax ! Looking for show /podcast pitches from you folks! Email francella@ckdu.ca";;@Dalnews @smuhalifax @ckdu;#Halifax;"768825368337911808";https://twitter.com/f_fiallos/status/768825368337911808
NightTimePod;2016-08-25 11:38;1;1;"@halifaxbloggers my #Halifax based shows on @bizarrepedia best crime podcasts list, despite only covering AtlCanada! http:// bit.ly/2bQ2xZf";;@halifaxbloggers @bizarrepedia;#Halifax;"768819929973821441";https://twitter.com/NightTimePod/status/768819929973821441
NightTimePod;2016-08-25 11:38;0;0;"@HalifaxMagazine my #Halifax based show on @bizarrepedia best crime podcasts list, despite only covering AtlCanada! http:// bit.ly/2bQ2xZf";;@HalifaxMagazine @bizarrepedia;#Halifax;"768819815909761025";https://twitter.com/NightTimePod/status/768819815909761025
NightTimePod;2016-08-25 11:37;1;2;"@CKDU881FM my #Halifax based show is on @bizarrepedia list of best crime podcasts, despite only covering Atl Canada! http:// bit.ly/2bQ2xZf";;@CKDU881FM @bizarrepedia;#Halifax;"768819541996507137";https://twitter.com/NightTimePod/status/768819541996507137
NightTimePod;2016-08-25 11:36;0;1;"@CBCNS my #Halifax based show is on @bizarrepedia list of best crime podcasts, despite only covering Atl Canada! http:// bit.ly/2bQ2xZf";;@CBCNS @bizarrepedia;#Halifax;"768819394889658368";https://twitter.com/NightTimePod/status/768819394889658368
NightTimePod;2016-08-25 11:36;0;0;"@TwitCoast my #Halifax based show 's on @bizarrepedia list of best crime podcasts, despite only covering Atl Canada! http:// bit.ly/2bQ2xZf";;@TwitCoast @bizarrepedia;#Halifax;"768819310336671744";https://twitter.com/NightTimePod/status/768819310336671744
Mr_NovaScotia;2016-08-25 11:20;0;0;"@joerogan @hannibalburess If you guys are doing a show in Newfoundland, come see us in Halifax , Nova Scotia: http://www. dal.ca/dept/arts-cent re/client-services/rent-the-rebecca-cohn.html …";;@joerogan @hannibalburess;;"768815319578243072";https://twitter.com/Mr_NovaScotia/status/768815319578243072
MarkDPhotos;2016-08-25 10:28;0;0;"Getting Married in 2017-2018? Estate on the Halifax is having their Bridal show open house! I have an huge sale... http:// fb.me/1roLuledL";;;;"768802162876874753";https://twitter.com/MarkDPhotos/status/768802162876874753
TechnocratParty;2016-08-25 08:25;0;0;"#TECHNOCRATS RULE GCSE results show significant decline: This year's GCSE results have fal... http:// bbc.in/2bkW9ao #rochdale #halifax";;;#TECHNOCRATS #rochdale #halifax;"768771353855995904";https://twitter.com/TechnocratParty/status/768771353855995904
TheRickHoweShow;2016-08-25 08:23;0;0;"Good morning! Here is what we have lined up for today's show : http://www. news957.com/the-rick-howe- show/ … #Halifax";;;#Halifax;"768770800866455553";https://twitter.com/TheRickHoweShow/status/768770800866455553
DartmouthDerek;2016-08-25 08:08;2;6;"The ten-fold increase in traffic on the Bluff trail shows the huge demand for near urban wilderness experiences in Halifax . @HfxAdventure";;@HfxAdventure;;"768767017818009601";https://twitter.com/DartmouthDerek/status/768767017818009601
djmes1;2016-08-25 02:57;2;1;"Here is my mix from The Halifax Mutha Fuckin Classics show . What a weekend! Hope ya dig it. #housemusic #house ... http:// fb.me/4Zq5xedE8";;;#housemusic #house;"768688846531760129";https://twitter.com/djmes1/status/768688846531760129
emelki1968;2016-08-25 01:29;0;1;"Last Tango in Halifax . Great couples show . Chefs Table if you like food or Almodovar's "Volver",to have something different.";;;;"768666652426711040";https://twitter.com/emelki1968/status/768666652426711040
CatWhispurrer;2016-08-25 01:05;0;2;"Int'l HALL OF SHAME!!! #Boycott the Rick Howe Show and Halifax too. #Corruption https:// twitter.com/IACHallofShame /status/766217758862376960 …";;;#Boycott #Corruption;"768660672041226240";https://twitter.com/CatWhispurrer/status/768660672041226240
Skeleton_Rebel;2016-08-24 23:27;0;0;"@zackalltimelow dude at the Halifax Nova Scotia concert you should totally show off your ability to stretch your skin lol";;@zackalltimelow;;"768635837986795521";https://twitter.com/Skeleton_Rebel/status/768635837986795521
DarcyMK;2016-08-24 21:47;0;0;"@fluffyguy any chances that you are giving away tickets to your Halifax Nova Scotia show ?";;@fluffyguy;;"768610715431206912";https://twitter.com/DarcyMK/status/768610715431206912
SherCarmont;2016-08-24 17:52;3;2;"This shows #refugeeswelcome here in my beautiful city of #Halifax . #Proud of the #generosity I continuously see. https:// twitter.com/IsaacMbaziira1 /status/768528055975444480 …";;;#refugeeswelcome #Halifax #Proud #generosity;"768551603385368577";https://twitter.com/SherCarmont/status/768551603385368577
StrikingStarr;2016-08-24 17:04;1;2;"I'd be happy to welcome you to Halifax by stretching you into submission! Show me what you've got! #StarrvsRhodes";;;#StarrvsRhodes;"768539406772862982";https://twitter.com/StrikingStarr/status/768539406772862982
ArtZoneGallery;2016-08-24 16:04;2;3;"SNEAK PEAK of of our 2016 Annual Member Show ! @DowntownHalifax #Halifax #NovaScotia #art https://www. facebook.com/events/1133953 063308381/ … pic.twitter.com/UcTmqZpOY3";;@DowntownHalifax;#Halifax #NovaScotia #art;"768524289918238720";https://twitter.com/ArtZoneGallery/status/768524289918238720
