username;date;retweets;favorites;text;geo;mentions;hashtags;id;permalink
chantelmcgregor;2016-09-23 00:25;2;2;"Chantel McGregor has a show on 2016-09-24 at 19:30 @Halifax Playhouse in Halifax , YOR https://www. reverbnation.com/q/6qe216 #concert";;@Halifax;#concert;"779159836487397376";https://twitter.com/chantelmcgregor/status/779159836487397376
lexjayxo;2016-09-23 00:16;1;1;"hell nah Halifax and Gw yo!!! that'll right there is the show alone";;;;"779157520036356096";https://twitter.com/lexjayxo/status/779157520036356096
LogManMaritimes;2016-09-22 23:11;1;0;"Follow our show @AtlCanCaper on Twitter today! #CBRM #Halifax #Dartmouth #Antigonish #Moncton #fredericton #SaintJohn #StJohns #pei";;@AtlCanCaper;#CBRM #Halifax #Dartmouth #Antigonish #Moncton #fredericton #SaintJohn #StJohns #pei;"779141039231819776";https://twitter.com/LogManMaritimes/status/779141039231819776
RKMJ13;2016-09-22 22:56;0;1;"Revenge Killed Mary Jane has a show on 2016-09-24 at 20:00 @Gus' Pub in Halifax , NS https://www. reverbnation.com/q/6qdy85 #concert";;@Gus;#concert;"779137415654936576";https://twitter.com/RKMJ13/status/779137415654936576
green_interview;2016-09-22 22:00;0;0;"Discussing Green Rights & Warrior Lawyers on CBC's Info Morning in Halifax tomorrow at 8:15, and on the Rick Howe Show on News 95.7 at 9:45 pic.twitter.com/JjbdJbBpQC";;;;"779123243013795840";https://twitter.com/green_interview/status/779123243013795840
silverdonald;2016-09-22 22:00;4;1;"Discussing Green Rights & Warrior Lawyers on CBC's Info Morning in Halifax tomorrow at 8:15, and on the Rick Howe Show on News 95.7 at 9:45 pic.twitter.com/bcNOaIRUiP";;;;"779123242321735680";https://twitter.com/silverdonald/status/779123242321735680
GreenRightsFilm;2016-09-22 22:00;0;0;"Discussing Green Rights & Warrior Lawyers on CBC's Info Morning in Halifax tomorrow at 8:15, and on the Rick Howe Show on News 95.7 at 9:45 pic.twitter.com/lEinHa6Xmo";;;;"779123242200133632";https://twitter.com/GreenRightsFilm/status/779123242200133632
BankReformers;2016-09-22 21:56;0;0;"Paul Hellyer will be saying NO to CETA on the Rick Howe show LIVE in Halifax NS on Friday, September 23rd at... http:// fb.me/1lF0FF40S";;;;"779122279145955329";https://twitter.com/BankReformers/status/779122279145955329
Fireside_HFX;2016-09-22 21:35;0;1;"Come and see us after the show ! @NeptuneTheatre #Halifax #downtown pic.twitter.com/lCEURWpj44";;@NeptuneTheatre;#Halifax #downtown;"779116871413014528";https://twitter.com/Fireside_HFX/status/779116871413014528
TomsHavana;2016-09-22 21:35;0;2;"Come and see us after the show ! @NeptuneTheatre #Halifax #downtown pic.twitter.com/Yq0nmHUesY";;@NeptuneTheatre;#Halifax #downtown;"779116858528174080";https://twitter.com/TomsHavana/status/779116858528174080
MorganeOgerBC;2016-09-22 20:15;0;0;"I will be in #Halifax #NS from 3 to 12 October. If any #trans or #LGBT orgs can find a place to show the 'In Alliance' film I can do Q&A";;;#Halifax #NS #trans #LGBT;"779096879548080128";https://twitter.com/MorganeOgerBC/status/779096879548080128
elisebesler;2016-09-22 20:07;0;0;"Seeking cool, perhaps quirky venues for a live music show in Halifax ~ the cooler the better! Get at me! #halifax #halifaxmusic";;;#halifax #halifaxmusic;"779094770589265920";https://twitter.com/elisebesler/status/779094770589265920
celebritystatu5;2016-09-22 18:41;0;2;"Hi my friend is selling 3 tickets to All Time Low, Simple Plan and PVRIS for the Halifax show . If you are interested in going pls msg me!!";;;;"779073200349065216";https://twitter.com/celebritystatu5/status/779073200349065216
MartL1;2016-09-22 18:24;0;0;"2 great sets of pecks on show there #muscles";;;#muscles;"779068973958721538";https://twitter.com/MartL1/status/779068973958721538
JBrofromNSco;2016-09-22 17:54;0;0;"@classified Trying to find someone to see your Halifax show with!";;@classified;;"779061355613655041";https://twitter.com/JBrofromNSco/status/779061355613655041
andyhollinshead;2016-09-22 17:35;0;0;",just noticed,you are Halifax ,mine are for the Stoke show .1st Oct";;;;"779056483870859264";https://twitter.com/andyhollinshead/status/779056483870859264
FletJan;2016-09-22 17:24;0;0;"They were at the Ottawa Blues Fest a few years back and then we saw them in Halifax after that. Great show !";;;;"779053847117336576";https://twitter.com/FletJan/status/779053847117336576
guitars4VETSCan;2016-09-22 17:22;1;4;"@FFDP we would really like some tickets to your show in Halifax . Support for Canadian Soldiers and veterans suffering with PTSD.";;@FFDP;;"779053196828413952";https://twitter.com/guitars4VETSCan/status/779053196828413952
RuthKapelus;2016-09-22 16:55;0;0;"in-game crew is in Halifax for training camp. I'm guessing the NHL. They're running the show .";;;;"779046398104772608";https://twitter.com/RuthKapelus/status/779046398104772608
DartGalleryNS;2016-09-22 16:16;3;6;"Love this gorgeous Town Clock painting by @MaeisArt ! Part of her new show on now #h #darmouth #halifax pic.twitter.com/j3BeoibOaf";;@MaeisArt;#h #darmouth #halifax;"779036551229636608";https://twitter.com/DartGalleryNS/status/779036551229636608
TheDanceCurrent;2016-09-22 16:13;0;0;"This weekend in Halifax : big anniversary show by @MoceanDance . Here's what they're highlighting >> http://www. thedancecurrent.com/video/quartet pic.twitter.com/AqEaKuGyFq";;@MoceanDance;;"779035801078247425";https://twitter.com/TheDanceCurrent/status/779035801078247425
TheReelPMac;2016-09-22 15:38;0;0;"Meghan, my 11 yr old, Jacqueline, wife and mom are driving to Boston from Halifax NS for the show , she is on hyperdrive!!!";;;;"779027089202765825";https://twitter.com/TheReelPMac/status/779027089202765825
RickHansenFdn;2016-09-22 14:35;5;12;"#TBT to Sept 1986 and the 7,000 Nova Scotians gathered at City Square in Halifax to show their support for the Man In Motion World Tour! pic.twitter.com/zN63D8izHX";;;#TBT;"779011157805920257";https://twitter.com/RickHansenFdn/status/779011157805920257
graftonstdinner;2016-09-22 13:24;0;0;"This is where Janis' hair hangs out after the show ! #offthewall #80shair #halifax #gsdt pic.twitter.com/CCl4fhEuyX";;;#offthewall #80shair #halifax #gsdt;"778993450326851584";https://twitter.com/graftonstdinner/status/778993450326851584
TheRickHoweShow;2016-09-22 12:26;2;2;"Thanks for another great show #Halifax ! Remember tomorrow we will be broadcasting live at the @MapleLeafs training camp in the @BMOCentrehfx";;@MapleLeafs @BMOCentrehfx;#Halifax;"778978769134579712";https://twitter.com/TheRickHoweShow/status/778978769134579712
DalArtsCentre;2016-09-22 12:23;0;0;"Hey #halifax - win tickets to the "Potted Potter" taking place (3 shows !) in the Cohn this weekend! https:// twitter.com/HalifaxEditor/ status/778559895838875648 …";;;#halifax;"778978140160917504";https://twitter.com/DalArtsCentre/status/778978140160917504
StooMetz;2016-09-22 12:21;4;4;"Phoenix the #HarrisHawk on the #Halifax waterfront today to show presence of a predator to frighten away seagulls. @halifaxnoise @haligonia pic.twitter.com/tH0TDNA6BR";;@halifaxnoise @haligonia;#HarrisHawk #Halifax;"778977418795216896";https://twitter.com/StooMetz/status/778977418795216896
MattYHZ;2016-09-22 11:03;0;2;"Two weeks til Halifax show !";;;;"778957777108475905";https://twitter.com/MattYHZ/status/778957777108475905
imagine_if_co;2016-09-22 10:05;0;0;"Not in Halifax but want to see the #youforgotthemince show ? Have a look at the other tour dates and venues here: http:// ow.ly/61Cq304eK1i";;;#youforgotthemince;"778943359310295048";https://twitter.com/imagine_if_co/status/778943359310295048
MariekeWalsh;2016-09-22 09:10;0;0;"Survey shows a drop from 41% to 38% approval, calls it statistically insignificant #nspoli #halifax pic.twitter.com/Cco9RKCLxf";;;#nspoli #halifax;"778929507554119681";https://twitter.com/MariekeWalsh/status/778929507554119681
MariekeWalsh;2016-09-22 09:09;1;0;"New @angusreidorg survey shows @StephenMcNeil w 3rd highest approval rating of provincial premiers #nspoli #Halifax http:// angusreid.org/premier-approv al-sept2016/ …";;@angusreidorg @StephenMcNeil;#nspoli #Halifax;"778929263248494592";https://twitter.com/MariekeWalsh/status/778929263248494592
thelewinskies2;2016-09-22 08:41;1;1;"Amazing show from @haydendesser last night in Halifax ! Voice is stronger then ever!! XO Have a fun tour!!";;@haydendesser;;"778922213311479808";https://twitter.com/thelewinskies2/status/778922213311479808
CaffeinatedMatt;2016-09-22 08:32;0;1;"This is a great time to show newcomers some of that maritime hospitality we're famous for #halifax #novascotia https:// twitter.com/EngageNS/statu s/778897033868537856 …";;;#halifax #novascotia;"778919951239446528";https://twitter.com/CaffeinatedMatt/status/778919951239446528
SusSuidae;2016-09-22 07:48;0;0;">> Brahamdagh seeking political asylum shows India’s deep involvement in terrorism in Paki... http:// bit.ly/2cNo5e4 #rochdale #halifax";;;#rochdale #halifax;"778908812627410944";https://twitter.com/SusSuidae/status/778908812627410944
ThisIsBenFuller;2016-09-22 07:46;0;1;"Billets purchased for @lowtheband Christmas show in #Halifax . See you there @adam0407 . #excited #festive";;@lowtheband @adam0407;#Halifax #excited #festive;"778908245289238528";https://twitter.com/ThisIsBenFuller/status/778908245289238528
DevilishAccord;2016-09-22 07:24;0;3;"You're so welcome! I can't wait to see the show when you get to Halifax .";;;;"778902868636135424";https://twitter.com/DevilishAccord/status/778902868636135424
WhaleSongProd;2016-09-21 23:29;2;5;"We're kind of nerdy, budgets give us a bit of thrill. Pre-production for our very first official show is underway! #musical theatre #halifax";;;#musical #halifax;"778783329298554880";https://twitter.com/WhaleSongProd/status/778783329298554880
MoniqueTL;2016-09-21 22:49;0;1;"Thank you @haydendesser for another amazing show @Halifax #frontrow pic.twitter.com/XNT7KVJJnd";;@haydendesser @Halifax;#frontrow;"778773289938391040";https://twitter.com/MoniqueTL/status/778773289938391040
LisaRichard99;2016-09-21 22:23;0;0;"Lisa Richard has a show on 2016-09-23 at 19:00 @Marriott Private Function in Halifax , NS https://www. reverbnation.com/q/6qclrq #concert";;@Marriott;#concert;"778766704906153984";https://twitter.com/LisaRichard99/status/778766704906153984
kimharrismusic;2016-09-21 22:17;0;10;""I don't know you personally, but thanks for sticking with me all these years." Tenderhearts leaving @haydendesser 's show in Halifax tonight";;@haydendesser;;"778765151369568260";https://twitter.com/kimharrismusic/status/778765151369568260
Mrjsamps;2016-09-21 22:13;0;0;"@joemachi have any shows in Halifax coming up?";;@joemachi;;"778764166916108290";https://twitter.com/Mrjsamps/status/778764166916108290
TheSummerRabbit;2016-09-21 21:15;2;1;"Hoping to have a release show in both Sydney and Halifax ! Wanna help out in anyway? Send us an email thesummerrabbit@gmail.com";;@gmail;;"778749527721246720";https://twitter.com/TheSummerRabbit/status/778749527721246720
DalScience;2016-09-21 20:52;0;0;"Don’t miss it! Reserve your free spot at a special @scilitweek show at the Halifax Planetarium tmrw: http:// bit.ly/2cCvcFW @astronomyns";;@scilitweek @astronomyns;;"778743616936161281";https://twitter.com/DalScience/status/778743616936161281
Corvak;2016-09-21 19:59;0;0;"yeah more of a general " shows i'd go to" thing, nothing ever comes to halifax xD";;;;"778730276360900609";https://twitter.com/Corvak/status/778730276360900609
DJ_Mindtrip;2016-09-21 19:05;0;0;"Kickin off the show with @djsnake @justinbieber Let Me Love You @DJ_Mindtrip @CKDU881FM @DalhousieU #halifax";;@djsnake @justinbieber @DJ_Mindtrip @CKDU881FM @DalhousieU;#halifax;"778716807846727680";https://twitter.com/DJ_Mindtrip/status/778716807846727680
chasmalloy;2016-09-21 17:51;0;0;"Fire this guy....evidence shows he is a bad actor.. Halifax officer says he was following training guidelines http://www. cbc.ca/1.3772125";;;;"778698151238578177";https://twitter.com/chasmalloy/status/778698151238578177
dansurround_;2016-09-21 14:42;0;2;"Why do they not do huge shows on Citadel hill anymore? That was my first experience in Halifax when I was just a teen!";;;;"778650572245311488";https://twitter.com/dansurround_/status/778650572245311488
ScotiaWeb;2016-09-21 12:08;0;0;"#Halifax Dub Kartel get serious: “It was awesome, probably our biggest show ever. Just a ... http:// bit.ly/2cKqSVi #NovaScotia #Music";;;#Halifax #NovaScotia #Music;"778611913571786753";https://twitter.com/ScotiaWeb/status/778611913571786753
NatashaPace;2016-09-21 12:05;0;0;"Video is very short & shows MacGillivary holding one of Acorns arms, backing up and throwing his name tag at Labonte #halifax";;;#halifax;"778611108420681728";https://twitter.com/NatashaPace/status/778611108420681728
sunhornby;2016-09-21 11:58;9;10;"Leafs won't release camp roster until Thursday's opening, keeping Lupul Watch on alert. Jim Hiller will run show in Halifax with Babs at WCH";;;;"778609370858795008";https://twitter.com/sunhornby/status/778609370858795008
myhalevents;2016-09-21 11:46;1;1;"Hayden EILF 20th Anniversary Show in Halifax http:// halevents.ca/halifax-dartmo uth-bedford-sackville-ns-events/1379/hayden-eilf-20th-anniversary-show-in-halifax/?utm_source=dlvr.it&utm_medium=twitter … #halevents #halifax pic.twitter.com/uy0cZf5nJI";;;#halevents #halifax;"778606332823805952";https://twitter.com/myhalevents/status/778606332823805952
PottersPress;2016-09-21 10:07;0;0;"Silver Donald Cameron and Marjorie Simmins will be on Global TV's Halifax morning show tomorrow, Sept 22, at 7:50 a.m. Tune in!";;;;"778581500673531904";https://twitter.com/PottersPress/status/778581500673531904
jimbryson;2016-09-20 22:46;0;17;"Halifax sells out a month ahead, Guelph sells literally almost no tickets with just days to the show . This is what life calls balance.";;;;"778410142144561157";https://twitter.com/jimbryson/status/778410142144561157
brewnoser;2016-09-20 15:20;0;0;"talk to Halifax fire department. Show them the racks.";;;;"778297737318129665";https://twitter.com/brewnoser/status/778297737318129665
familyfunyhz;2016-09-20 13:30;2;0;"Save the date: Cat Show Oct. 22-23 #Halifax #Dartmouth @ccawebsite @halifaxforum #cat #Halloween http:// ow.ly/sqYY304olHw pic.twitter.com/ujoYNU4q8w";;@ccawebsite @halifaxforum;#Halifax #Dartmouth #cat #Halloween;"778270075115765760";https://twitter.com/familyfunyhz/status/778270075115765760
thesmacleodshow;2016-09-20 12:33;1;0;"Good afternoon! We're back on @NEWS957 for another edition of the show . LISTEN: http:// player.news957.com #Halifax #NS";;@NEWS957;#Halifax #NS;"778255784631267328";https://twitter.com/thesmacleodshow/status/778255784631267328
TheDrake1001;2016-09-20 11:56;0;0;"We need a #DMB show in Halifax . https:// twitter.com/davematthewsbn d/status/778246182242021376 …";;;#DMB;"778246462408908801";https://twitter.com/TheDrake1001/status/778246462408908801
ChrissyDawnVee;2016-09-20 11:36;0;2;"@HawksleyWorkman Ugh, I just found a super cheap flight to Halifax for your December 14th show . So tempted. I need you to talk me into it.";;@HawksleyWorkman;;"778241547884167168";https://twitter.com/ChrissyDawnVee/status/778241547884167168
LiveArtDance;2016-09-20 11:10;0;1;"Great article from Halifax Mag about @MoceanDance 's show , opening this Thursday at 8! http:// ow.ly/QaOf304lt0f";;@MoceanDance;;"778234894703030272";https://twitter.com/LiveArtDance/status/778234894703030272
TheRickHoweShow;2016-09-20 10:28;5;11;"Thanks @TaylorFord55 and @KevyRespo30 for joining us on today's show . All the best this season! #Moosheads #Halifax pic.twitter.com/onjJMi0J0e";;@TaylorFord55 @KevyRespo30;#Moosheads #Halifax;"778224209197723648";https://twitter.com/TheRickHoweShow/status/778224209197723648
FusionHalifax;2016-09-20 10:19;6;5;"Fill the room this Thursday to show #Halifax 's next Mayor that issues affecting young people matter! #nspoli https://www. facebook.com/events/7739083 89378842/ … pic.twitter.com/QieNzyFLah";;;#Halifax #nspoli;"778222128189571074";https://twitter.com/FusionHalifax/status/778222128189571074
DentalatBSD;2016-09-20 03:14;0;0;"There's so much you can do to better your #smile — Bedford South Dentistry is proud to be able to show you the possibilities, #Halifax !";;;#smile #Halifax;"778115024783106049";https://twitter.com/DentalatBSD/status/778115024783106049
NewfiePete77;2016-09-19 23:04;0;0;"the Halifax show ?";;;;"778052212899577856";https://twitter.com/NewfiePete77/status/778052212899577856
andrewavaughan;2016-09-19 17:10;0;1;"In a couple hours #Halifax Megacomedy Mondays comes to Gus' Pub with a fantastic show . We have… https://www. instagram.com/p/BKjOkhRgAi-/";;;#Halifax;"777963205138247680";https://twitter.com/andrewavaughan/status/777963205138247680
andrewavaughan;2016-09-19 12:23;2;2;"#Halifax awesome show @GusPub tonight with two 22 minutes writers. Headlined by @TheAdamChristie #comedy pic.twitter.com/3QQk6i3JHk";;@GusPub @TheAdamChristie;#Halifax #comedy;"777890835626983424";https://twitter.com/andrewavaughan/status/777890835626983424
DevaRamkelawan;2016-09-19 11:24;0;0;"Documents show CSIS and RCMP's role in post-9/11 torture of 3 Canadians #cdnpoli #halifax #quebec #topoli #vanpoli http:// ln.is/www.cbc.ca/new s/cana/INL2W …";;;#cdnpoli #halifax #quebec #topoli #vanpoli;"777876093084852224";https://twitter.com/DevaRamkelawan/status/777876093084852224
cathyreinders;2016-09-19 11:15;0;0;"don't find anything, to bad show does not have a profile, @WKNDMornings Halifax sure Bill & Doug enjoy link, know I do with them!";;@WKNDMornings;;"777873802906759168";https://twitter.com/cathyreinders/status/777873802906759168
Fizzarcher;2016-09-19 09:45;0;0;"Sensational Sixties with top bands playing Halifax feelgood show http:// dlvr.it/MHpN7x pic.twitter.com/WrErcMpsYX";;;;"777851201656229888";https://twitter.com/Fizzarcher/status/777851201656229888
sarahwhitehfx;2016-09-19 09:17;0;0;"Perhaps if he saw some older male circus performers it would help? Halifax Circus puts on a good show at Nocturne";;;;"777844177145126912";https://twitter.com/sarahwhitehfx/status/777844177145126912
TheRickHoweShow;2016-09-19 08:40;0;0;"Morning #Halifax ! Today's show starts your week with some local politics, science and history. Here's a closer look: http://www. news957.com/the-rick-howe- show/ …";;;#Halifax;"777834691420364801";https://twitter.com/TheRickHoweShow/status/777834691420364801
TheDRUNKENHOUR;2016-09-19 08:28;0;0;"thesonreal show in Halifax the guitar man killin it @joeyresly #Propz https://www. instagram.com/p/BKiSz-aAj29L 4WX3KW091dbfrPzVquEeuBFOdU0/ …";;@joeyresly;#Propz;"777831824445800448";https://twitter.com/TheDRUNKENHOUR/status/777831824445800448
globalhalifax;2016-09-19 07:32;1;2;"Halifax dance company @moceandance swings by to preview their fifteen year anniversary show "Fifteen". http:// snpy.tv/2cVXzeG";;@moceandance;;"777817666161512448";https://twitter.com/globalhalifax/status/777817666161512448
HelpMe4MyGood;2016-09-19 03:24;0;0;"Just to show you kids what no scufs allowed vs scufs allowed looks like PHIZZURP NEVER BEAT HALIFAX (nV) IN ANY MODE COD4 XBOX 360 OR PS3";;;;"777755338359443456";https://twitter.com/HelpMe4MyGood/status/777755338359443456
Pattidbedwell;2016-09-19 00:34;0;1;"Robert Mirabel! Love painted Cave & all ur music, played all on radio show 89.9 fm CKDU Halifax . https:// twitter.com/vinceschilling /status/776949058145574912 …";;;;"777712495243001860";https://twitter.com/Pattidbedwell/status/777712495243001860
SunCoffeeHouse;2016-09-18 19:40;1;1;"Hey #Halifax we're on the air 8pm @newscotradio Listen for our goodbye summer welcome autumn show . #schfolk pic.twitter.com/3JhZsH02ww";;@newscotradio;#Halifax #schfolk;"777638354431062016";https://twitter.com/SunCoffeeHouse/status/777638354431062016
CITADELCC;2016-09-18 19:14;0;2;"We wanted the collection & lookbook to resemble the culture of Halifax and show the highlights of the city.";;;;"777631796456484864";https://twitter.com/CITADELCC/status/777631796456484864
Alex_WJ_Milne;2016-09-18 18:28;0;1;"my dad had his 64 Mercury Comet in the Halifax Car Show the other day, very classy cars. @milne351 pic.twitter.com/KAb4xv5CBe";;@milne351;;"777620295201021953";https://twitter.com/Alex_WJ_Milne/status/777620295201021953
donnagreen4;2016-09-18 15:22;1;1;"Ive just donated to Phoenix Radio in Halifax . They do a great job of training young people, plus great shows . https://www. justgiving.com/crowdfunding/h oward-priestley …";;;;"777573609124626432";https://twitter.com/donnagreen4/status/777573609124626432
DylanMenzie;2016-09-18 12:50;11;14;"Hey #NovaScotia heading your way for a few shows ! Come say hi! #Halifax #NewGlasgow #Sydney http:// Dylanmenzie.com pic.twitter.com/DnBYzJXbMo";;;#NovaScotia #Halifax #NewGlasgow #Sydney;"777535269507653632";https://twitter.com/DylanMenzie/status/777535269507653632
kensicomusic;2016-09-18 12:10;0;0;"Update: Halifax , Nova Scotia added - Sept. 21st󾭸Upcoming shows // Prochains shows : 18 Sept. 16h - Festival des... http:// fb.me/sKmdsJtP";;;;"777525194885857280";https://twitter.com/kensicomusic/status/777525194885857280
halimurphy;2016-09-18 12:05;0;0;"serious? YOUR photo clearly shows its a halifax police badge lol.";;;;"777523824711663617";https://twitter.com/halimurphy/status/777523824711663617
apatrickmurray;2016-09-18 10:31;0;0;"OPEN HOUSE! Today 2-4 at 3 Coldstream Run in Dartmouth! Beautiful former show home. Ready for you! $309k #Halifax pic.twitter.com/GX4ukAvVsZ";;;#Halifax;"777500364148998144";https://twitter.com/apatrickmurray/status/777500364148998144
BFI;2016-09-18 08:00;37;43;"That's the way to do it! A lively Punch and Judy show in Halifax , 1901 http:// bit.ly/2cloOQb #BritainOnFilm pic.twitter.com/IZDcd4Ke5k";;;#BritainOnFilm;"777462218732412929";https://twitter.com/BFI/status/777462218732412929
FBG_ActiveWear;2016-09-18 00:13;1;0;"http://www. fatbaldguyactivewear.com Let your FBG show . #Halifaxnoise #dalafterdark #halifax #Dartmouth #902 #novascotia #yhz pic.twitter.com/KCljrl6J2S";;;#Halifaxnoise #dalafterdark #halifax #Dartmouth #902 #novascotia #yhz;"777344830900932608";https://twitter.com/FBG_ActiveWear/status/777344830900932608
hfxcelticfest;2016-09-17 22:05;0;0;"Celtic Rant is putting on quite the show ! Live at the Halifax Forum Multipurpose Centre! http:// fb.me/R40nUyRB";;;;"777312439067025408";https://twitter.com/hfxcelticfest/status/777312439067025408
ears2dground;2016-09-17 21:42;0;1;"18 September in Halifax NS @CarletonHalifax : @joelplaskett & @Mo_kenney ​ Sold out show http://www. earstotheground.ca/component/ohan ah/a-very-special-evening-with-joel-plaskett%20mo-kenney-sold-out.html … @halifaxnoise @AwesomeHalifax";;@CarletonHalifax @joelplaskett @Mo_kenney @halifaxnoise @AwesomeHalifax;;"777306752538775553";https://twitter.com/ears2dground/status/777306752538775553
Alex_WJ_Milne;2016-09-17 21:16;1;7;"my dad had his 64 Mercury Comet in the Halifax Car Show the other day, very classy cars. @milne351 pic.twitter.com/BZvC8mkK44";;@milne351;;"777300156416978944";https://twitter.com/Alex_WJ_Milne/status/777300156416978944
SegwayNS;2016-09-17 20:43;3;3;"Who’s up for #SegsInTheCity Show Student ID for a FREE try. Victoria Park #Halifax 12-2pm Sept 18 #DalhousieU #SMU pic.twitter.com/MoAaTXkbhI";;;#SegsInTheCity #Halifax #DalhousieU #SMU;"777291823433805824";https://twitter.com/SegwayNS/status/777291823433805824
FBG_ActiveWear;2016-09-17 19:48;0;0;"http://www. fatbaldguyactivewear.com Let your FBG show . #Halifaxnoise #halifax #Dartmouth #902 #haligonia #novascotia #yhz pic.twitter.com/CSDfnFMvzG";;;#Halifaxnoise #halifax #Dartmouth #902 #haligonia #novascotia #yhz;"777278131853987840";https://twitter.com/FBG_ActiveWear/status/777278131853987840
shaun_driver;2016-09-17 16:28;0;1;"#Halifax shows it doesn't deserve nice things. Shockingly horrible attendance for @DavisCup . Take note @TennisCanada";;@DavisCup @TennisCanada;#Halifax;"777227817213915136";https://twitter.com/shaun_driver/status/777227817213915136
Atch_Media;2016-09-17 14:56;0;0;"Dream over for Ashton Athletic as FC Halifax class shows : Ashton Athletic's management trio weren't able to c... http:// jftb.a.boysofts.com/3cOR";;;;"777204583483314178";https://twitter.com/Atch_Media/status/777204583483314178
thebootlegsaint;2016-09-17 11:27;0;2;"It is way better than cartoons! (Also, crazy envious of the Halifax show ! You're gonna have the best time!!)";;;;"777151974991011840";https://twitter.com/thebootlegsaint/status/777151974991011840
TylerShawMusic;2016-09-17 11:15;8;54;"Just landed in #Halifax ! Show tonight at @Dalnews #FroshWeek #Dalhousie";;@Dalnews;#Halifax #FroshWeek #Dalhousie;"777149092191350785";https://twitter.com/TylerShawMusic/status/777149092191350785
FreemansPizza;2016-09-17 09:30;1;0;"Tonight at Freeman's #Fairview Friends! Get your dancin' shoes on! Show time at 8pm! #halifax http:// fb.me/9K7U1ATU1";;;#Fairview #halifax;"777122444427440128";https://twitter.com/FreemansPizza/status/777122444427440128
Darrel_Mac;2016-09-17 00:02;0;0;"@TerriClarkMusic Hey Terri love the Q@A at the end of the show , the story of your Grandfather was touchy, Halifax being a military city !!!!";;@TerriClarkMusic @A;;"776979581391761409";https://twitter.com/Darrel_Mac/status/776979581391761409
PlymouthCoach;2016-09-16 22:23;0;0;"'BLUE MAN' BACHELORETTE. This group from Halifax boarded our black stretch Limo and headed to the show . #limo pic.twitter.com/l9OFStfq6p";;;#limo;"776954758934519810";https://twitter.com/PlymouthCoach/status/776954758934519810
JanMac1961;2016-09-16 21:15;0;0;"Anyone know what the wonderful fireworks were tonight, outside of Halifax NS? Eastern Passage way? Awesome show !";;;;"776937556978069504";https://twitter.com/JanMac1961/status/776937556978069504
Ford_Bradshaw;2016-09-16 21:14;0;11;"First high school game in Halifax that I've been to in a few years. Halftime show from the band includes Migos. It's lit";;;;"776937392599134208";https://twitter.com/Ford_Bradshaw/status/776937392599134208
