username;date;retweets;favorites;text;geo;mentions;hashtags;id;permalink
ResCareTo21;2017-06-25 09:27;4;5;"See where and when Ben will be walking on his travels from Halifax to London. Every Child Leaving Care Matters. #ECLCM #RespectYourself https:// twitter.com/AshcroftBen/st atus/878904019237961728 …";;;#ECLCM #RespectYourself;"878952855541096448";https://twitter.com/ResCareTo21/status/878952855541096448
HalifaxSeaport;2017-06-24 20:26;0;2;"We look forward to welcoming you to Halifax ! Safe travels";;;;"878756304818511873";https://twitter.com/HalifaxSeaport/status/878756304818511873
HeatherByTheSea;2017-06-24 17:01;0;1;"#meetdaniel Halifax NS, 35, I help unemployed ppl find work, get educated, & start businesses, TWD & travel ! What's your plan for today?";;;#meetdaniel;"878704743807373312";https://twitter.com/HeatherByTheSea/status/878704743807373312
DeninerDixon09;2017-06-24 14:20;0;0;"#MeetDaniel 45 disabled f/ Halifax ,Nova Scotia,I LOVE TWD! LOVE animals,addicted 2 chocolate! Love scary movies,breezy days, travel ,Dateline";;;#MeetDaniel;"878664081451999232";https://twitter.com/DeninerDixon09/status/878664081451999232
VOILA_Rewards;2017-06-24 11:00;0;2;"Looking for a hotel to stay in #CANADA ?Check out Atlantica Hotel Halifax #Rewards #Privileges #Points #Travel #Stays #Hotels pic.twitter.com/8x7XsDPPzC";;;#CANADA #Rewards #Privileges #Points #Travel #Stays #Hotels;"878613690739695617";https://twitter.com/VOILA_Rewards/status/878613690739695617
JobsHalifax1;2017-06-24 03:04;0;0;"Travel Agent – Inbound Sales http:// dlvr.it/PPhKDq Job Halifax";;;;"878493915191562242";https://twitter.com/JobsHalifax1/status/878493915191562242
meaganwrds;2017-06-23 20:52;1;3;"Since trying online dating, I have: scared away a guy with time travel given Halifax sightseeing tips discussed satanic hair care rituals";;;;"878400465897234433";https://twitter.com/meaganwrds/status/878400465897234433
canadaconnect;2017-06-23 19:45;0;0;"Today in 1940 Sgt Henry Larsen left Vancouver for Halifax , a trip which made him the 1st to travel W to E by boat. pic.twitter.com/vRnEwHTuiS";;;;"878383433491369984";https://twitter.com/canadaconnect/status/878383433491369984
dibbleslynn;2017-06-23 18:54;0;0;"Halifax , Nova Scotia - Travel Best Bets https://www. travelbestbets.com/deals/halifax/ via @http://twitter.com/#!/TravelBestBets";;@http;#;"878370685327859714";https://twitter.com/dibbleslynn/status/878370685327859714
Beyondships;2017-06-23 12:19;0;1;"A look at the Art Gallery of Nova Scotia in Halifax http://www. beyondshipsart.com/art-gallery-of -nova-scotia.html … #art #Halifax #novascotia #travel pic.twitter.com/I0qlZfjhgh";;;#art #Halifax #novascotia #travel;"878271178237919233";https://twitter.com/Beyondships/status/878271178237919233
TheHalifaxMatt;2017-06-23 09:50;0;2;"When one travels from Halifax to Toronto, one must conquer @burgerspriest ! #bringit";;@burgerspriest;#bringit;"878233683047600128";https://twitter.com/TheHalifaxMatt/status/878233683047600128
davestan64;2017-06-23 05:23;0;1;"Halifax tours sorted mine out he has done the lot parking flights digs train travel match tickets ive just got to take him to the airport.";;;;"878166589442412544";https://twitter.com/davestan64/status/878166589442412544
sreesraadha06;2017-06-23 03:51;1;3;"5 Things to Do in Halifax - FASHION Magazine http:// bit.ly/2rIEzX6 #travel #fashion #thingstodoinhalifax #halifax pic.twitter.com/hMZ8CjfWun";;;#travel #fashion #thingstodoinhalifax #halifax;"878143401509519360";https://twitter.com/sreesraadha06/status/878143401509519360
WorldTravls;2017-06-23 00:15;0;0;"Please RT? #travel #traveller Halifax , Nova Scotia City Guide http:// bit.ly/2gOqq5F pic.twitter.com/ViObdhxm9x";;;#travel #traveller;"878089196635701251";https://twitter.com/WorldTravls/status/878089196635701251
rob_gill_;2017-06-22 17:42;0;0;"Travel from Halifax to see @thabo from Huddersfield pic.twitter.com/qkkmeafL1x";;@thabo;;"877990205948481536";https://twitter.com/rob_gill_/status/877990205948481536
HfxSeaportMrkt;2017-06-22 14:55;0;5;"Thanks for including us @shortpresents ! HALIFAX TRAVEL GUIDE: WHERE TO EAT, SHOP, EXPLORE – SHORT PRESENTS http:// buff.ly/2sUYYvw pic.twitter.com/Mae1UKbGoH";;@shortpresents;;"877948064115437569";https://twitter.com/HfxSeaportMrkt/status/877948064115437569
norealplan;2017-06-22 13:37;0;1;"Always travel with a Halifax Clarity Credit Card and then just withdraw from ATM in that country with no fees. How I've done this whole trip";;;;"877928559863406592";https://twitter.com/norealplan/status/877928559863406592
Gregory_Power;2017-06-21 23:29;0;2;"New #travel #photography : #Halifax Central Library @hfxpublib - this was my 2nd living room before I moved to S'toon http:// wp.me/p2uqrg-39S";;@hfxpublib;#travel #photography #Halifax;"877715233355087873";https://twitter.com/Gregory_Power/status/877715233355087873
FitbitCanadian;2017-06-21 15:34;0;0;"Summer Travel is upon me ! #Toronto #Ottawa #QuebecCity #Halifax Question: @TripAdvisor why is your platform so hostile to share on Twitter?";;@TripAdvisor;#Toronto #Ottawa #QuebecCity #Halifax;"877595663315329025";https://twitter.com/FitbitCanadian/status/877595663315329025
bidetofevil;2017-06-21 13:47;0;0;"All this talk of a #CanPL team in Halifax is a bit surprising. If the CFL can't get the economics to work wrt travel /fan-base, soccer can?";;;#CanPL;"877568568895971330";https://twitter.com/bidetofevil/status/877568568895971330
HarleneBrown;2017-06-21 13:45;0;1;"#Canada150 travel to T Bay, Toronto, St. John's, Halifax & Cape Breton Island; #Greenway150 trekking in #yyc ; singing anthem en francais.";;;#Canada150 #Greenway150 #yyc;"877568158734798848";https://twitter.com/HarleneBrown/status/877568158734798848
hfxnovascotia;2017-06-21 08:05;8;29;"Fav this tweet if you have travel plans this summer! Photo by freedomtravelhack on @instagram #MountUniacke #Halifax @VisitNovaScotia pic.twitter.com/TlcrclYR4N";;@instagram @VisitNovaScotia;#MountUniacke #Halifax;"877482705457467392";https://twitter.com/hfxnovascotia/status/877482705457467392
JasonBFB;2017-06-21 05:44;0;0;"I'm normally clued up on travel stuff but I've just ordered a Halifax clarity card for me travels ... #thanks";;;#thanks;"877447241534930944";https://twitter.com/JasonBFB/status/877447241534930944
MickCondon;2017-06-21 03:32;0;1;"@CapitalYorks 1/2hr Halifax 2 Leeds when I was young & keen. Same woman now I rarely travel further than a flight of steps";;@CapitalYorks;;"877413797581000704";https://twitter.com/MickCondon/status/877413797581000704
gypsynester;2017-06-21 00:43;2;1;"An Eerie Day in Halifax --> http:// bit.ly/GWSjoL #travel #Canada #lp pic.twitter.com/UDzH8mbhe5";;;#travel #Canada #lp;"877371301802921985";https://twitter.com/gypsynester/status/877371301802921985
TravellinFoodie;2017-06-20 23:53;1;2;"Hello there! Feeling artistic at @ArtGalleryNS ! This is from their new Nunavut exhibit! #Travel #Halifax pic.twitter.com/aFfpnESDiG – bei Art Gallery of Nova Scotia";;@ArtGalleryNS;#Travel #Halifax;"877358712289193985";https://twitter.com/TravellinFoodie/status/877358712289193985
TravellinFoodie;2017-06-20 23:29;0;2;"#Travel : I'm in cloud 9 in being able to explore #Halifax ! I've been here once before but only for a few hours as … http:// bit.ly/2sRuCe0 pic.twitter.com/WiPkKqhJmE";;;#Travel #Halifax;"877352836522156033";https://twitter.com/TravellinFoodie/status/877352836522156033
semanuel88;2017-06-20 16:17;0;0;"@itvMLshow can I put money on my Halifax Clarity card (like a prepaid card) before I travel abroad?";;@itvMLshow;;"877243970593718274";https://twitter.com/semanuel88/status/877243970593718274
Brighouseprkrun;2017-06-20 11:00;0;0;"Have barcode, will travel .... Brighouse, Halifax and Huddersfield parkruns are all cancelled on 24th June 2017 as... http:// fb.me/tDr3vtrY";;;;"877164227919847424";https://twitter.com/Brighouseprkrun/status/877164227919847424
browninfosecguy;2017-06-20 08:10;0;1;"#travel #tip : How to pack for #Halifax #NovaScotia ? Pack for 3 seasons Summer, Fall and Rain.";;;#travel #tip #Halifax #NovaScotia;"877121512750370816";https://twitter.com/browninfosecguy/status/877121512750370816
faithforever52;2017-06-20 07:44;0;0;"My son had 33 treatments and it was stressful in itself.. We live in Halifax .. God bless the people who have to travel";;;;"877114959649550337";https://twitter.com/faithforever52/status/877114959649550337
Pulse1Radio;2017-06-20 04:36;0;1;"TRAVEL NEWS: Accident on Godley Road at Godley Branch Road, congestion to Kell Lane in Halifax . http://www. pulse1.co.uk/news/traffic/ Mylo & Rosie pic.twitter.com/DkAYn43bMJ";;;;"877067656683302912";https://twitter.com/Pulse1Radio/status/877067656683302912
mylifeinthesunn;2017-06-20 04:31;0;0;"The Halifax Vacation Superstore by Maritime Travel I like to travel , a lot. So, I thought it was http:// rviv.ly/isuOk #EastCoastBlogger";;;#EastCoastBlogger;"877066238542925824";https://twitter.com/mylifeinthesunn/status/877066238542925824
TravellinFoodie;2017-06-19 23:27;0;3;"So tired! Can't wait to sleep at @HaliburtonHotel ! #Halifax #Travel pic.twitter.com/1qUIfEiiYy – bei The Halliburton";;@HaliburtonHotel;#Halifax #Travel;"876989806894600192";https://twitter.com/TravellinFoodie/status/876989806894600192
heatherdann;2017-06-19 18:10;0;0;"When you accidentally time travel . #novascotia #halifax #citadel #halifaxcitadel #canada … https://www. instagram.com/p/BViSWewDEdI/";;;#novascotia #halifax #citadel #halifaxcitadel #canada;"876909978237325312";https://twitter.com/heatherdann/status/876909978237325312
TravellinFoodie;2017-06-19 16:43;1;8;"I'm in cloud 9 to #VisitNovaScotia ! Follow along as I explore what the #Halifax has to offer! #Travel #Foodie pic.twitter.com/9U8V3ELmJ5";;;#VisitNovaScotia #Halifax #Travel #Foodie;"876888124181417984";https://twitter.com/TravellinFoodie/status/876888124181417984
JimByersTravel;2017-06-19 14:39;0;1;"Canadians rate #Vancouver , #Montreal & #Halifax top 3 #food cities in #Canada . #Winnipeg 4th, #Toronto 5th. http:// jimbyerstravel.com/2017/06/19/boo king-com-travellers-love-the-food-in-hong-kong-sao-paulo-and-tokyo-athens-and-vegas-also-feel-the-love/ … #travel pic.twitter.com/AXbY9ZZXyX";;;#Vancouver #Montreal #Halifax #food #Canada #Winnipeg #Toronto #travel;"876856902843588609";https://twitter.com/JimByersTravel/status/876856902843588609
thesmacleodshow;2017-06-19 13:11;2;2;". @CouncillorDen wants to get a #cancer treatment centre in #Yarmouth . "I have to travel to #Halifax ... we have #chemo , but not #radiation ."";;@CouncillorDen;#cancer #Yarmouth #Halifax #chemo #radiation;"876834851395166210";https://twitter.com/thesmacleodshow/status/876834851395166210
APTN;2017-06-19 12:32;0;1;"Safe travels to you. We're looking forward to seeing you at #ADL2017 in #Halifax . We're already setting up. See you soon. https:// twitter.com/donaldamero/st atus/876781400761839616 …";;;#ADL2017 #Halifax;"876824975923003394";https://twitter.com/APTN/status/876824975923003394
toadiecam;2017-06-19 11:28;0;0;"Lady was allowed to travel from halifax to leeds but told she could not make return journey without collapsing electric scooter @MetroUK https:// twitter.com/toadiecam/stat us/876805027725275136 …";;@MetroUK;;"876808860484423681";https://twitter.com/toadiecam/status/876808860484423681
browninfosecguy;2017-06-19 10:21;0;0;"#Travel Diary: Uber Driver in Ottawa thought I'm Italian Enterprise guy in Halifax thought I'm Middle Eastern Go Figure";;;#Travel;"876792024615329792";https://twitter.com/browninfosecguy/status/876792024615329792
HfxAdventure;2017-06-19 09:35;0;0;"Who else wants to be there right now??? . @trisnoarybudi #halifax #outdoors #travel #nature #earth #hiking ... http:// fb.me/1CpQN9v8u";;@trisnoarybudi;#halifax #outdoors #travel #nature #earth #hiking;"876780528472436736";https://twitter.com/HfxAdventure/status/876780528472436736
VisitorsDreams;2017-06-18 14:16;0;1;"Perfect day for walking around #pointpleasant park. #halifax #novascotia #travel https://www. instagram.com/p/BVfSyiul5Ak/";;;#pointpleasant #halifax #novascotia #travel;"876488734274969600";https://twitter.com/VisitorsDreams/status/876488734274969600
mdeschenes69;2017-06-18 11:22;1;1;"What To Do In Halifax : See. Stay. Do. - Follow Me Away http:// crwd.fr/2snWRA6 #travel pic.twitter.com/YOIYxuCZHy";;;#travel;"876444931325349888";https://twitter.com/mdeschenes69/status/876444931325349888
OxyOfficial;2017-06-17 12:15;0;1;"An average travel day to Halifax takes me about 19 hrs door to door. I know that feel. Have an amazing time!!";;;;"876096029199826944";https://twitter.com/OxyOfficial/status/876096029199826944
HfxAdventure;2017-06-17 08:59;1;2;"100 Things to do with your FAMILY this SUMMER! #halifax #NovaScotia #outdoors #hiking #walking #camping #travel ... http:// fb.me/8IWFMZJAP";;;#halifax #NovaScotia #outdoors #hiking #walking #camping #travel;"876046613915074560";https://twitter.com/HfxAdventure/status/876046613915074560
matthaldane;2017-06-17 06:42;0;1;"Thanks! Just a quick question. What airline do you fly with when you travel between the uk and Halifax ? pic.twitter.com/K7TtpIhsl1";;;;"876012122949513216";https://twitter.com/matthaldane/status/876012122949513216
DanMyles1;2017-06-16 23:22;0;0;"Night Lights #night ##historic #street #photography #photoofday #travel #halifax #novascotia … https://www. instagram.com/p/BVbHtOSHNMu/";;;#night # #historic #street #photography #photoofday #travel #halifax #novascotia;"875901416648327168";https://twitter.com/DanMyles1/status/875901416648327168
CanadaJobCareer;2017-06-16 16:32;0;0;"Travel Consultant, Entry Level Position in Halifax ,NS #job #hiring http://www. canadajobsandcareers.ca/jobs.php?ad=14 95828526&utm_source=Twitter&utm_medium=organic&utm_campaign=1495828526 …";;;#job #hiring;"875798143597719552";https://twitter.com/CanadaJobCareer/status/875798143597719552
mylifeinthesunn;2017-06-16 07:53;0;0;"The Halifax Vacation Superstore by Maritime Travel I like to travel , a lot. So, I thought it was http:// rviv.ly/R6yg4 #EastCoastBlogger";;;#EastCoastBlogger;"875667678907727872";https://twitter.com/mylifeinthesunn/status/875667678907727872
HRJobCentre;2017-06-16 07:11;0;0;"Travel Agent - Inbound Sales - Halifax - Legal Job Description - Yorkshire- Halifax , Our client is recruiting for... http:// fb.me/3DGcA9aqu";;;;"875657135245361152";https://twitter.com/HRJobCentre/status/875657135245361152
gedspears;2017-06-16 05:42;0;0;"Huddersfield 2, is that the same reason? told is to streamline and and make it more cost effective, to hell with travel problems 2 Halifax";;;;"875634790757683200";https://twitter.com/gedspears/status/875634790757683200
atlantic_canada;2017-06-16 02:21;0;0;"Accounts Payable Clerk: Maritime Travel Inc. ( Halifax ): "Maritime Travel is searching for a FT… http://www. eluta.ca/search?ptitle= Accounts+Payable+Clerk&position=951c5bdbf9164bfcd5db553fd8a11563&imo=1 … #novascotia #jobs";;;#novascotia #jobs;"875584131005956097";https://twitter.com/atlantic_canada/status/875584131005956097
ICGReward;2017-06-15 17:23;0;0;"47 minutes to travel between all 6 cities but still 40 minutes to get to #Leeds from #halifax - need to deal with #local first not #cities";;;#Leeds #halifax #local #cities;"875448792631431168";https://twitter.com/ICGReward/status/875448792631431168
Globe_Guide;2017-06-15 15:15;1;1;"Top 10 things to do in Halifax , Nova Scotia- http:// bit.ly/2elgBKn #VisitNovaScotia #ExploreCanada #Travel pic.twitter.com/vKQM33gZig";;;#VisitNovaScotia #ExploreCanada #Travel;"875416381793153025";https://twitter.com/Globe_Guide/status/875416381793153025
hfxnovascotia;2017-06-15 08:38;0;19;"Work. Travel . Save. Repeat Photo by wildsweetpeaphotography on @instagram #Halifax #Waverley @VisitNovaScotia pic.twitter.com/EYl0QKjHGQ";;@instagram @VisitNovaScotia;#Halifax #Waverley;"875316688765550592";https://twitter.com/hfxnovascotia/status/875316688765550592
Sharitucker;2017-06-15 08:00;0;0;"#Iceland is becoming an increasingly popular #travel destination from #Halifax - <3 for their #responsibletourism ! https:// youtu.be/qqcnvjVrbQU pic.twitter.com/SlKoHcreiq";;;#Iceland #travel #Halifax #responsibletourism;"875306973985742848";https://twitter.com/Sharitucker/status/875306973985742848
kenysholidays;2017-06-15 07:17;2;4;"Hotel Four Points by Sheraton Halifax #Halifax , #Canada - 742 reviews #holiday #Travel Book now http:// buff.ly/2s84jip pic.twitter.com/y0EuUGYCkF";;;#Halifax #Canada #holiday #Travel;"875296075363569664";https://twitter.com/kenysholidays/status/875296075363569664
TrvlsAndMore;2017-06-15 00:15;0;0;"Please RT? #travel #traveller Halifax , Nova Scotia City Guide http:// bit.ly/2haAG8u pic.twitter.com/1DO1mPoHRe";;;#travel #traveller;"875190025197166593";https://twitter.com/TrvlsAndMore/status/875190025197166593
PicklePlanetYQM;2017-06-14 23:25;0;1;"Check out this article: HALIFAX TRAVEL GUIDE: WHERE TO EAT, SHOP, EXPLORE http:// shortpresents.com/2017/06/halifa x-travel-guide-where-to-eat-shop-explore.html/ … #ECMCanada150";;;#ECMCanada150;"875177538863149056";https://twitter.com/PicklePlanetYQM/status/875177538863149056
SoloExplore;2017-06-14 21:35;0;1;"Deadman's Island #Halifax #viewns #maritimes #expore @VisitNovaScotia #travel pic.twitter.com/S0pYW99tD0";;@VisitNovaScotia;#Halifax #viewns #maritimes #expore #travel;"875149674994380800";https://twitter.com/SoloExplore/status/875149674994380800
remontkvartir;2017-06-14 17:36;0;0;"Halifax UK #buy #travel #insurance : #travel insurence #Travel insurance Halifax … https:// goo.gl/fb/YIJD6h #Travel";;;#buy #travel #insurance #travel #Travel #Travel;"875089532114305024";https://twitter.com/remontkvartir/status/875089532114305024
India_Florence_;2017-06-14 15:30;0;1;"I have a friend in Halifax bring him and his beautiful girlfriend back for me as a gift from your travels";;;;"875057942076248066";https://twitter.com/India_Florence_/status/875057942076248066
NicheTravelGrp;2017-06-14 12:38;0;1;"With direct flights from Halifax to Frankfurt and Munich, Germany is closer than ever. #Condor #Halifax @Dartmouth #EuropeanVacation #travel pic.twitter.com/88f1rRieF2";;@Dartmouth;#Condor #Halifax #EuropeanVacation #travel;"875014466995462144";https://twitter.com/NicheTravelGrp/status/875014466995462144
casita_sol;2017-06-14 11:36;0;1;"Hotel Four Points by Sheraton Halifax #Halifax , #Canada - 742 reviews #holiday #Travel Book now http:// buff.ly/2s7PtbQ pic.twitter.com/vHIDerkgBX";;;#Halifax #Canada #holiday #Travel;"874998906924539905";https://twitter.com/casita_sol/status/874998906924539905
aditheadipose;2017-06-13 20:28;0;1;"Sweet Jesus it was hot enough in #Halifax to melt fat today. This is why I travel by backpack. The shade.";;;#Halifax;"874770576220577793";https://twitter.com/aditheadipose/status/874770576220577793
CanadaJobCareer;2017-06-13 16:34;0;0;"Travel Consultant, Entry Level Position in Halifax ,NS #job #hiring http://www. canadajobsandcareers.ca/jobs.php?ad=14 95828526&utm_source=Twitter&utm_medium=organic&utm_campaign=1495828526 …";;;#job #hiring;"874711483351011328";https://twitter.com/CanadaJobCareer/status/874711483351011328
BlogJamAtlantic;2017-06-13 16:30;1;0;"HALIFAX TRAVEL GUIDE: WHERE TO EAT, SHOP, EXPLORE – SHORT PRESENTS http:// buff.ly/2teYNrv pic.twitter.com/ALjjqxKRFA";;;;"874710548616761347";https://twitter.com/BlogJamAtlantic/status/874710548616761347
halifaxca1;2017-06-13 08:49;0;0;"Bilingual Travel Consultant, Senior - HRG North America - Halifax , NS https:// goo.gl/fb/iDyddc Job Halifax CA";;;;"874594636777631748";https://twitter.com/halifaxca1/status/874594636777631748
JennNaugler;2017-06-13 08:29;1;2;"Check out this article: HALIFAX TRAVEL GUIDE: WHERE TO EAT, SHOP, EXPLORE http:// shortpresents.com/2017/06/halifa x-travel-guide-where-to-eat-shop-explore.html/ … #Canada150 #ECMCANADA150";;;#Canada150 #ECMCANADA150;"874589563787902977";https://twitter.com/JennNaugler/status/874589563787902977
halifaxca1;2017-06-13 07:41;0;0;"Bilingual Travel Consultant, Intermediate - HRG North America - Halifax , NS https:// goo.gl/fb/6ai1Na Job Halifax CA";;;;"874577533810946048";https://twitter.com/halifaxca1/status/874577533810946048
halifaxca1;2017-06-13 07:41;0;0;"Bilingual Travel Consultant, Senior - HRG North America - Halifax , NS https:// goo.gl/fb/0269w4 Job Halifax CA";;;;"874577525653090304";https://twitter.com/halifaxca1/status/874577525653090304
halifaxca1;2017-06-13 07:41;0;0;"Bilingual Travel Consultant, Junior - HRG North America - Halifax , NS https:// goo.gl/fb/9VBlzg Job Halifax CA";;;;"874577524256370689";https://twitter.com/halifaxca1/status/874577524256370689
timothyhc;2017-06-12 14:38;0;1;"5 Things to Do in #Halifax http:// fashionmagazine.com/lifestyle/5-th ings-halifax … via @FashionCanada #travel @hfxnovascotia";;@FashionCanada @hfxnovascotia;#Halifax #travel;"874319893298122754";https://twitter.com/timothyhc/status/874319893298122754
Paul_Par;2017-06-12 14:32;0;1;"Remember than CanSoccer would be picking up the travel tab for Jamaica. Is it worth the significant extra expense to send them to Halifax ?";;;;"874318387525984256";https://twitter.com/Paul_Par/status/874318387525984256
cannibal_queer;2017-06-12 14:11;0;0;"because I'm bored and want to escape Ottawa for awhile and it only costs like 300$ to travel to Halifax .";;;;"874313202817015808";https://twitter.com/cannibal_queer/status/874313202817015808
shortpresents;2017-06-12 11:59;2;2;"Coming to #Halifax ? Here's a full travel guide of where to eat, shop, and explore > http:// shortpresents.com/2017/06/halifa x-travel-guide-where-to-eat-shop-explore.html/ … pic.twitter.com/T4ltyvudc5";;;#Halifax;"874279986974380032";https://twitter.com/shortpresents/status/874279986974380032
suziconfesses;2017-06-12 11:59;0;0;"Check out this article: HALIFAX TRAVEL GUIDE: WHERE TO EAT, SHOP, EXPLORE http:// shortpresents.com/2017/06/halifa x-travel-guide-where-to-eat-shop-explore.html/ …";;;;"874279959266721792";https://twitter.com/suziconfesses/status/874279959266721792
989XFM;2017-06-12 09:57;0;0;"Runners from HMCS Halifax travel the province to raise money for the Children's Wish Foundation. http://www. 989xfm.ca/hmcs-halifax-a nnual-run-for-childrens-wish-foundation-coming-to-antigonish-this-week/ …";;;;"874249250502311937";https://twitter.com/989XFM/status/874249250502311937
bayfieldcelt;2017-06-12 09:57;0;1;"Runners from HMCS Halifax travel the province to raise money for the Children's Wish Foundation. http://www. 989xfm.ca/hmcs-halifax-a nnual-run-for-childrens-wish-foundation-coming-to-antigonish-this-week/ …";;;;"874249250439389185";https://twitter.com/bayfieldcelt/status/874249250439389185
patterballs;2017-06-12 09:41;0;0;"I'm in Halifax . News travels slowly here...";;;;"874245325602652160";https://twitter.com/patterballs/status/874245325602652160
gostudywork;2017-06-12 04:15;0;2;"RT @adventureista "Peaceful Halifax waterfront sunset views #photooftheday #beauty #travel #Canada #canada150 pic.twitter.com/6Y2zXTVyPV "";;@adventureista;#photooftheday #beauty #travel #Canada #canada150;"874163139352383488";https://twitter.com/gostudywork/status/874163139352383488
worldtvandmedia;2017-06-12 00:04;0;0;"Hotel Four Points by Sheraton Halifax #Halifax , #Canada - 742 reviews #holiday #Travel Book now http:// buff.ly/2s7DATe pic.twitter.com/GaiqUgAhxV";;;#Halifax #Canada #holiday #Travel;"874100023360970752";https://twitter.com/worldtvandmedia/status/874100023360970752
PlayOnHalifax;2017-06-11 19:58;0;2;"See ya soon in Halifax , safe travels eh!";;;;"874038113659736064";https://twitter.com/PlayOnHalifax/status/874038113659736064
TopHalifaxNow;2017-06-11 18:47;0;0;"Terri Travels : The dancers are doing an Amazing job here HFX Greek Fest Halifax GreekFest http:// toplocalnow.com/ca/halifax/at/ 18#t4770295 …";;;#t4770295;"874020186482819072";https://twitter.com/TopHalifaxNow/status/874020186482819072
SMacBosch;2017-06-11 16:35;0;2;"#Sundaysunsets #travel #dogsoftwitter #beaches #novascotia #shelburne #halifax #dartmouth #driftwoodpark #capechignecto pic.twitter.com/ixLODxKv6z";;;#Sundaysunsets #travel #dogsoftwitter #beaches #novascotia #shelburne #halifax #dartmouth #driftwoodpark #capechignecto;"873987019298484226";https://twitter.com/SMacBosch/status/873987019298484226
SoloExplore;2017-06-11 16:14;1;3;"Beautiful spot to sit outside with some food and listen to music @GreekFestHFX #travel @halifaxnoise #Halifax #GreekFest2017 pic.twitter.com/1PJCgp6hHq";;@GreekFestHFX @halifaxnoise;#travel #Halifax #GreekFest2017;"873981718511964160";https://twitter.com/SoloExplore/status/873981718511964160
yaacovp;2017-06-11 11:18;0;2;"Travel also booked for @SSSReading in Halifax !! Been a few years since I've been. Def my fav conference.";;@SSSReading;;"873907239857385472";https://twitter.com/yaacovp/status/873907239857385472
ae82c703fd3a471;2017-06-11 04:09;0;0;"@TheNationalLge you will travel to aldershot on the opening day and at home to halifax on the first Tuesday.";;@TheNationalLge;;"873799434806722565";https://twitter.com/ae82c703fd3a471/status/873799434806722565
gaylegirl;2017-06-10 18:25;0;0;"After 18 hrs of travel , I have a feeling I'm picking up a zombie (at @hfxstanfield in Halifax , NS, NS) https://www. swarmapp.com/c/a4lxkdxvawn";;@hfxstanfield;;"873652429270790144";https://twitter.com/gaylegirl/status/873652429270790144
histamin32;2017-06-10 17:50;0;0;"Firing the noon gun at #Halifax Citadel #NovaScotia #Canada #Travel pic.twitter.com/x4GQWnt8mC";;;#Halifax #NovaScotia #Canada #Travel;"873643679721938944";https://twitter.com/histamin32/status/873643679721938944
alpha1canada;2017-06-10 13:51;0;2;"Kicking off our Halifax Education Day afternoon session is Erica Hancock, RT @MedigasCanada - Oxygen Therapy: Modalities & Travel !! pic.twitter.com/wwUs5Lac7Q";;@MedigasCanada;;"873583513160888320";https://twitter.com/alpha1canada/status/873583513160888320
