username;date;retweets;favorites;text;geo;mentions;hashtags;id;permalink
Phylli77;2015-04-17 18:36;2;2;"Some Folk/ Rock music w/David Bradshaw & @NoahTyeMusic tonight @rockbotmbrewpub @David_Bradshaw1 ,10pm @halifaxbloggers #livemusic #Halifax";;@NoahTyeMusic @rockbotmbrewpub @David_Bradshaw1 @halifaxbloggers;#livemusic #Halifax;"589180592845148161";https://twitter.com/Phylli77/status/589180592845148161
AwesomenessBot;2015-04-15 21:52;0;1;"Radiohead - Just http:// bit.ly/l8Sij #Awesomeness #Halifax #Newcastle #Roc #Rock #Alternative #Music #ThomYorke #YouDoItToYourself — …";;;#Awesomeness #Halifax #Newcastle #Roc #Rock #Alternative #Music #ThomYorke #YouDoItToYourself;"588505282193547264";https://twitter.com/AwesomenessBot/status/588505282193547264
pixnvids;2015-04-15 21:47;0;1;"Radiohead - Just http:// bit.ly/l8Sij #Awesomeness #Halifax #Newcastle #Roc #Rock #Alternative #Music #ThomYorke #YouDoItToYourself";;;#Awesomeness #Halifax #Newcastle #Roc #Rock #Alternative #Music #ThomYorke #YouDoItToYourself;"588503839000649730";https://twitter.com/pixnvids/status/588503839000649730
SoNaztee;2015-04-11 12:51;0;0;"Tragically Hip concert tonight!!! #TheHip #TragicallyHip #Halifax #NS #NovaScotia #Rock #Concert #Live #Music #LiveMusic";;;#TheHip #TragicallyHip #Halifax #NS #NovaScotia #Rock #Concert #Live #Music #LiveMusic;"586919403670872065";https://twitter.com/SoNaztee/status/586919403670872065
thestarhalifax;2015-04-10 09:07;2;3;"Rock on, Halifax : In-Flight Safety, the Town Heroes score big at East Coast Music Awards http:// ow.ly/LqTcQ pic.twitter.com/ACJZCRCUUZ";;;;"586500835334578176";https://twitter.com/thestarhalifax/status/586500835334578176
Bettszee;2015-04-10 07:34;0;0;"Oh how I miss these days- Rock on, Halifax : In-Flight Safety, the Town Heroes score big at East Coast Music Awards http:// ow.ly/3xJ5Pm";;;;"586477248439517185";https://twitter.com/Bettszee/status/586477248439517185
thehalifaxnews;2015-04-09 23:31;0;0;"Rock on, Halifax : In-Flight Safety, the Town Heroes score big at East Coast Music Awards http:// bit.ly/1Cwm3y4 [via Metro] #halifax";;;#halifax;"586355684922363905";https://twitter.com/thehalifaxnews/status/586355684922363905
thestarhalifax;2015-04-09 22:52;3;13;"Rock on, Halifax : In-Flight Safety, the Town Heroes score big at East Coast Music Awards. http:// ow.ly/LpVHW pic.twitter.com/CWAfjm4Dgj";;;;"586346033631862784";https://twitter.com/thestarhalifax/status/586346033631862784
LandingSound;2015-04-04 19:52;2;1;"You can listen to our music @https://soundcloud.com/landingsound #rockmusic #Halifax .. new material coming out soon!! pic.twitter.com/oUiFUiOJ8W";;@https;#rockmusic #Halifax;"584488622117773315";https://twitter.com/LandingSound/status/584488622117773315
rightonyukon;2015-03-23 10:42;0;1;"Check out our #video for Haunted on #Rormix http:// ror.mx/b1k #canadianmusic #cdnmusic #music #rockandroll #rock #dartmouth #halifax";;;#video #Rormix #canadianmusic #cdnmusic #music #rockandroll #rock #dartmouth #halifax;"580001637806243840";https://twitter.com/rightonyukon/status/580001637806243840
NSRasta;2015-03-19 07:16;0;0;"Dear Spring, Listen Up! ♫ Lay it on the Line ♫ - Triumph (Live in #Halifax ) : https://www. youtube.com/watch?v=jkx47Z syicc … LIVE #Rock #Music #Video #NowPlaying";;;#Halifax #Rock #Music #Video #NowPlaying;"578500181055959040";https://twitter.com/NSRasta/status/578500181055959040
MatthewHalliday;2015-03-14 17:42;0;0;"@WornRagged @klaszus Yet more baffling. (The bedrock under Halifax is granite; and, uh, hard- rock music is cool?) pic.twitter.com/fjjqC77kU4";;@WornRagged @klaszus;;"576845973063860224";https://twitter.com/MatthewHalliday/status/576845973063860224
TheBryanWillett;2015-03-04 11:54;0;0;"Essential music for a road trip to Halifax : Several 30+ min. Progressive Rock songs loaded onto your mobile device :)";;;;"573149429496201219";https://twitter.com/TheBryanWillett/status/573149429496201219
banjomanjeff;2015-02-19 09:41;0;2;"Bryan Adams doing his thing. #halifax #music #rock http:// instagram.com/p/zSOjeMgHCj/";;;#halifax #music #rock;"568405047429730304";https://twitter.com/banjomanjeff/status/568405047429730304
xbtsxtrashx;2015-02-15 12:27;0;2;"@Alyssa__Cookie @sidney_singerr @Cookies_Lilly because its a station where we live ( halifax ) and its all rock music and plays their music";;@Alyssa__Cookie @sidney_singerr @Cookies_Lilly;;"566997211951931392";https://twitter.com/xbtsxtrashx/status/566997211951931392
NSRasta;2015-02-10 22:49;0;0;"OUTRO: Goodnight Halifax , Goodnight ♫ Panema ♫ - Van Halen - http:// youtu.be/w-NshzYK9y0 #Rock #Music #Video #NowPlaying";;;#Rock #Music #Video #NowPlaying;"565341705185296384";https://twitter.com/NSRasta/status/565341705185296384
SouthRockBuzz;2015-02-06 16:05;0;0;"Live music tonight at Southpoint! The Halifax Wharf Rats are playing classic rock w/ an East-Coast & Maritime vibe! http:// ow.ly/i/8wfCP";;;;"563790565624799232";https://twitter.com/SouthRockBuzz/status/563790565624799232
JChergi;2015-01-28 17:55;0;0;"QB ever. He's earned it. Debate Question #2. Music . Should Journey be in the Rock and Roll HOF? HALIFAX (Wins Coin Toss) I would say NO.";;;#2;"560556901776125952";https://twitter.com/JChergi/status/560556901776125952
mikecue;2015-01-24 13:36;0;1;"Is there any music going on to tonight in #Halifax punk, blues, métal, rock ? #NovaScotia";;;#Halifax #NovaScotia;"559042076986580992";https://twitter.com/mikecue/status/559042076986580992
chaostheoryband;2014-12-31 22:22;1;3;"Rock ’s Top 15 East Coast Canadian Releases of 2014 http://www. chaostheoryband.com/blog/chaosrock /rocks-top-15-east-coast-canadian-releases-of-2014/ … #2014 #independent #music #halifax #truro #PEI #NS #NB";;;#2014 #independent #music #halifax #truro #PEI #NS #NB;"550477185417371648";https://twitter.com/chaostheoryband/status/550477185417371648
wyweddingco;2014-12-02 18:52;0;0;"Xmas shopping evening Fri 6.30pm Rock Hotel @Halifax for Forget Me Not Childrens Hospice=Food-Drink- Music . #xmasshoppng #xmasgifts PLZ RT";;@Halifax;#xmasshoppng #xmasgifts;"539915120982654976";https://twitter.com/wyweddingco/status/539915120982654976
rolliecangolf;2014-11-25 00:18;0;2;"Great to see Bob Seger tonight in Halifax !! A rock and roll music legend! #NightMoves #oldtimerockandroll pic.twitter.com/FGLSsesVYi";;;#NightMoves #oldtimerockandroll;"537097943137140736";https://twitter.com/rolliecangolf/status/537097943137140736
websterMC;2014-11-19 16:16;1;2;"Fri @LeesPalaceTO Halifax 's @SoHoGhetto play " music for those who appreciate bedroom rock performed on a stadium scale"";;@LeesPalaceTO @SoHoGhetto;;"535164759432507392";https://twitter.com/websterMC/status/535164759432507392
bladesee;2014-11-17 16:53;4;4;"Is it Friday yet?! Getting excited for @BOTRTour @CasinoNSHalifax !!! This country girl cannot wait to rock out!! #country #halifax #music";;@BOTRTour @CasinoNSHalifax;#country #halifax #music;"534449177271734272";https://twitter.com/bladesee/status/534449177271734272
ClintonDesveaux;2014-11-07 10:23;0;0;"I don't understand, a city with 400,000 people and 3 universities doesn't have a good rock music promoter. Can we have more gigs in Halifax ?";;;;"530727303140376576";https://twitter.com/ClintonDesveaux/status/530727303140376576
SuzySchafer;2014-11-02 13:37;0;0;"Rainy nor'easter day - calls for some rock documentaries. Suggestions? #halifax #music";;;#halifax #music;"528964154330447872";https://twitter.com/SuzySchafer/status/528964154330447872