username;date;retweets;favorites;text;geo;mentions;hashtags;id;permalink
CBCNS;2015-10-17 21:57;31;42;"The donair should be Halifax 's official food : city councillor http:// bit.ly/1keByJK pic.twitter.com/dUKklhQ44X";;;;"655548099562217472";https://twitter.com/CBCNS/status/655548099562217472
Jer_Godfrey;2015-10-17 21:47;0;0;"Yes! Donair could become Halifax 's official food Tuesday http://www. cbc.ca/1.3276426";;;;"655545759585206272";https://twitter.com/Jer_Godfrey/status/655545759585206272
HalifaxNSNews;2015-10-17 21:36;3;2;"Donair could become Halifax 's official food Tuesday - CBC.ca - http:// bit.ly/1PzaGjx";;;;"655542824058785792";https://twitter.com/HalifaxNSNews/status/655542824058785792
halifaxnews;2015-10-17 21:32;2;3;"The donair should be Halifax 's official food : city councillor http:// dld.bz/dXp3B";;;;"655541820542316544";https://twitter.com/halifaxnews/status/655541820542316544
EINFoodNews;2015-10-17 21:21;0;0;"City council to look at making the donair Halifax ’s official food http:// s.einnews.com/mzDn1PycKm";;;;"655539053086027776";https://twitter.com/EINFoodNews/status/655539053086027776
wardrachel;2015-10-17 20:52;1;0;"I'm hungry. #Halifax might make the donair its official food , before a city like #yeg does http://www. cbc.ca/1.3276426 pic.twitter.com/f5WRJuHGBi";;;#Halifax #yeg;"655531949134626816";https://twitter.com/wardrachel/status/655531949134626816
CBCNS;2015-10-17 20:46;20;33;"Hungry? Donair could become Halifax 's official food Tuesday http://www. cbc.ca/1.3276426 pic.twitter.com/yMfp8HXS9n";;;;"655530367521165312";https://twitter.com/CBCNS/status/655530367521165312
DaveGuyHfx;2015-10-17 20:40;4;6;"Big political week: Election Monday, then #Halifax Council decides Tuesday whether to declare donair the city's official food .";;;#Halifax;"655528953805975552";https://twitter.com/DaveGuyHfx/status/655528953805975552
jennhoegg;2015-10-17 20:26;0;0;"@JakeAReid That's the most interesting federal food update I've ever read. Obviously donairs belong in Halifax , not Alberta or Ontario";;@JakeAReid;;"655525321861693440";https://twitter.com/jennhoegg/status/655525321861693440
TwitCoast;2015-10-17 20:05;15;21;"City council to look at making the donair Halifax ’s official food http://www. thecoast.ca/RestaurantandB arNews/archives/2015/10/17/city-council-to-look-at-making-the-donair-halifaxs-official-food … pic.twitter.com/eUXNynzz6B";;;;"655519989366169601";https://twitter.com/TwitCoast/status/655519989366169601
ScotiaWeb;2015-10-17 20:01;5;1;"#Halifax City council to look at making the donair Halifax ’s official food : [Image-1]... http:// bit.ly/1jM3qnR #NovaScotia #Food";;;#Halifax #NovaScotia #Food;"655518996008038400";https://twitter.com/ScotiaWeb/status/655518996008038400
evilpez4;2015-10-17 19:52;1;2;"If HRM Council makes the Donair, Halifax 's official food on Tuesday, Sackville needs to follow suit with a Kaiser's sub.";;;;"655516681729613824";https://twitter.com/evilpez4/status/655516681729613824
SpotOnCanada;2015-10-17 19:38;1;1;"DHABA EXPRESS is traditional East Indian food in Halifax , Nova Scotia http://www. dhaba-express.ca / #ourspotcanada pic.twitter.com/qJKCviPj5K";;;#ourspotcanada;"655513321689378816";https://twitter.com/SpotOnCanada/status/655513321689378816
MeganLeslieHFX;2015-10-17 17:01;4;8;"A vote for @MeganLeslieHFX is a vote for the local food movement #ML4HFX #Ready4Change #elxn42 #Halifax #LocalFoodClub";;@MeganLeslieHFX;#ML4HFX #Ready4Change #elxn42 #Halifax #LocalFoodClub;"655473757545496576";https://twitter.com/MeganLeslieHFX/status/655473757545496576
SarahSawler;2015-10-17 15:40;0;0;"Kid-friendly restaurants in #Halifax with yummy food for grown-ups--Go!";;;#Halifax;"655453280797982721";https://twitter.com/SarahSawler/status/655453280797982721
KatePow3ll;2015-10-17 15:35;0;24;"I went to the health food shop & the till guy gave me these for free bc we'd both been to Acca. Can't escape Halifax pic.twitter.com/yszU4EurGO";;;;"655452085085995008";https://twitter.com/KatePow3ll/status/655452085085995008
JuliaCinderella;2015-10-17 15:34;0;0;"Lovely food and drinks tonight at 53 Degrees #53degreesnorth#halifax https:// instagram.com/p/88u2_AD8fn/";;;#53degreesnorth #halifax;"655451856114728960";https://twitter.com/JuliaCinderella/status/655451856114728960
Lawsonlaa;2015-10-17 15:18;0;0;"Having a drink then over to Halifax sports bar for some food and the @BlueJays game";;@BlueJays;;"655447898495275008";https://twitter.com/Lawsonlaa/status/655447898495275008
CatchaJob_ca;2015-10-17 14:27;0;0;"#Job #Canada #Qualifirst Foods Ltd. Junior Manager &#8211; Gourmet Foods Full Time in #Halifax , NS, http://www. catchajob.ca/job/qualifirst -foods-ltd-junior-manager-gourmet-foods-full-time-in-halifax-ns/ …";;;#Job #Canada #Qualifirst #8211 #Halifax;"655434866780196864";https://twitter.com/CatchaJob_ca/status/655434866780196864
MattWoodmanCTV;2015-10-17 14:18;16;11;"On Tuesday city councillors will debate making the donair the official food of #Halifax @CTVAtlantic";;@CTVAtlantic;#Halifax;"655432638958825472";https://twitter.com/MattWoodmanCTV/status/655432638958825472
alangdon17;2015-10-17 14:14;6;21;"Oct 20th. will the Donair become the official food of Halifax ? @MikeSavageHFX @matlantivex @KingOfDonair pic.twitter.com/36AvNTzuQG";;@MikeSavageHFX @matlantivex @KingOfDonair;;"655431670686994433";https://twitter.com/alangdon17/status/655431670686994433
NatashaPace;2015-10-17 13:52;0;0;"The market is also collecting donations this weekend to help support the #Dartmouth North Community Food Centre, which just opened #Halifax";;;#Dartmouth #Halifax;"655426118363840512";https://twitter.com/NatashaPace/status/655426118363840512
KingOfDonair;2015-10-17 13:48;10;16;"On Oct 20, Halifax Council will debate to make the DONAIR THE OFFICIAL FOOD OF HALIFAX ! In http://www. halifax.ca/council/agenda sc/documents/151020ca1155.pdf … pic.twitter.com/wsABdkHTUn";;;;"655425266068627456";https://twitter.com/KingOfDonair/status/655425266068627456
MeganLeslieHFX;2015-10-17 13:31;1;0;"@FEEDNOVASCOTIA ’s Annual Food Run is tomorrow at @CdaGamesCentre . Learn how to support them here: http:// bit.ly/1PwhL4r #Halifax";;@FEEDNOVASCOTIA @CdaGamesCentre;#Halifax;"655420819875733505";https://twitter.com/MeganLeslieHFX/status/655420819875733505
HalifaxPressGC;2015-10-17 12:38;1;0;"BREAKING NEWS: Melting Warning in Effect for North End #Halifax - Cheese Floods Expected. See local food truck for details.";;;#Halifax;"655407494576152576";https://twitter.com/HalifaxPressGC/status/655407494576152576
foodpages;2015-10-17 12:04;0;0;"The Mix Review. 5201 Duke St, Halifax , NSCheck out the Beijing Chicken at the chinese food place. It has a really... http:// fb.me/46uXswTWv";;;;"655399094538608641";https://twitter.com/foodpages/status/655399094538608641
StreetFoodApp;2015-10-17 11:35;0;0;"14 food trucks are open today in Halifax http:// streetfoodapp.com/halifax";;;;"655391656649338880";https://twitter.com/StreetFoodApp/status/655391656649338880
vetsridecanada;2015-10-17 10:49;1;1;"Love Halifax ! Knights in shining armour have arrived! #navy #NATO #food #Support #Veterans pic.twitter.com/7kjGwRMq36";;;#navy #NATO #food #Support #Veterans;"655380185978507264";https://twitter.com/vetsridecanada/status/655380185978507264
AnjuliCBC;2015-10-17 10:06;1;1;"Julie Chaisson w/ Halifax Seaport Market says donations will be made to Dartmouth North Community Food Centre pic.twitter.com/kEs4la6Hwv";;;;"655369173170827264";https://twitter.com/AnjuliCBC/status/655369173170827264
sunbonnettrio;2015-10-16 23:06;0;1;"@Stephbeth_lewis everything about this is BAE, I miss Halifax food and you";;@Stephbeth_lewis;;"655203254951874560";https://twitter.com/sunbonnettrio/status/655203254951874560
keelagencies;2015-10-16 20:21;0;1;"@tasteomauritius you've outdone yourself yet again. Best #food option in #HALIFAX . And delivered to your door!";;@tasteomauritius;#food #HALIFAX;"655161606914121728";https://twitter.com/keelagencies/status/655161606914121728
AngryFoodie2015;2015-10-16 16:53;0;1;"@AsheSchow Well, between this and the convo at barber re Halifax food , I am hungry again. @MargaretsBelly @boring";;@AsheSchow @MargaretsBelly @boring;;"655109280169750528";https://twitter.com/AngryFoodie2015/status/655109280169750528
SaronnKitchen;2015-10-16 15:42;1;2;"Check me out at STUDIO EAST Food +Drink !!! #halifax #love #lunchdinner #dinein #hangout #takeout #comfortfood http:// fb.me/7Fl6dYh36";;;#halifax #love #lunchdinner #dinein #hangout #takeout #comfortfood;"655091429299978240";https://twitter.com/SaronnKitchen/status/655091429299978240
SFLHalifax;2015-10-16 11:53;0;0;"Join SFL Halifax this Sunday Oct. 18 for the annual Food Run at the Canada Games Centre Halifax ! We will have... http:// fb.me/7Bae39thM";;;;"655033772711256064";https://twitter.com/SFLHalifax/status/655033772711256064
StreetFoodApp;2015-10-16 11:35;0;0;"11 food trucks are open today in Halifax http:// streetfoodapp.com/halifax";;;;"655029266418126848";https://twitter.com/StreetFoodApp/status/655029266418126848
halitrax;2015-10-16 10:20;1;0;"Food insecurity rates for Nova Scotia and Halifax worst in Canada http://www. cbc.ca/1.3262622";;;;"655010499172659200";https://twitter.com/halitrax/status/655010499172659200
halifaxtrucks;2015-10-16 09:31;0;0;"Happy FriYAY! Here are your #Halifax food truck locations http:// bit.ly/1fQCjXq #Halifaxfoodtrucks pic.twitter.com/Tm4KQCd97q";;;#Halifax #Halifaxfoodtrucks;"654998190022860800";https://twitter.com/halifaxtrucks/status/654998190022860800
DealsLandsUK;2015-10-16 04:03;4;4;"Be the best with our exquisite food deals @http://www. dealslands.co.uk/coupon-categor y/food-drinks/ … #WorldFoodDay #KPRS #ATSocialMedia #Halifax pic.twitter.com/xY5EXBgVpE";;@http;#WorldFoodDay #KPRS #ATSocialMedia #Halifax;"654915601543098368";https://twitter.com/DealsLandsUK/status/654915601543098368
halifaxca1;2015-10-16 03:01;0;0;"Food Production Worker - Food & Nutrition Services - Capital District Health… http:// goo.gl/fb/tP94av Job Halifax CA";;;;"654899893564129280";https://twitter.com/halifaxca1/status/654899893564129280
halifaxca1;2015-10-16 03:01;0;0;"Utility Worker - Food & Nutrition Services - Capital District Health… http:// goo.gl/fb/gXz6XE Job Halifax CA";;;;"654899891672498176";https://twitter.com/halifaxca1/status/654899891672498176
job_canada_;2015-10-16 02:57;0;0;"Capital District Health Authority: Food Production Worker - Food & Nutrition Services ( Halifax , , Ca... http://www. jobs.as/display-job/11 045140/ …";;;;"654898905755332608";https://twitter.com/job_canada_/status/654898905755332608
job_canada_;2015-10-16 02:57;0;0;"Capital District Health Authority: Utility Worker - Food & Nutrition Services ( Halifax , , Canada) http://www. jobs.as/display-job/11 045142/ …";;;;"654898860154834944";https://twitter.com/job_canada_/status/654898860154834944
PonzaLT;2015-10-15 23:27;0;0;"@MrBitterTV NOLA is dream cuisine. Like... it's up there with Halifax NS Lebanese food .";;@MrBitterTV;;"654846064223236096";https://twitter.com/PonzaLT/status/654846064223236096
lonnietaylor;2015-10-15 22:32;0;2;"Anyone want to comment on their favorite #yyc food joints to a Halifax food blog? https:// twitter.com/EatThisTown/st atus/654509536456384513 …";;;#yyc;"654832196063133696";https://twitter.com/lonnietaylor/status/654832196063133696
PaulHReporter1;2015-10-15 22:05;0;0;"@Donnie_ Halifax ha! She had some wicked stinky food !";;@Donnie_;;"654825572288204801";https://twitter.com/PaulHReporter1/status/654825572288204801
laceybeanreads;2015-10-15 21:31;0;0;"Had Thai food for the first time ! So yummy!!! #Halifax #food I love Pad Thai! pic.twitter.com/6Kvojozho4";;;#Halifax #food;"654816981841932288";https://twitter.com/laceybeanreads/status/654816981841932288
CatchaJob_ca;2015-10-15 21:27;0;0;"#Job #Canada #Casino Nova Scotia Food and beverage server Temporary in #Halifax , NS, http://www. catchajob.ca/job/casino-nov a-scotia-food-and-beverage-server-temporary-in-halifax-ns/ …";;;#Job #Canada #Casino #Halifax;"654815777195880448";https://twitter.com/CatchaJob_ca/status/654815777195880448
karenneves;2015-10-15 20:30;0;0;"Hey, #Halifax . The best online ordering app for food ? Please? Go!";;;#Halifax;"654801586032545792";https://twitter.com/karenneves/status/654801586032545792
SullyErna;2015-10-15 19:47;5;25;"Almost there. First time in Halifax Nova Scotia! Where do we go for food and drinks? https:// instagram.com/p/84CN8PByMz/";;;;"654790744910118912";https://twitter.com/SullyErna/status/654790744910118912
HipperholmeGS;2015-10-15 18:43;0;2;"Harvest Festival donations going to the Ebenezer Food Bank in Halifax . pic.twitter.com/Njha9JcB3f";;;;"654774602078416896";https://twitter.com/HipperholmeGS/status/654774602078416896
apaincca;2015-10-15 18:16;1;1;"Halifax customers, don't miss tomorrow's Assa Abloy BBQ! Food is on us, see Assa Abloy's products and we have a special surprise for you!";;;;"654767852352737281";https://twitter.com/apaincca/status/654767852352737281
GetYourEatOnNS;2015-10-15 16:57;0;1;"Get Your Eat On Nova Scotia https:// youtu.be/E7jG_Y3y45U #food #foodie #foodtv #bbq #biggreenegg #MahoneBay #NS #Halifax #eat #yum";;;#food #foodie #foodtv #bbq #biggreenegg #MahoneBay #NS #Halifax #eat #yum;"654747958588518403";https://twitter.com/GetYourEatOnNS/status/654747958588518403
HalifaxNSNews;2015-10-15 14:36;0;0;"Halifax police probe another food tampering report - TheChronicleHerald.ca - http:// bit.ly/1Rd7los";;;;"654712349723529216";https://twitter.com/HalifaxNSNews/status/654712349723529216
CWP_CSP;2015-10-15 14:25;0;0;"Food insecurity rates for #NovaScotia and #Halifax worst in Canada http:// ow.ly/Tr6PQ via @CBC #WeNeedAPlan #elx42";;@CBC;#NovaScotia #Halifax #WeNeedAPlan #elx42;"654709673673687040";https://twitter.com/CWP_CSP/status/654709673673687040
StreetFoodApp;2015-10-15 11:35;0;0;"10 food trucks are open today in Halifax http:// streetfoodapp.com/halifax";;;;"654666870801326080";https://twitter.com/StreetFoodApp/status/654666870801326080
Brewtrippers;2015-10-15 11:31;0;0;"Plan to be in #Halifax in January so you can check out @ConnectionsHFX 's Craft Beer & Local Food event! http:// localconnections.ca/events/view/53 6/the-third-annual-craft-beer-local-food-celebration … #NScraftbeer";;@ConnectionsHFX;#Halifax #NScraftbeer;"654665878374518784";https://twitter.com/Brewtrippers/status/654665878374518784
TheSquareLemon;2015-10-15 10:51;2;0;"Welcome aboard @thechinesebuffet #Halifax food safety level 2 #online any issues call 01273 974040";;@thechinesebuffet;#Halifax #online;"654655894731419649";https://twitter.com/TheSquareLemon/status/654655894731419649
halifaxtrucks;2015-10-15 09:31;0;0;"Here are your Thursday #Halifax food truck locations http:// bit.ly/1fQCjXq #Halifaxfoodtrucks pic.twitter.com/HRu43B1fD6";;;#Halifax #Halifaxfoodtrucks;"654635683252961280";https://twitter.com/halifaxtrucks/status/654635683252961280
DirectionEmploi;2015-10-15 09:20;0;0;"Journeyman Cook, Food Services | Job offer in Halifax City | Finance & Corporate Shared Services... http:// fb.me/4P7IOfUt5";;;;"654632894909054976";https://twitter.com/DirectionEmploi/status/654632894909054976
bigtravelnut;2015-10-15 09:05;1;0;"Touring the Halifax food scene with Local Tasting Tours - (From the archives of BigTravelNut) #ttot #travel http:// tinyurl.com/pouwwlt";;;#ttot #travel;"654629090343841792";https://twitter.com/bigtravelnut/status/654629090343841792
iam_Halifax;2015-10-15 05:55;0;0;"Ever dished so much food then you end eating like 2 spoons and u tired ? Lol";;;;"654581352193519617";https://twitter.com/iam_Halifax/status/654581352193519617
InfoPrintout;2015-10-15 05:42;0;0;"Menu design for Italian Restaurant Il Tartufo in Wyke, Halifax . Eat your heart out @JamiesItalianUK #italian #food pic.twitter.com/ZMQXClxOVT";;@JamiesItalianUK;#italian #food;"654578009077350400";https://twitter.com/InfoPrintout/status/654578009077350400
halifaxca1;2015-10-15 03:37;0;0;"Food Service Supervisor - Patient Food Services - St. Martha's Regional… http:// goo.gl/fb/7gfhU9 Job Halifax CA";;;;"654546661109288960";https://twitter.com/halifaxca1/status/654546661109288960
halifaxca1;2015-10-14 20:02;0;0;"Food Service Coordinator - Franchise Management Inc. (FMI) - Halifax , NS http:// goo.gl/fb/4fLCVY Job Halifax CA";;;;"654432027752669184";https://twitter.com/halifaxca1/status/654432027752669184
Erin_YYC;2015-10-14 15:16;2;4;"attending @CAIS_Schools conference in #Halifax this week? hit @2DoorsDownhfx if you're in need of great food -burgers outstanding #grtservice";;@CAIS_Schools @2DoorsDownhfx;#Halifax #grtservice;"654360164284395521";https://twitter.com/Erin_YYC/status/654360164284395521
ScotiaWeb;2015-10-14 14:10;3;2;"#Halifax Coming soon: Portland Street Creperie: Lifelong Dartmouthians, and father-son busin... http:// bit.ly/1PgA3qY #NovaScotia #Food";;;#Halifax #NovaScotia #Food;"654343603666313216";https://twitter.com/ScotiaWeb/status/654343603666313216
SallyRolls_TD;2015-10-14 12:38;0;0;"This is my #favorite #season for #food love a #foodiefromhalifax #halifax https:// twitter.com/Doctors_NS/sta tus/654319510854500352 …";;;#favorite #season #food #foodiefromhalifax #halifax;"654320443323752448";https://twitter.com/SallyRolls_TD/status/654320443323752448
StreetFoodApp;2015-10-14 11:35;0;0;"7 food trucks are open today in Halifax http:// streetfoodapp.com/halifax";;;;"654304477504212993";https://twitter.com/StreetFoodApp/status/654304477504212993
DinerEnBlancJB;2015-10-14 09:55;0;1;"Stumped for #dinerenblancjoburg food ideas? These pics from Halifax , Nova Scotia should have you inspired! pic.twitter.com/oDxvHixZHo";;;#dinerenblancjoburg;"654279379162386432";https://twitter.com/DinerEnBlancJB/status/654279379162386432
halifaxtrucks;2015-10-14 09:45;1;1;"Happy #HumpDay ! Here are your #Halifax food truck locations http:// bit.ly/1fQCjXq #Halifaxfoodtrucks pic.twitter.com/yHFdZTRjYe";;;#HumpDay #Halifax #Halifaxfoodtrucks;"654276958038163456";https://twitter.com/halifaxtrucks/status/654276958038163456
HalifaxJob;2015-10-14 07:14;1;0;"Regional Sales Executive: McCain Foods : "Sameday Worldwide has an immediate vacancy for a… http://www. eluta.ca/search?ptitle= Regional+Sales+Executive&position=3df209a32bf62521d3de47ab5dc1b1ef&imo=1 … #halifax #jobs #ns";;;#halifax #jobs #ns;"654238771043438592";https://twitter.com/HalifaxJob/status/654238771043438592
HalifaxJob;2015-10-14 07:14;0;0;"Dock Worker: McCain Foods : "Day Ross Freight has an immediate opening for a full-time Dock… http://www. eluta.ca/search?ptitle= Dock+Worker&position=54a1498df5b722ef4aba1d0cd4918286&imo=1 … #halifax #jobs #ns";;;#halifax #jobs #ns;"654238759467089920";https://twitter.com/HalifaxJob/status/654238759467089920
CatchaJob_ca;2015-10-13 23:11;0;0;"#Job #Canada #Doraku foods Kitchen helper (Japanese fast food cook) Full Time in #Halifax , NS, http://www. catchajob.ca/job/doraku-foo ds-kitchen-helper-japanese-fast-food-cook-full-time-in-halifax-ns/ …";;;#Job #Canada #Doraku #Halifax;"654117178795556864";https://twitter.com/CatchaJob_ca/status/654117178795556864
NeuvooHalifaxNS;2015-10-13 22:31;0;0;"NS KT Foods Inc o/a KFC/Taco Bell is hiring! #Food #service supervisor ( NOC: 6212 ) in #Halifax , apply now! #jobs http:// neuvoo.ca/job.php?id=88g 52gkuf8&source=twitter&lang=en&client_id=241&l=Halifax%2C+Nova+Scotia%2C+CA&k=Food+service+supervisor+%28+NOC%3A+6212+%29 …";;;#Food #service #Halifax #jobs;"654107231781289984";https://twitter.com/NeuvooHalifaxNS/status/654107231781289984
erika_boutilier;2015-10-13 20:42;0;0;"@Kraveburger you guys are awesome! Love how involved you are with what's going on in Halifax . The food is fantastic as well! #A +";;@Kraveburger;#A;"654079834390401024";https://twitter.com/erika_boutilier/status/654079834390401024
lotsixbar;2015-10-13 18:00;5;1;"Seared tuna with wasabi cream, pickled daikon and tempura sushi rice. #food #lotsix #bar #halifax #hfx pic.twitter.com/r04XR38XJg";;;#food #lotsix #bar #halifax #hfx;"654039035346821124";https://twitter.com/lotsixbar/status/654039035346821124
gofondue;2015-10-13 16:02;0;1;"RT TheJasonTerry Stew on a cold wet day in Halifax . #food #foodporn #yum #instafood #TagsForLikes .com #yummy #amaz … https:// instagram.com/p/8yddBTIZ5f/";;;#food #foodporn #yum #instafood #TagsForLikes #yummy #amaz;"654009255675174912";https://twitter.com/gofondue/status/654009255675174912
TheJasonTerry;2015-10-13 15:50;0;0;"Stew on a cold wet day in Halifax . #food #foodporn #yum #instafood #TagsForLikes .com #yummy #amazing … https:// instagram.com/p/8yddBTIZ5f/";;;#food #foodporn #yum #instafood #TagsForLikes #yummy #amazing;"654006215345745920";https://twitter.com/TheJasonTerry/status/654006215345745920
halifaxtrucks;2015-10-13 15:45;0;0;"Get your taco fix at these #Halifax food trucks http:// bit.ly/1LIdp4D #Halifaxfoodtrucks #TacoTuesday pic.twitter.com/v8eI8Cc8Br";;;#Halifax #Halifaxfoodtrucks #TacoTuesday;"654005083445817344";https://twitter.com/halifaxtrucks/status/654005083445817344
BCFoodSecurity;2015-10-13 13:55;0;0;"Food insecurity rates for Nova Scotia and Halifax worst in Canada http:// bcfoodsecuritygateway.ca/?p=1075";;;;"653977364075020288";https://twitter.com/BCFoodSecurity/status/653977364075020288
samanthaarrow;2015-10-13 13:31;0;0;"Food insecurity rates for Nova Scotia and Halifax worst in Canada http://www. cbc.ca/1.3262622";;;;"653971445832286208";https://twitter.com/samanthaarrow/status/653971445832286208
CatchaJob_ca;2015-10-13 12:48;0;0;"#Job #Canada #Cambridge Suites Hotel Halifax Food and beverage server (Breakfast) Full Time in #Halifax , NS, http://www. catchajob.ca/job/cambridge- suites-hotel-halifax-food-and-beverage-server-breakfast-full-time-in-halifax-ns/ …";;;#Job #Canada #Cambridge #Halifax;"653960399067422720";https://twitter.com/CatchaJob_ca/status/653960399067422720
CatchaJob_ca;2015-10-13 12:13;0;0;"#Job #Canada #Food service attendant (Customer Service Lead &#8211; Halifax) in #Halifax , NS, http://www. catchajob.ca/job/food-servi ce-attendant-customer-service-lead-halifax-in-halifax-ns/ …";;;#Job #Canada #Food #8211 #Halifax;"653951582485250048";https://twitter.com/CatchaJob_ca/status/653951582485250048
CatchaJob_ca;2015-10-13 11:59;1;1;"#Job #Canada #Pete &#8217;s Food service attendant (Deli Supervisor &#8211; Halifax ) Full Time in #Halifax , NS, http://www. catchajob.ca/job/petes-food -service-attendant-deli-supervisor-halifax-full-time-in-halifax-ns/ …";;;#Job #Canada #Pete #8217 #8211 #Halifax;"653948058103869441";https://twitter.com/CatchaJob_ca/status/653948058103869441
rockbotmbrewpub;2015-10-13 11:58;0;0;"Rainy days call for comfort food ! Our Curried Chicken Penne is the perfect comfort food ! Don't you agree #Halifax ? pic.twitter.com/03JhFQvNC3";;;#Halifax;"653948024641728512";https://twitter.com/rockbotmbrewpub/status/653948024641728512
DrAHennigar;2015-10-13 11:36;1;2;"Wondering where to get nutritious food in Halifax ? @petesns is one of Dr. A favourites. Learn more at tonight's nutrition talk at 5:30.";;@petesns;;"653942318672805888";https://twitter.com/DrAHennigar/status/653942318672805888
StreetFoodApp;2015-10-13 11:35;0;0;"3 food trucks are open today in Halifax http:// streetfoodapp.com/halifax";;;;"653942087801417728";https://twitter.com/StreetFoodApp/status/653942087801417728
halifaxca1;2015-10-13 11:35;0;0;"Food Service Coordinator - Grab n Go Convenience - Halifax , NS http:// goo.gl/fb/jCdqBG Job Halifax CA";;;;"653942060593086464";https://twitter.com/halifaxca1/status/653942060593086464
ScotiaWeb;2015-10-13 11:17;0;0;"#Halifax Sneak Peek: Studio East (opening tonight!): On Saturday, Studio East served up a t... http:// bit.ly/1k1Kh1D #NovaScotia #Food";;;#Halifax #NovaScotia #Food;"653937596607823875";https://twitter.com/ScotiaWeb/status/653937596607823875
halifaxtrucks;2015-10-13 09:55;0;1;"Here are your Tuesday #Halifax food truck locations http:// bit.ly/1fQCjXq #Halifaxfoodtrucks pic.twitter.com/H8qgNLMfqw";;;#Halifax #Halifaxfoodtrucks;"653916887974285312";https://twitter.com/halifaxtrucks/status/653916887974285312
welcomehousing;2015-10-13 09:44;1;2;"Great event #friday @VeithHouse & @necchalifax for the Harvest Party! #music #food #Halifax #community #northend http://www. necchalifax.ca/posters/1358/";;@VeithHouse @necchalifax;#friday #music #food #Halifax #community #northend;"653914230790430720";https://twitter.com/welcomehousing/status/653914230790430720
TheLowerDeckHFX;2015-10-13 09:37;0;0;"@gwlra Want to share some great deals on our delicious food with #Halifax Purdy's Wharf professionals-Tweet us for details @DowntownHalifax";;@gwlra @DowntownHalifax;#Halifax;"653912476363309056";https://twitter.com/TheLowerDeckHFX/status/653912476363309056
thephoneladyca;2015-10-13 07:03;4;2;"How would your life change if you didn't have access to good food ? Cast your vote #Halifax #SoulsHarbour https://www. avivacommunityfund.org/ideas/acf32496 @AvivaCF";;@AvivaCF;#Halifax #SoulsHarbour;"653873638031118336";https://twitter.com/thephoneladyca/status/653873638031118336
NeuvooHalifaxNS;2015-10-13 05:16;0;0;"Best Choice Chinese Food is hiring! #Cook in #Halifax , apply now! #jobs http:// neuvoo.ca/job.php?id=0t8 b4rj7iw&source=twitter&lang=en&client_id=241&l=Halifax%2C+Nova+Scotia%2C+CA&k=Cook …";;;#Cook #Halifax #jobs;"653846646573371392";https://twitter.com/NeuvooHalifaxNS/status/653846646573371392
melissastyba;2015-10-12 21:41;0;0;"#salty #Halifax amazing!!! Great service, food and view #Albertalove for sure!";;;#salty #Halifax #Albertalove;"653732248232034304";https://twitter.com/melissastyba/status/653732248232034304
halifaxca1;2015-10-12 20:36;1;0;"Food service supervisor (Assistant) - The Chickenburger - Bedford, NS http:// goo.gl/fb/dAhrQb Job Halifax CA";;;;"653715915364765696";https://twitter.com/halifaxca1/status/653715915364765696
