username;date;retweets;favorites;text;geo;mentions;hashtags;id;permalink
chrisannad;2017-03-17 17:54;0;0;"Folks holding up #citadelhill at 5:50pm. #stpatricksday #halifax #goodonya #novascotia https://www. instagram.com/p/BRwN4ejgfyr/";;;#citadelhill #stpatricksday #halifax #goodonya #novascotia;"842841675030585345";https://twitter.com/chrisannad/status/842841675030585345
thembauk;2017-03-17 09:21;1;2;"Thanks @SAHFOS So many hands-on activities happening at the Citadel Hill lab for #bsw17 https:// twitter.com/skinnerjb/stat us/842696856845139972 …";;@SAHFOS;#bsw17;"842712592468656128";https://twitter.com/thembauk/status/842712592468656128
martooner;2017-03-17 08:50;0;2;"@Q104Halifax Hendrix in Halifax: All Along The Citadel Hill Clocktower. The Wind Cries St. Mary's. Robie House. #Halifax #hendrix #comedy .";;@Q104Halifax;#Halifax #hendrix #comedy;"842704601648435203";https://twitter.com/martooner/status/842704601648435203
cportolesi;2017-03-16 21:39;0;1;"Team Myles Halifax kicked Citadel Hill 's butt tonight! The view from the top is amazing!… https://www. instagram.com/p/BRuCwJPA4hs/";;;;"842535726579421186";https://twitter.com/cportolesi/status/842535726579421186
northendrunners;2017-03-15 20:40;0;0;"#Repost @nataliechavarie ・・・ Drill night #snowcrew #northendrunners @Citadel Hill https://www. instagram.com/p/BRrXM8SBQUt/";;@nataliechavarie @Citadel;#Repost #snowcrew #northendrunners;"842158487580762113";https://twitter.com/northendrunners/status/842158487580762113
halifaxnoise;2017-03-14 23:01;2;9;"From @halifaxin1340days — Foggy Citadel Hill http:// ift.tt/2mHnZFa pic.twitter.com/zUiyUDsGrX";;@halifaxin1340days;;"841831777740169219";https://twitter.com/halifaxnoise/status/841831777740169219
lady_kelady;2017-03-14 20:46;0;0;"Don't take o-fence @Citadel Hill https://www. instagram.com/p/BRozK56gROs/";;@Citadel;;"841797774442131456";https://twitter.com/lady_kelady/status/841797774442131456
whereispaulh;2017-03-14 13:38;0;1;"Budapest from the top of the Citadel hill (at The Citadel, Budapest) pic.twitter.com/91kTcSCOdB";;;;"841689922142650368";https://twitter.com/whereispaulh/status/841689922142650368
IAdoreJordan;2017-03-13 20:27;0;0;"#The Umayyad Palace is a large palatial complex from the Umayyad period, located on the Citadel Hill (Jabal... http:// fb.me/6GwX0wu95";;;#The;"841430555694624769";https://twitter.com/IAdoreJordan/status/841430555694624769
HomesInHalifax1;2017-03-13 11:15;0;0;"Elegant Penthouse, with stunning views of our beautiful Common, Citadel Hill and the city! #homesinhalifax http:// ow.ly/PIbY309PqXD";;;#homesinhalifax;"841291576705994753";https://twitter.com/HomesInHalifax1/status/841291576705994753
halifaxnoise;2017-03-12 10:05;2;15;"From @defectivecompass_ — Passage of History #citadelhill #parkscanada #halifax #novascot … http:// ift.tt/2myKXy4 pic.twitter.com/yXIgn0OtZ3";;@defectivecompass_;#citadelhill #parkscanada #halifax #novascot;"840911583878512641";https://twitter.com/halifaxnoise/status/840911583878512641
mylifeinthesunn;2017-03-12 01:24;0;0;"Parks Canada Ghost Tour of Citadel Hill Citadel Hill is a National Historic Site in Halifax, NS. http:// rviv.ly/cBD7d #EastCoastBlogger";;;#EastCoastBlogger;"840795599272345600";https://twitter.com/mylifeinthesunn/status/840795599272345600
kay_buckle;2017-03-10 20:16;0;1;"the fort in citadel hill has space for events";;;;"840355639687839745";https://twitter.com/kay_buckle/status/840355639687839745
thembauk;2017-03-09 08:36;3;12;"A beautiful quilt kindly donated to the MBA depicting The Citadel Hill Laboratory and Plymouth Sound by Susan Denton #IWD2017 pic.twitter.com/qMSsEz9eTC";;;#IWD2017;"839817232842698752";https://twitter.com/thembauk/status/839817232842698752
WafidInstitute;2017-03-08 10:27;0;0;"The Umayyad Palace on top of the Citadel Hill in Amman, Jordan. When are you going to explore it… https://www. instagram.com/p/BRYWZYBgnSU/";;;;"839482701790998528";https://twitter.com/WafidInstitute/status/839482701790998528
martyswild;2017-03-07 16:40;0;0;"I'll guard citadel hill ! #Halifax pic.twitter.com/fNqaNZMi0H";;;#Halifax;"839214075297075200";https://twitter.com/martyswild/status/839214075297075200
mylifeinthesunn;2017-03-05 03:37;4;2;"Parks Canada Ghost Tour of Citadel Hill Citadel Hill is a National Historic Site in Halifax, NS. http:// rviv.ly/MVL5C #EastCoastBlogger";;;#EastCoastBlogger;"838292427299508224";https://twitter.com/mylifeinthesunn/status/838292427299508224
LCThornton;2017-03-02 22:14;0;0;"A little pocket of zen in the middle of Halifax #latergram #sunset #citadelhill #home https://www. instagram.com/p/BRKKl7Ylcmc/";;;#latergram #sunset #citadelhill #home;"837486422953234432";https://twitter.com/LCThornton/status/837486422953234432
Sarradis;2017-03-02 08:24;0;0;"Foggy run this morning. #citadelhill https://www. instagram.com/p/BRIrgGRB2Md/";;;#citadelhill;"837277311460204544";https://twitter.com/Sarradis/status/837277311460204544
SampsonKenny;2017-03-01 12:27;0;1;". Citadel Hill looks pretty good from the hotel side of the Nova Centre too! pic.twitter.com/0r8fpV4Gik";;;;"836976123984678913";https://twitter.com/SampsonKenny/status/836976123984678913
ShaunTheShooter;2017-02-28 20:11;0;0;"#Halifax #CitadelHill #NovaScotia #Landscape @Citadel Hill https://www. instagram.com/p/BREy6AlhKcS/";;@Citadel;#Halifax #CitadelHill #NovaScotia #Landscape;"836730646944874496";https://twitter.com/ShaunTheShooter/status/836730646944874496
Sarradis;2017-02-28 14:32;0;2;"#clocktower #citadelhill #halifax https://www. instagram.com/p/BREMFIPh8a_/";;;#clocktower #citadelhill #halifax;"836645264790188032";https://twitter.com/Sarradis/status/836645264790188032
chronicleherald;2017-02-28 10:00;0;0;"Citadel Hill getting improvements http:// herald.ca/z7W#.";;;#;"836576716990648320";https://twitter.com/chronicleherald/status/836576716990648320
Sarradis;2017-02-28 09:22;0;0;"My running buddy. #crows #citadelhill https://www. instagram.com/p/BRDopa_By2f/";;;#crows #citadelhill;"836567345694855168";https://twitter.com/Sarradis/status/836567345694855168
Sarradis;2017-02-28 09:21;0;0;"The Two Towers #halifaxlotr #citadelhill https://www. instagram.com/p/BRDocUZhY6g/";;;#halifaxlotr #citadelhill;"836566897936117760";https://twitter.com/Sarradis/status/836566897936117760
Sarradis;2017-02-28 09:18;0;1;"Incredible morning in #halifax #morningrun #citadelhill https://www. instagram.com/p/BRDoI0dhQWP/";;;#halifax #morningrun #citadelhill;"836566227690504194";https://twitter.com/Sarradis/status/836566227690504194
chronicleherald;2017-02-27 19:32;1;2;"Citadel Hill getting improvements http:// herald.ca/z7W#.";;;#;"836358252002693120";https://twitter.com/chronicleherald/status/836358252002693120
NSRasta;2017-02-27 19:30;0;0;"City at Night Digital Download - #Dartmouth Bridge - Citadel Hill #Halifax View - NS Photo - http:// shrd.by/ZaHFS7 via @angelbeachglass";;@angelbeachglass;#Dartmouth #Halifax;"836357772958629888";https://twitter.com/NSRasta/status/836357772958629888
HomesInHalifax1;2017-02-26 12:01;0;1;"Elegant Penthouse overlooking the Commons & Citadel Hill - a stunning view that will never change! #homesinhalifax http:// ow.ly/qKmy309fYd8 pic.twitter.com/z5NZC3UWxV";;;#homesinhalifax;"835882365364940802";https://twitter.com/HomesInHalifax1/status/835882365364940802
brunchausen;2017-02-25 17:51;0;8;"reporting to you live from citadel hill to let you know there's fog out there buds pic.twitter.com/Cp7Jw5RBbL";;;;"835608202486169606";https://twitter.com/brunchausen/status/835608202486169606
tnthalifax;2017-02-25 13:25;6;10;"Not only did these runners crush Citadel Hill , they are raising funds to crush blood cancer #GoTeam #SomeDayIsToday #WeTrainToCRUSHCancer pic.twitter.com/XC8HaoZzkC";;;#GoTeam #SomeDayIsToday #WeTrainToCRUSHCancer;"835541281770246144";https://twitter.com/tnthalifax/status/835541281770246144
tristandyer;2017-02-25 13:11;0;0;"Up and down citadel hill . Twice. #sweatyshirt https:// twitter.com/tristandyer/st atus/835536943257686016 …";;;#sweatyshirt;"835537610948939778";https://twitter.com/tristandyer/status/835537610948939778
mylifeinthesunn;2017-02-25 01:15;0;0;"Parks Canada Ghost Tour of Citadel Hill Citadel Hill is a National Historic Site in Halifax, NS. http:// rviv.ly/ukeJI #EastCoastBlogger";;;#EastCoastBlogger;"835357508273340416";https://twitter.com/mylifeinthesunn/status/835357508273340416
LegalInfoNS;2017-02-23 13:50;0;1;"Thanks for the shout out, and yes, please drop by to see us in our new spot opposite Citadel Hill ! https:// twitter.com/CourtsNS_News/ status/834414367156342785 …";;;;"834822650069413888";https://twitter.com/LegalInfoNS/status/834822650069413888
TalentTeamLaura;2017-02-23 13:30;0;1;"#hearthealthmonth at @LixarIT . What a beautiful day in Halifax to hike #CitadelHill ! pic.twitter.com/lFoL3ZcfCV";;@LixarIT;#hearthealthmonth #CitadelHill;"834817754846920704";https://twitter.com/TalentTeamLaura/status/834817754846920704
CBCcameraman;2017-02-22 14:40;4;12;"#citadelhill #halifax #novascotia #beautifulwinterday #snowmelting #cbcns pic.twitter.com/nZRxPRCIfP";;;#citadelhill #halifax #novascotia #beautifulwinterday #snowmelting #cbcns;"834472910236635141";https://twitter.com/CBCcameraman/status/834472910236635141
CBCcameraman;2017-02-22 14:32;0;1;"#halifax The capital of #novascotia . #citadelhill stands out after last weeks #snowstorms … https://www. instagram.com/p/BQ0vU-1D-n4/";;;#halifax #novascotia #citadelhill #snowstorms;"834470978398932998";https://twitter.com/CBCcameraman/status/834470978398932998
ajlburke;2017-02-21 17:40;0;0;"#dusk #halifax @Citadel Hill https://www. instagram.com/p/BQygDKTl79V/";;@Citadel;#dusk #halifax;"834155911631478784";https://twitter.com/ajlburke/status/834155911631478784
ajlburke;2017-02-21 17:39;0;0;"Nice evening walk home. Cloud rainbow! #halifax @Citadel Hill https://www. instagram.com/p/BQyf5yOFscG/";;@Citadel;#halifax;"834155588691058689";https://twitter.com/ajlburke/status/834155588691058689
ErPhrase;2017-02-21 12:10;0;1;"On my mom's side, her ancestors both escaped to freedom via the Underground Railroad and came here from Jamaica to work build Citadel Hill .";;;;"834072856774447104";https://twitter.com/ErPhrase/status/834072856774447104
LDTG117;2017-02-20 19:15;0;0;"I loved seeing all the families out on Citadel Hill enjoying Heritage Day.";;;;"833817359643189251";https://twitter.com/LDTG117/status/833817359643189251
rosebeefe;2017-02-20 18:00;1;5;"Some asshole is driving the wrong way around Citadel Hill , which is a one way. They gave me the finger when I tried to let them know.";;;;"833798622684786689";https://twitter.com/rosebeefe/status/833798622684786689
EvanMeisner;2017-02-20 15:40;0;0;"Sledding on the mountain. #sledding #snow #zoom #woohoo #gunnagetchya @Citadel Hill https://www. instagram.com/p/BQvte_kgnMK/";;@Citadel;#sledding #snow #zoom #woohoo #gunnagetchya;"833763231806140418";https://twitter.com/EvanMeisner/status/833763231806140418
TimoMajere;2017-02-20 13:21;0;0;"I can remember when we didn't have to pay money to visit the N.S Museum and Citadel Hill . Apparently learning history costs money nowadays";;;;"833728289369944064";https://twitter.com/TimoMajere/status/833728289369944064
NaysaCrew;2017-02-20 12:56;0;0;"Shot this at Citadel Hill after my float session...I was in a weird peaceful state of… https://www. instagram.com/p/BQvawR4j8C3/";;;;"833722048279089152";https://twitter.com/NaysaCrew/status/833722048279089152
Becominggranola;2017-02-20 12:39;0;1;"drive around commons. Use roundabout near base of citadel hill to turn directions if you found spot on other side of road.";;;;"833717688144916480";https://twitter.com/Becominggranola/status/833717688144916480
mylifeinthesunn;2017-02-20 02:04;0;0;"Parks Canada Ghost Tour of Citadel Hill Citadel Hill is a National Historic Site in Halifax, NS. http:// rviv.ly/YatgA #EastCoastBlogger";;;#EastCoastBlogger;"833557920130400256";https://twitter.com/mylifeinthesunn/status/833557920130400256
Michael_Malott;2017-02-20 00:16;0;0;"I remember sprinting Citadel Hill in downtown Halifax with gtuck45 and patcarroll902. We'd talk… https://www. instagram.com/p/BQuDtO5ggDA/";;;;"833530627760717824";https://twitter.com/Michael_Malott/status/833530627760717824
aleyahs;2017-02-19 20:12;0;1;"Sunset over the hill • • #htxhalifax #travelHT #citadelhill #sunset #eastcoast #halifax … https://www. instagram.com/p/BQtn0zSg69Z/";;;#htxhalifax #travelHT #citadelhill #sunset #eastcoast #halifax;"833469319870808066";https://twitter.com/aleyahs/status/833469319870808066
sarah_ivens;2017-02-19 16:09;0;1;"View from Citadel Hill , Halifax @Citadel Hill https://www. instagram.com/p/BQtMCSZA6W1/";;@Citadel;;"833408204126171140";https://twitter.com/sarah_ivens/status/833408204126171140
_tianafaith;2017-02-18 19:09;1;81;"my bfs bday last yr we drove to citadel hill at 4:30am the day chance dropped coloring book, laid in the sunrise & just listened start to";;;;"833091184927076352";https://twitter.com/_tianafaith/status/833091184927076352
ChristmasM2C;2017-02-18 12:49;0;1;"#sledding #citadelhill #cousins #love #halifax @CraigsTwist pic.twitter.com/xc8bZdrRdh";;@CraigsTwist;#sledding #citadelhill #cousins #love #halifax;"832995538937200640";https://twitter.com/ChristmasM2C/status/832995538937200640
ChristmasM2C;2017-02-18 12:45;0;5;"Beauty day sledding w @CraigsTwist , my big bro and the kiddies @#citadelhill #halifax #family pic.twitter.com/eHSu8iZXui";;@CraigsTwist @;#citadelhill #halifax #family;"832994443213012993";https://twitter.com/ChristmasM2C/status/832994443213012993
CraigsTwist;2017-02-18 12:38;0;4;"What an awesome day for sledding. Citadel hill has great snow, kids and I had a ball. pic.twitter.com/qD65y0o79G";;;;"832992707438055424";https://twitter.com/CraigsTwist/status/832992707438055424
ColleenLucas2;2017-02-17 09:58;0;0;"The snowbanks are tall as Citadel Hill and it’s illegal to shovel onto street, so what should we do with snow? http://www. thecoast.ca/halifax/the-sn owbanks-are-as-tall-as-citadel-hill-and-its-illegal-to-shovel-onto-the-street-so-what-should-we-do-with-all-this-snow/Poll?poll=5997185 …";;;;"832590024663322627";https://twitter.com/ColleenLucas2/status/832590024663322627
Rottenapple1985;2017-02-17 09:36;0;0;"@Thebeast_ufc dude where are you at? Come up to citadel hill !";;@Thebeast_ufc;;"832584398012825600";https://twitter.com/Rottenapple1985/status/832584398012825600
Sarradis;2017-02-17 07:54;0;1;"Good morning Halifax! #happyfriday #citadelhill #sunrise https://www. instagram.com/p/BQnJ19Th44W/";;;#happyfriday #citadelhill #sunrise;"832558956279050240";https://twitter.com/Sarradis/status/832558956279050240
ianxharris;2017-02-16 16:38;0;0;"#tbt to a very cured stack of wood in the middle of Halifax. @Citadel Hill https://www. instagram.com/p/BQlhA7VBRLe/";;@Citadel;#tbt;"832328438362943488";https://twitter.com/ianxharris/status/832328438362943488
ammpsocial;2017-02-16 14:58;0;0;"Looks like they're about to dismantle Citadel Hill . Well, it had a good run but who really needs a fortress in 2017? pic.twitter.com/85NiBknPIn";;;;"832303035468636163";https://twitter.com/ammpsocial/status/832303035468636163
RoseSL63;2017-02-16 10:29;0;1;"This caught my eye on the evening commute home last night. A lone tree on Citadel Hill . Seems… https://www. instagram.com/p/BQk2wZ3BgIm/";;;;"832235509707534337";https://twitter.com/RoseSL63/status/832235509707534337
MurphTWN;2017-02-16 05:46;0;5;"He got stuck on Citadel Hill -could there be an encore performance awaiting @NateTWN on Magnetic Hill? Live coverage from #Moncton this am! https:// twitter.com/NateTWN/status /831889606006149121 …";;@NateTWN;#Moncton;"832164284339732480";https://twitter.com/MurphTWN/status/832164284339732480
MaritimeDrifter;2017-02-15 11:54;0;0;"Saw this nice #mk7golfr downtown last week. #mk7 #golfr #volkswagen #kraftswork #awd @Citadel Hill https://www. instagram.com/p/BQibpKZD9Om/";;@Citadel;#mk7golfr #mk7 #golfr #volkswagen #kraftswork #awd;"831894427945857026";https://twitter.com/MaritimeDrifter/status/831894427945857026
MurphTWN;2017-02-15 11:15;8;16;"No rest for @NateTWN ! Finally down from Citadel Hill after storm #1 & is on his way to #Moncton , NB for storm #2! Updates @weathernetwork pic.twitter.com/7bA699GvtX";;@NateTWN @weathernetwork;#1 #Moncton #2;"831884585025859584";https://twitter.com/MurphTWN/status/831884585025859584
HiromiActs;2017-02-15 09:53;0;1;""Oh Canada, we stand on guard for thee" @CanadianFlag @canada150th @environmentca #canada150 #cdnhistory #cdnpoli #NovaScotia #CitadelHill pic.twitter.com/pyzHqFWmlS";;@CanadianFlag @canada150th @environmentca;#canada150 #cdnhistory #cdnpoli #NovaScotia #CitadelHill;"831864060014637058";https://twitter.com/HiromiActs/status/831864060014637058
ADebisonCTV;2017-02-14 22:46;0;0;"Sleds are so 2016. This guy flew down Citadel Hill in #Halifax by kayak. @CTVAtlantic pic.twitter.com/iRN8LnmclB";;@CTVAtlantic;#Halifax;"831696191356301312";https://twitter.com/ADebisonCTV/status/831696191356301312
rolyred;2017-02-14 17:23;0;0;"weather-network-reporters-abandon-vehicle-on- citadel-hill https://www. theweathernetwork.com/ca/videos/gall ery/weather-network-reporters-abandon-vehicle-on-citadel-hill/sharevideo/5321747987001 …";;;;"831614836232581130";https://twitter.com/rolyred/status/831614836232581130
StarboardWP;2017-02-14 16:30;0;1;"A pow day at CITADEL Hill ! pic.twitter.com/rZ87mTnnhJ";;;;"831601466913726465";https://twitter.com/StarboardWP/status/831601466913726465
WesleyCoughlan;2017-02-14 13:11;0;0;"I liked a @YouTube video http:// youtu.be/a8EnlUP5Fgw?a Weather Network reporters abandon vehicle on Citadel Hill | Atlantic nor'easter";;@YouTube;;"831551559175696384";https://twitter.com/WesleyCoughlan/status/831551559175696384
keithjohnsCTV;2017-02-14 12:56;33;49;"Kayaking on Citadel hill ... good run!! #NSStorm #blizzard2017 pic.twitter.com/T2mxKkNYGl";;;#NSStorm #blizzard2017;"831547736205963264";https://twitter.com/keithjohnsCTV/status/831547736205963264
ProfessorRotman;2017-02-14 11:45;0;0;"Weather Network reporters stuck on Halifax's Citadel Hill : weather-network-reporters-abandon-vehicle-on- citadel-hill https://www. theweathernetwork.com/ca/videos/gall ery/weather-network-reporters-abandon-vehicle-on-citadel-hill/sharevideo/5321747987001 …";;;;"831529872371675136";https://twitter.com/ProfessorRotman/status/831529872371675136
DSHAPO;2017-02-14 08:22;0;0;"Weather Network reporters abandon vehicle on Citadel Hill #ShareYourWeather https://www. theweathernetwork.com/videos/gallery /weather-network-reporters-abandon-vehicle-on-citadel-hill/sharevideo/5321747987001 … pic.twitter.com/qmN0ZBaLXp";;;#ShareYourWeather;"831478708087189504";https://twitter.com/DSHAPO/status/831478708087189504
SBelliveauCTV;2017-02-14 07:48;3;10;"View of Citadel Hill on this blustery morning. Winds are strong, still snowing. Stay safe and warm. Updates all morning on @CTVMorningAtl pic.twitter.com/HOuWkyxvoF";;@CTVMorningAtl;;"831470089216126976";https://twitter.com/SBelliveauCTV/status/831470089216126976
caper2guy;2017-02-13 22:25;0;0;"Right now in Halifax I imagine there is a long line-up for the Citadel Hill ski lift.";;;;"831328514402054144";https://twitter.com/caper2guy/status/831328514402054144
dt49;2017-02-13 21:03;1;1;"Making the most of mother nature. Off to Citadel Hill . #blizzard2017 pic.twitter.com/nGHesl4Nci";;;#blizzard2017;"831307741658546180";https://twitter.com/dt49/status/831307741658546180
Darrel_Mac;2017-02-13 19:51;0;1;"weather-network-reporters-abandon-vehicle-on- citadel-hill https://www. theweathernetwork.com/ca/videos/gall ery/weather-network-reporters-abandon-vehicle-on-citadel-hill/sharevideo/5321747987001 …";;;;"831289622420406276";https://twitter.com/Darrel_Mac/status/831289622420406276
ptabbiner;2017-02-13 18:52;0;0;"I assume Elsa is atop Citadel Hill right now. #Halifaxstorm pic.twitter.com/xODUwbmgir";;;#Halifaxstorm;"831274857291722752";https://twitter.com/ptabbiner/status/831274857291722752
likesunnydays;2017-02-13 16:39;0;0;"lol isn't Citadel Hill like a 45 degree angled street? You're lucky this wasn't an ice storm!";;;;"831241455041646595";https://twitter.com/likesunnydays/status/831241455041646595
weathernetwork;2017-02-13 15:56;42;45;"Intense snow drifts in Halifax force @weathernetwork reporters to abandon vehicle on Citadel Hill http:// ow.ly/tbjv308Y3Iu #NSstorm #Atlstorm pic.twitter.com/LnFGz39Mcv";;@weathernetwork;#NSstorm #Atlstorm;"831230571695190016";https://twitter.com/weathernetwork/status/831230571695190016
keithjohnsCTV;2017-02-13 15:29;33;31;"Video from Citadel hill #Blizzard2017 #HfxSnow pic.twitter.com/2Ui6EfKBBl";;;#Blizzard2017 #HfxSnow;"831223714020720642";https://twitter.com/keithjohnsCTV/status/831223714020720642
halifaxnoise;2017-02-13 14:17;0;3;"TONIGHT. CITADEL HILL . Get there around 6. It's the biggest storm day of the year!… http:// ift.tt/2kDfvwR pic.twitter.com/j1AmZD4zWX";;;;"831205730074103808";https://twitter.com/halifaxnoise/status/831205730074103808
nowthatstyping;2017-02-13 13:37;0;0;"#blizzard2017 #NSStorm will not be declared over till @cstclair1 @weathernetwork can get off #CitadelHill .";;@cstclair1 @weathernetwork;#blizzard2017 #NSStorm #CitadelHill;"831195714621415425";https://twitter.com/nowthatstyping/status/831195714621415425
keithjohnsCTV;2017-02-13 12:04;14;14;"Downtown Halifax from Citadel Hill . Pretty much same scene everywhere!! pic.twitter.com/6i5OJz8mh0";;;;"831172256013352960";https://twitter.com/keithjohnsCTV/status/831172256013352960
weathernetwork;2017-02-13 11:55;4;7;"Winds roaring across Citadel Hill in #Halifax this morning @cstclair1 #NSStorm https://www. youtube.com/watch?v=K0MYHW 103lI …";;@cstclair1;#Halifax #NSStorm;"831169998777356288";https://twitter.com/weathernetwork/status/831169998777356288
MurphTWN;2017-02-13 10:55;2;6;"I bet the discussion between these two, at some point, went like this "...ok, whose bright idea was it to come up Citadel Hill ?" #atlstorm https:// twitter.com/cstclair1/stat us/831122783568592896 …";;;#atlstorm;"831154852935905282";https://twitter.com/MurphTWN/status/831154852935905282
ScotiaPharmacy;2017-02-13 10:47;1;3;"IS THIS CITADEL HILL !?? WHAT ARE U TRYING TO SIGHT SEE UP THERE #HFXWHITEOUT";;;#HFXWHITEOUT;"831152875992711169";https://twitter.com/ScotiaPharmacy/status/831152875992711169
LumberMart;2017-02-13 09:46;0;0;"It's windy on #citadelhill #halifax #nsstorm https:// twitter.com/cstclair1/stat us/831099366886821888 …";;;#citadelhill #halifax #nsstorm;"831137416761266176";https://twitter.com/LumberMart/status/831137416761266176
MurphTWN;2017-02-13 09:41;4;6;"Normally, I love the view from here... #atlstorm #Halifax #CitadelHill https:// twitter.com/cstclair1/stat us/831099366886821888 …";;;#atlstorm #Halifax #CitadelHill;"831136255593287681";https://twitter.com/MurphTWN/status/831136255593287681
StarboardWP;2017-02-13 08:00;0;3;"We are closed today. If you want to chat grab your skis or snowboard and meet me on citadel hill . #Snowmaggedon2017";;;#Snowmaggedon2017;"831110890007171072";https://twitter.com/StarboardWP/status/831110890007171072
weathernetwork;2017-02-13 07:48;2;5;"LIVE look at conditions atop Citadel Hill in Halifax #Atlstorm #NSStorm https:// twitter.com/cstclair1/stat us/831106292265607168 …";;;#Atlstorm #NSStorm;"831107821433401348";https://twitter.com/weathernetwork/status/831107821433401348
cstclair1;2017-02-13 07:32;0;19;"At this rate, we may not get down Citadel Hill https:// twitter.com/lmackie12/stat us/831103174165590016 …";;;;"831103634586886145";https://twitter.com/cstclair1/status/831103634586886145
NateTWN;2017-02-13 06:42;1;16;"Current conditions on Citadel Hill . #Halifax #nsstorm About to go LIVE w/ @cstclair1 @NicoleKarkic @MurphTWN pic.twitter.com/YMhzHj0zv4";;@cstclair1 @NicoleKarkic @MurphTWN;#Halifax #nsstorm;"831091141785296896";https://twitter.com/NateTWN/status/831091141785296896
historyrussell;2017-02-12 19:57;0;0;"An interesting counter factual: Citadel Hill in Ottawa? http:// ottawacitizen.com/news/local-new s/andrew-king-what-if-bytown-had-become-fortress-ottawa-some-imagined-it-might …";;;;"830928930198716416";https://twitter.com/historyrussell/status/830928930198716416
lauratravel;2017-02-12 19:28;1;6;"Citadel Hill , Halifax, Nova Scotia, Canada pic.twitter.com/4g1ebHYyHk";;;;"830921427695996928";https://twitter.com/lauratravel/status/830921427695996928
halifaxnoise;2017-02-12 17:40;4;16;"Citadel Hill , from @dylanhebb — slopes. http:// ift.tt/2kI4IUA pic.twitter.com/fGuP28dQ42";;@dylanhebb;;"830894447730814976";https://twitter.com/halifaxnoise/status/830894447730814976
daveonfern;2017-02-11 17:15;0;0;"too bad we won't be able to see them from Citadel Hill while they are here";;;;"830525594630778882";https://twitter.com/daveonfern/status/830525594630778882
halifaxnoise;2017-02-10 22:42;1;8;"From @pictureperfecttours — Winter is at our feet. ☆ Sidewalk at Citadel Hill National His… http:// ift.tt/2l3wbAH pic.twitter.com/cVK1Lp2Q0o";;@pictureperfecttours;;"830245570463879168";https://twitter.com/halifaxnoise/status/830245570463879168
StormhunterTWN;2017-02-10 16:29;13;51;"Ok, this is so cool. Sea effect snow bands! I can see the whole band from the top of Citadel Hill in Halifax. @weathernetwork pic.twitter.com/AJH4TIuvMm";;@weathernetwork;;"830151691462901760";https://twitter.com/StormhunterTWN/status/830151691462901760
StormhunterTWN;2017-02-10 16:27;5;38;"Hey look who I bumped into at the top of Citadel Hill ! @weathernetwork @NateTWN pic.twitter.com/hQkDd1Gyla";;@weathernetwork @NateTWN;;"830151336545091586";https://twitter.com/StormhunterTWN/status/830151336545091586
CCCyclistGC;2017-02-10 13:47;0;1;"Don't think I'd want to be in that cab as it was trekking up Citadel hill !!! https:// twitter.com/NickCnf/status /830107264006623232 …";;;;"830110948514000897";https://twitter.com/CCCyclistGC/status/830110948514000897
