username;date;retweets;favorites;text;geo;mentions;hashtags;id;permalink
Lighthouse0107;2018-04-29 18:30;1;9;"Ok, Halifax people definitely rock !!!!!! No real Standing ovation in Ottawa!!!! They didn’t even have to stop the music ..... GO HALIFAX !!! #virtuemoir https:// twitter.com/woodestiel/sta tus/990700506111594496 …";;;#virtuemoir;"990704960273821696";https://twitter.com/Lighthouse0107/status/990704960273821696
ClassicRock979;2018-04-26 15:44;0;0;"IN FLIGHT SAFETY PULLS OUT OF ROCK THE HUB OVER LACK OF DIVERSITY Thursday 26th April 2018 A Halifax indie rock band is pulling out of a Nova Scotia music festival, saying the lineup lacks diversity. In-Flight Safety frontman... http:// classicrock979.ca/story.php?view =21902 …";;;;"989575927909658624";https://twitter.com/ClassicRock979/status/989575927909658624
globalhalifax;2018-04-26 12:18;4;12;"A #Halifax indie rock band is pulling out of a Nova Scotia music festival, saying the lineup lacks diversity. https:// trib.al/THxKBPy";;;#Halifax;"989524114309287936";https://twitter.com/globalhalifax/status/989524114309287936
Live105HRM;2018-04-25 09:11;0;1;"105 Minutes of Commercial Free Uninterrupted Music NOW - 10:30AM then again from 3:45-5:30PM! * Head banging * #Halifax #HRM #HFX #NovaScotia #Canada #ROCKMusic #AltRock #Getit #LIVE105 pic.twitter.com/aCnTv6ytZv";;;#Halifax #HRM #HFX #NovaScotia #Canada #ROCKMusic #AltRock #Getit #LIVE105;"989114744358481920";https://twitter.com/Live105HRM/status/989114744358481920
Live105HRM;2018-04-24 08:59;0;1;"105 Minutes of Commercial Free Uninterrupted Music is NOW 'til 10:30AM! It happens all over again from 3:45-5:30PM! ROCK ON! #Halifax #HRM #HFX #LIVE105 #NovaScotia #Canada pic.twitter.com/biDhx0rOfT";;;#Halifax #HRM #HFX #LIVE105 #NovaScotia #Canada;"988749333527957504";https://twitter.com/Live105HRM/status/988749333527957504
TheBeaconHx;2018-04-24 05:34;0;1;"Retweeted Orange Box Halifax ( @OrangeBoxHX ): Orange Box Rock School is perfect for those who love music . Fancy joining other 11- 16 year old musicians to make music , form a band or collaborate? Join us Mondays... https://www. facebook.com/TheBeaconHalif ax/posts/2153501477996793 …";;@OrangeBoxHX;;"988697697011027968";https://twitter.com/TheBeaconHx/status/988697697011027968
thorneyhfx;2018-04-22 11:30;0;3;"This type of all-male guitar- rock lineup—working-class music —is itself a stereotype, born of the Bud-drinking hick (what “real men” listen to), which is a real type of person former and current, in Truro and Halifax and all over this country.";;;;"988062501244981248";https://twitter.com/thorneyhfx/status/988062501244981248
Live105HRM;2018-04-19 08:51;0;1;"Right now, 'til 10:30AM you're inside 105 Minutes of Commercial Free ROCK ! It happens again with Lindsay fr: 3:45-5:30PM! #GetROCKINwithit #LIVE105 #Halifax #HRM #HFX #NovaScotia #Canada #ROCKMusic #listen #LIVE - Scotty & Ferne pic.twitter.com/dzM1GINLK8";;;#GetROCKINwithit #LIVE105 #Halifax #HRM #HFX #NovaScotia #Canada #ROCKMusic #listen #LIVE;"986935276214812674";https://twitter.com/Live105HRM/status/986935276214812674
AtlCanCaper;2018-04-18 21:40;1;1;"Congrats to the ECMA Nominees in the Rock Category that we're proud to air here at "In the East Coast" returns back in Fall 2018 on @CaperRadio 107.3FM in Sydney. @EastCoastMusic Awards are taking place two weeks from today from May 2-6 in Halifax ! #EastCoast #Halifax #ROCKMUSIC";;@CaperRadio @EastCoastMusic;#EastCoast #Halifax #ROCKMUSIC;"986766424709455873";https://twitter.com/AtlCanCaper/status/986766424709455873
Melotikamusic;2018-04-18 20:14;2;7;"In #Moncton #newbrunswick on tour w/ @Krosstoutmusic ! Still sick today. Going to save my vox for this week end in #halifax & #Charlottetown ! #nowplaying #livemusic #hiphop #rockmusic #canadianmusic";;@Krosstoutmusic;#Moncton #newbrunswick #halifax #Charlottetown #nowplaying #livemusic #hiphop #rockmusic #canadianmusic;"986744898605940736";https://twitter.com/Melotikamusic/status/986744898605940736
myparktheatre;2018-04-17 13:48;3;7;"Tomorrow! @RedMoonRoad & @hillsburnband ! RMR will be debuting brand new material, joined by Hillsburn, a five-piece, indie- rock band from Halifax A solid night of great music ! Grab a friend with good taste in tunes and get down to The Park! https:// myparktheatre.com/event-calendar /8-pm-red-moon-road-hillsburn/ … pic.twitter.com/IH5rtAdWrn";;@RedMoonRoad @hillsburnband;;"986285256759181313";https://twitter.com/myparktheatre/status/986285256759181313
Live105HRM;2018-04-16 08:45;2;0;"HERE WE GO! 105 Minutes of Commercial-free ROCK Music starts! 8:45-10:30AM & again with Lindsay fr: 3:45-5:30PM! Get your ROCK ON! #Halifax #HRM #HFX #NovaScotia #LIVE105 #RockMusic #HalifaxsBestRock pic.twitter.com/ghXp0sxM6n";;;#Halifax #HRM #HFX #NovaScotia #LIVE105 #RockMusic #HalifaxsBestRock;"985846727071752193";https://twitter.com/Live105HRM/status/985846727071752193
PierreSEH;2018-04-13 19:48;0;0;"A band to discover from Halifax NS #dalivangogh #newcanadianmusic #ROCKMUSIC #SupportLocal #Halifax #novascotia #Canada https:// twitter.com/dalivangogh/st atus/979397705582759938 …";;;#dalivangogh #newcanadianmusic #ROCKMUSIC #SupportLocal #Halifax #novascotia #Canada;"984926429547606016";https://twitter.com/PierreSEH/status/984926429547606016
Live105HRM;2018-04-13 08:48;0;0;"We're now spinning 105 Minutes of Commercial-Free Music here at Live 105 Halifax . It's on 'til 10:30 & again with Lindsay fr: 3:30-5:45PM. HAPPY FRIDAY THE 13TH! ROCK OUT! - Scotty & Ferne #Fridaythe13th #NonStopMusic #CommercialFree #ROCKON pic.twitter.com/6jCKGo6yaT";;;#Fridaythe13th #NonStopMusic #CommercialFree #ROCKON;"984760327752568832";https://twitter.com/Live105HRM/status/984760327752568832
RICK_ROCK_88;2018-04-11 22:36;1;2;"Come to Halifax we will be there to listen to your great music #";;;#;"984243836611387392";https://twitter.com/RICK_ROCK_88/status/984243836611387392
Live105HRM;2018-04-11 08:53;2;1;"Here we goooooo! 105 Minutes of Commercial-Free ROCK ! 8:45-10:30AM with Scotty & Ferne & 3:45-5:30PM with Lindsay! Killin' it! #ROCKMusic #CommercialFree #listen #TuneIn #iHeartRadio #Halifax #HRM #HFX #NovaScotia #Canada pic.twitter.com/xwqXkDRtSy";;;#ROCKMusic #CommercialFree #listen #TuneIn #iHeartRadio #Halifax #HRM #HFX #NovaScotia #Canada;"984036699008364544";https://twitter.com/Live105HRM/status/984036699008364544
Live105HRM;2018-04-10 08:47;3;1;"RIGHT NOW! 105 Minutes of Commercial-Free Music on @Live105HRM ! It's happening again thsi afternoon too from 3:45-5:30PM! Get your rock on! #Halifax #HRM #HFX #NovaScotia #RockMusic #CommercialFree #Music #keepgoingandgoing pic.twitter.com/9YjOZfixo4";;@Live105HRM;#Halifax #HRM #HFX #NovaScotia #RockMusic #CommercialFree #Music #keepgoingandgoing;"983672733870559232";https://twitter.com/Live105HRM/status/983672733870559232
Live105HRM;2018-04-06 08:50;2;0;"We're now into 105 minutes of COMMERCIAL-FREE ROCK ! Tune in 8:45-10:30AM & 3:45-5:30PM weekdays! #Halifax #HRM #HFX #NovaScotia #Canada #LIVE105 #CommercialFree #ROCK #RockMusic #GetIt pic.twitter.com/t0byGtnqLT";;;#Halifax #HRM #HFX #NovaScotia #Canada #LIVE105 #CommercialFree #ROCK #RockMusic #GetIt;"982224080588845060";https://twitter.com/Live105HRM/status/982224080588845060
Live105HRM;2018-04-05 08:53;2;4;"Need a good fill of music ? We're in our 105 minutes of commercial-free ROCK ! From 8:45-10:30AM & again from 3:45-5:30PM! #CommercialFreeMusic #AlltheMusic #Rock #RockonMe #Halifax #HRM #HFX #LIVE105 #NovaScotia #NS #Canada pic.twitter.com/KLjq6Tt1t3";;;#CommercialFreeMusic #AlltheMusic #Rock #RockonMe #Halifax #HRM #HFX #LIVE105 #NovaScotia #NS #Canada;"981862411606085632";https://twitter.com/Live105HRM/status/981862411606085632
Live105HRM;2018-04-04 08:58;2;2;"We're at the beginning of 105 Minutes Commercial-Free Music ! LISTEN weekdays 8:45-10:30AM & 3:45-5:30PM. Get your ROCK fix! #Halifax #HRM #HFX #LIVE105 #NovaScotia #ROCKMusic #ClassicRock #AlternativeRock #AllROCK pic.twitter.com/SM86Ki0JYC";;;#Halifax #HRM #HFX #LIVE105 #NovaScotia #ROCKMusic #ClassicRock #AlternativeRock #AllROCK;"981501331251912704";https://twitter.com/Live105HRM/status/981501331251912704
halifaxbloggers;2018-04-03 12:55;0;2;"Halifax 's Brothers have "found a niche for themselves, nestling their sound between the rock and hip-hop genres", says Trev. His review of their new album, Zebra: https:// halifaxbloggers.ca/hafilax/2018/0 3/album-review-brothers-zebra/ … #music #local #albumreview @HAFILAXtweets @brothershfx pic.twitter.com/ensGz7Blv5";;@HAFILAXtweets @brothershfx;#music #local #albumreview;"981198389755785218";https://twitter.com/halifaxbloggers/status/981198389755785218
Global_NB;2018-04-02 09:45;0;1;"We chat with Halifax actor Geordie Brown about being chosen to star “Jukebox Hero”, an upcoming musical based on the music of classic rock legends Foreigner that critics say is destined for broadway. pic.twitter.com/NuR9bis1tB";;;;"980788266185080832";https://twitter.com/Global_NB/status/980788266185080832
globalhalifax;2018-04-02 07:46;3;6;"We chat with Halifax actor Geordie Brown about being chosen to star “Jukebox Hero”, an upcoming musical based on the music of classic rock legends Foreigner that critics say is destined for broadway. http:// globalnews.ca/halifax/videos/ pic.twitter.com/fri0hg50gu";;;;"980758439394607104";https://twitter.com/globalhalifax/status/980758439394607104
TheBloodyHell1;2018-03-31 14:17;0;1;"Finish all the things that I started. #Thebloodyhellhfx #halifax #punk #punkrock #music #musicnovascotia #rock #rockandroll #canadianmusic #eastcoastmusic #eastcoastloud #horror #horrorrock #halifaxhorrorrock #livemusic #bandphotography #guspubandgrill pic.twitter.com/v5EtFf5zVo";;;#Thebloodyhellhfx #halifax #punk #punkrock #music #musicnovascotia #rock #rockandroll #canadianmusic #eastcoastmusic #eastcoastloud #horror #horrorrock #halifaxhorrorrock #livemusic #bandphotography #guspubandgrill;"980132033736462336";https://twitter.com/TheBloodyHell1/status/980132033736462336
AtlCanCaper;2018-03-30 01:26;1;1;"#EastCoast #NovaScotia #CapeBreton #Halifax #NewBrunswick #Moncton #Fredericton #SaintJohn #PEI #Newfoundland #StJohns #cornerbrook #ROCKMUSIC";;;#EastCoast #NovaScotia #CapeBreton #Halifax #NewBrunswick #Moncton #Fredericton #SaintJohn #PEI #Newfoundland #StJohns #cornerbrook #ROCKMUSIC;"979575501122686976";https://twitter.com/AtlCanCaper/status/979575501122686976
LogManMaritimes;2018-03-30 01:10;1;1;"@CFXUradio @CKDU881FM @CCKC889 @chmaFM @CHSR979 @local1073fm @chmrmunradio @ncracanada #EastCoast #NovaScotia #Halifax #CapeBreton #NewBrunswick #Moncton #Fredericton #SaintJohn #PEI #Newfoundland #StJohns #cornerbrook #ROCKMUSIC";;@CFXUradio @CKDU881FM @CCKC889 @chmaFM @CHSR979 @local1073fm @chmrmunradio @ncracanada;#EastCoast #NovaScotia #Halifax #CapeBreton #NewBrunswick #Moncton #Fredericton #SaintJohn #PEI #Newfoundland #StJohns #cornerbrook #ROCKMUSIC;"979571557851893760";https://twitter.com/LogManMaritimes/status/979571557851893760
AtlCanCaper;2018-03-28 17:47;1;1;"We're sorry for the confusion and hope to have you tuning in! @CFXUradio @CCKC889 @CKDU881FM @chmaFM @CHSR979 @local1073fm @chmrmunradio @ncracanada #EastCoast #NovaScotia #CapeBreton #Halifax #NewBrunswick #Moncton #Fredericton #SaintJohn #Charlottetown #ROCKMUSIC";;@CFXUradio @CCKC889 @CKDU881FM @chmaFM @CHSR979 @local1073fm @chmrmunradio @ncracanada;#EastCoast #NovaScotia #CapeBreton #Halifax #NewBrunswick #Moncton #Fredericton #SaintJohn #Charlottetown #ROCKMUSIC;"979097636321062912";https://twitter.com/AtlCanCaper/status/979097636321062912
LogManMaritimes;2018-03-28 17:37;1;1;"And I hope that you'll tune in to tonight's show! @CFXUradio @CCKC889 @CKDU881FM @chmaFM @CHSR979 @local1073fm @chmrmunradio @ncracanada #EastCoast #NovaScotia #Halifax #CapeBreton #NewBrunswick #Moncton #Fredericton #SaintJohn #Charlottetown #ROCKMUSIC";;@CFXUradio @CCKC889 @CKDU881FM @chmaFM @CHSR979 @local1073fm @chmrmunradio @ncracanada;#EastCoast #NovaScotia #Halifax #CapeBreton #NewBrunswick #Moncton #Fredericton #SaintJohn #Charlottetown #ROCKMUSIC;"979095258725306368";https://twitter.com/LogManMaritimes/status/979095258725306368
SecLineParade;2018-03-28 11:33;0;1;"#halifax #novascotia , This is an important announcement! We will be playing the @CarletonHalifax this Friday! Come enjoy a night of full on #rock music with the Summer Rabbit and The Shakedown Combo! Tell your friends! https://www. facebook.com/events/8857947 98269031/ …";;@CarletonHalifax;#halifax #novascotia #rock;"979003573831905280";https://twitter.com/SecLineParade/status/979003573831905280
Live105HRM;2018-03-28 08:52;0;1;"105 minutes of commercial-free, non-stop rock is ON NOW! LISTEN LIVE http://www. live105.ca weekdays from 8:45-10:30AM & 3:45-5:30PM! #Halifax #HRM #HFX #NovaScotia #LIVE105 #music #alternativerock pic.twitter.com/QdrcOOPgxU";;;#Halifax #HRM #HFX #NovaScotia #LIVE105 #music #alternativerock;"978963120919064576";https://twitter.com/Live105HRM/status/978963120919064576
LogManMaritimes;2018-03-27 23:39;2;0;"#NovaScotia #Halifax #CapeBreton #NewBrunswick #Moncton #Fredericton #SaintJohn #PEI #Charlottetown #ROCKMUSIC";;;#NovaScotia #Halifax #CapeBreton #NewBrunswick #Moncton #Fredericton #SaintJohn #PEI #Charlottetown #ROCKMUSIC;"978823749750411264";https://twitter.com/LogManMaritimes/status/978823749750411264
AtlCanCaper;2018-03-27 23:02;2;1;"#AtlanticCanada #NovaScotia #CapeBreton #Halifax #NewBrunswick #Moncton #SaintJohn #PEI #Charlottetown #ROCKMUSIC";;;#AtlanticCanada #NovaScotia #CapeBreton #Halifax #NewBrunswick #Moncton #SaintJohn #PEI #Charlottetown #ROCKMUSIC;"978814501570121728";https://twitter.com/AtlCanCaper/status/978814501570121728
ryan_idiot_;2018-03-22 10:15;1;4;"From last years Maritime Metal & Hard Rock Festival. (Photo by @rmacrae ) #Punk #PunkRock #Idiot #Generation #PopPunk #GarageRock #Metal #MetalFest #Festival #Summer #WindsorNovaScotia #HardRock #Rock #Music #LiveShow #MaritimeMusic #Blue #Halifax #HFX pic.twitter.com/GF9a5wg4Lm";;@rmacrae;#Punk #PunkRock #Idiot #Generation #PopPunk #GarageRock #Metal #MetalFest #Festival #Summer #WindsorNovaScotia #HardRock #Rock #Music #LiveShow #MaritimeMusic #Blue #Halifax #HFX;"976809685608226816";https://twitter.com/ryan_idiot_/status/976809685608226816
halifaxbloggers;2018-03-19 13:20;0;0;"Halifax got a double dose of retro-soaked rock n’ roll this weekend from @TheSheepdogs & @coffeyandlungs . Trev's review: https:// halifaxbloggers.ca/hafilax/2018/0 3/sheepdogsmar162018/ … #music #livemusic #photos @HAFILAXtweets pic.twitter.com/10FIUy3pja";;@TheSheepdogs @coffeyandlungs @HAFILAXtweets;#music #livemusic #photos;"975768863345463301";https://twitter.com/halifaxbloggers/status/975768863345463301
noisography;2018-03-18 20:52;0;2;"Don't forget to check out our YouTube channel for new videos as well! New playlist added today from Wet Box's album release show, back in February. Tunes from @thefemdoms @fungus . rock and more! . . . #noisography #livemusic #music #Halifax #halifaxns #eastcoast #novascotia #… pic.twitter.com/VQnu6pzti6";;@thefemdoms @fungus;#noisography #livemusic #music #Halifax #halifaxns #eastcoast #novascotia #;"975520440012681216";https://twitter.com/noisography/status/975520440012681216
dazormusic;2018-03-16 22:59;1;5;"Crushing some burgs after a long evening getting the drums dialed in @TheSonicTemple . New material coming your way so stay tuned. #Halifax #AltRock #kraveburger #rock #music pic.twitter.com/NIbqYxyBDX";;@TheSonicTemple;#Halifax #AltRock #kraveburger #rock #music;"974827430606188545";https://twitter.com/dazormusic/status/974827430606188545
ShadowofEverest;2018-03-16 20:19;0;4;"This is rock n’ roll. We’re loud at Radstorm Halifax ! #music #livemusic #halifax #halifaxnoise … https://www. instagram.com/p/BgZvusQhRn6/";;;#music #livemusic #halifax #halifaxnoise;"974787142860750848";https://twitter.com/ShadowofEverest/status/974787142860750848
TheBeaconHx;2018-03-16 07:47;0;0;"Retweeted Orange Box Halifax ( @OrangeBoxHX ): Orange Box Rock School is perfect for those who love music . Fancy... https:// fb.me/1FDg4T40z";;@OrangeBoxHX;;"974597926940012544";https://twitter.com/TheBeaconHx/status/974597926940012544
LogManMaritimes;2018-03-11 22:47;1;0;"@BigDogTruro now sounds kinda like @Live105HRM since it changed their Music Format to Active Rock but not the same Active Rock as Q104 Halifax !";;@BigDogTruro @Live105HRM;;"973012480053186560";https://twitter.com/LogManMaritimes/status/973012480053186560
ThePunkPit;2018-03-10 22:26;0;0;"Pretty broad question here but. Things that are making a come back whats better VINYL or CASSETTES? I see the upsides to both. #vinyl #cassettes #music #WhatDoYouThink #ItsComingBack #rock #punk #PunkRock #OldSchoolComeBacks #Halifax #Dartmouth #questions by #ryan_idiot_";;;#vinyl #cassettes #music #WhatDoYouThink #ItsComingBack #rock #punk #PunkRock #OldSchoolComeBacks #Halifax #Dartmouth #questions #ryan_idiot_;"972659921220259840";https://twitter.com/ThePunkPit/status/972659921220259840
ryan_idiot_;2018-03-10 22:22;3;1;"Pretty broad question here but. Things that are making a come back whats better VINYL or CASSETTES? I see the upsides to both. #vinyl #cassettes #music #WhatDoYouThink #ItsComingBack #rock #punk #PunkRock #OldSchoolComeBacks #Halifax #Dartmouth #questions";;;#vinyl #cassettes #music #WhatDoYouThink #ItsComingBack #rock #punk #PunkRock #OldSchoolComeBacks #Halifax #Dartmouth #questions;"972658903883440129";https://twitter.com/ryan_idiot_/status/972658903883440129
EvanWCraig;2018-03-05 22:53;0;0;"PLEASE come to Halifax (canada). the city would LOVE it! small city but big heart and we love our rock music . contact the metro. make it happen @AliceInChains saw u in 2013 in Edmonton, AMAZING! jerrys god";;@AliceInChains;;"970854823833858048";https://twitter.com/EvanWCraig/status/970854823833858048
clintcoady;2018-03-05 16:00;0;2;"It's #90s rock night in #Halifax AKA, the music I still mostly listen to lol https:// twitter.com/ScotiabankCtr/ status/970671599635623936 …";;;#90s #Halifax;"970750821091758082";https://twitter.com/clintcoady/status/970750821091758082
NewEraProdCo;2018-03-01 18:38;2;8;"Ayeeeeeee Ooooooo! Almost Friday! #thursday #tbt #music #rap #rock #mixer #pop #hiphop #trance #rave #punk #dj #edm #followforfollow #concert #venue #event #promo #entertainment #wanderlust #traveler #studio #followme #halifax #novascotia #canada #ifb #f4f #l4l #like4like #fff pic.twitter.com/lOXvZNMB1g";;;#thursday #tbt #music #rap #rock #mixer #pop #hiphop #trance #rave #punk #dj #edm #followforfollow #concert #venue #event #promo #entertainment #wanderlust #traveler #studio #followme #halifax #novascotia #canada #ifb #f4f #l4l #like4like #fff;"969341235113668610";https://twitter.com/NewEraProdCo/status/969341235113668610
CatLife31751876;2018-03-01 09:50;0;0;"Music from NPR: First Listen: Nap Eyes, 'I'm Bad Now' The Halifax rock band meditates on mortality, limitations and solitude in tight, shimmery guitar riffs. http:// ift.tt/2FfZivd";;;;"969208198266871809";https://twitter.com/CatLife31751876/status/969208198266871809
NewEraProdCo;2018-02-28 18:45;3;5;"Tryin to slide into the weekend early lol #wednesday #rave #dj #edm #music #rap #rock #pop #hiphop #punk #song #trance #trap #mixer #concert #venue #event #entertainment #like4like #humpday #travel #Halifax #canada #followforfollow #wanderlust #ifb #f4f #l4l #follow #followme pic.twitter.com/Zx2jys1krc";;;#wednesday #rave #dj #edm #music #rap #rock #pop #hiphop #punk #song #trance #trap #mixer #concert #venue #event #entertainment #like4like #humpday #travel #Halifax #canada #followforfollow #wanderlust #ifb #f4f #l4l #follow #followme;"968980546712989697";https://twitter.com/NewEraProdCo/status/968980546712989697
NewEraProdCo;2018-02-26 16:17;1;3;"Mixin up Monday #monday #mondaymotivation #music #song #track #rap #rock #pop #hiphop #trance #rave #punk #edm #trap #productions #concert #venue #event #mixer #travel #entertainment #wanderlust #followme #traveler #canada #halifax #ifb #f4f #l4l #MondayMotivations #follow pic.twitter.com/EW2SWSAKsx";;;#monday #mondaymotivation #music #song #track #rap #rock #pop #hiphop #trance #rave #punk #edm #trap #productions #concert #venue #event #mixer #travel #entertainment #wanderlust #followme #traveler #canada #halifax #ifb #f4f #l4l #MondayMotivations #follow;"968218447384580103";https://twitter.com/NewEraProdCo/status/968218447384580103
RockOtherWorlds;2018-02-26 07:57;0;0;"Gothic from Halifax - "Paradise Lost". One of the early photos of the band. Готи з Галіфаксу - "Paradise Lost". Одна з ранніх фото гурту. #Halifax #WestYorkshire #England #UK #music #rock #metal #ParadiseLost #Gothic #history #музика #рок #метал #історія pic.twitter.com/JpqTR1O0M8";;;#Halifax #WestYorkshire #England #UK #music #rock #metal #ParadiseLost #Gothic #history # # # #;"968092776469540864";https://twitter.com/RockOtherWorlds/status/968092776469540864
NewEraProdCo;2018-02-24 22:27;2;9;"Stuck in the zone on a Saturday night #saturday #weekendvibes #saturdaynight #dj #edm #music #rap #rock #pop #hiphop #trance #mixer #concert #venue #event #entertainment #nightlife #production #sports #halifax #novascotia #canada #wanderlust #traveler #ifb #f4f #l4l #follow pic.twitter.com/b3bi06hJMn";;;#saturday #weekendvibes #saturdaynight #dj #edm #music #rap #rock #pop #hiphop #trance #mixer #concert #venue #event #entertainment #nightlife #production #sports #halifax #novascotia #canada #wanderlust #traveler #ifb #f4f #l4l #follow;"967586861895114753";https://twitter.com/NewEraProdCo/status/967586861895114753
sue_comeau;2018-02-24 20:21;1;1;"Wow! #Halifax has some talented students! Great time here @hrsbmusic #winterlude #music rocks pic.twitter.com/BZjk05ni19";;@hrsbmusic;#Halifax #winterlude #music;"967555108522287104";https://twitter.com/sue_comeau/status/967555108522287104
halifaxnoise;2018-02-24 13:17;0;0;"TONIGHT. GUS’. $8 From @uncleflood — Playing w/ @swtbbt tonight @guspubandgrill with @macneil_alex and @natalielynnmusic . . #Livemusic#guspub#halifax #halifaxmusic#halifaxnoise#rock #rockmusic #supportlivemusic#supportlocalmusic#swtbbt http:// ift.tt/2GGRboA pic.twitter.com/aiOfMTgtqR";;@uncleflood @swtbbt @guspubandgrill @macneil_alex @natalielynnmusic;#Livemusic #guspub #halifax #halifaxmusic #halifaxnoise #rock #rockmusic #supportlivemusic #supportlocalmusic #swtbbt;"967448300399087616";https://twitter.com/halifaxnoise/status/967448300399087616
NewEraProdCo;2018-02-23 23:20;1;10;"Missing these lights....this tho Singapore #fridayfeeling #friday #fbf #rave #dj #edm #music #rap #rock #pop #hiphop #trance #sports #wanderlust #globetrotter #singapore #weekend #concert #venue #event #entertainment #halifax #travel #traveler #fff #wanderlust #ifb #f4f #l4l pic.twitter.com/zFXv9LyY40";;;#fridayfeeling #friday #fbf #rave #dj #edm #music #rap #rock #pop #hiphop #trance #sports #wanderlust #globetrotter #singapore #weekend #concert #venue #event #entertainment #halifax #travel #traveler #fff #wanderlust #ifb #f4f #l4l;"967237850335981569";https://twitter.com/NewEraProdCo/status/967237850335981569
TheSummerRabbit;2018-02-23 19:55;1;1;"Playing @GusPub with west.ave and theothertenants next month, woo! #halifax #local #music #rock https://www. instagram.com/p/BfjvLtTA9E3/";;@GusPub;#halifax #local #music #rock;"967186130935234561";https://twitter.com/TheSummerRabbit/status/967186130935234561
intothenightHFX;2018-02-22 14:57;0;0;"@hfxnovascotia @halifaxnoise #livemusic #musicfestival #Halifax #NovaScotia #halifaxevents #punkrock #beer #music #ROCKMUSIC";;@hfxnovascotia @halifaxnoise;#livemusic #musicfestival #Halifax #NovaScotia #halifaxevents #punkrock #beer #music #ROCKMUSIC;"966748865465593857";https://twitter.com/intothenightHFX/status/966748865465593857
NewEraProdCo;2018-02-22 11:12;1;10;"Big boardin on a Thursday #thursday #tbt #music #song #rap #rock #rnb #pop #hiphop #trance #rave #punk #dj #edm #trap #concert #venue #event #promo #entertainment #wanderlust #traveler #studio #followme #mixer #halifax #ifb #f4f #l4l #follo4follo #folloMe #ThursdayThoughts pic.twitter.com/5QNiplHPBY";;;#thursday #tbt #music #song #rap #rock #rnb #pop #hiphop #trance #rave #punk #dj #edm #trap #concert #venue #event #promo #entertainment #wanderlust #traveler #studio #followme #mixer #halifax #ifb #f4f #l4l #follo4follo #folloMe #ThursdayThoughts;"966692265816182784";https://twitter.com/NewEraProdCo/status/966692265816182784
AtlCanCaper;2018-02-21 22:56;1;1;"@BigDogTruro has flipped to an Active Rock Music Format and is playing Active Rock Music as of Monday kinda like Q104 Halifax ! #Radio #NovaScotia #Halifax";;@BigDogTruro;#Radio #NovaScotia #Halifax;"966506982168346625";https://twitter.com/AtlCanCaper/status/966506982168346625
LogManMaritimes;2018-02-21 22:55;1;0;"As of Monday @BigDogTruro has flipped to an Active Rock Music Format and is now playing Active Rock Music just like Q104 Halifax ! #NovaScotia #Halifax";;@BigDogTruro;#NovaScotia #Halifax;"966506781471117312";https://twitter.com/LogManMaritimes/status/966506781471117312
JosieHoChiu;2018-02-21 10:16;1;4;"Thank you @Live105HRM and @AmandaLogan for the interview , you guys rock !!! Hope you guys like my music !!! #Halifax #rock pic.twitter.com/X2VBJRhpgG";;@Live105HRM @AmandaLogan;#Halifax #rock;"966315663110299648";https://twitter.com/JosieHoChiu/status/966315663110299648
