username;date;retweets;favorites;text;geo;mentions;hashtags;id;permalink
tawni06;2017-10-30 20:00;0;0;"#halifax #waterfront #streetart @Halifax Harbour Waterfront https://www. instagram.com/p/Ba48to2lcBsC 99RPChtHA0p8j28-DuyLLkoV180/ …";;@Halifax;#halifax #waterfront #streetart;"925135362753728513";https://twitter.com/tawni06/status/925135362753728513
everywheredave;2017-10-30 18:25;1;0;"A game changer! Jump In — Check out Anika’s Pilot Project for Halifax Harbour ! #HireMeHalifax @HfxPartnership https:// blogs.dal.ca/sustainability news/2017/08/28/jump-in/ …";;@HfxPartnership;#HireMeHalifax;"925111531347509248";https://twitter.com/everywheredave/status/925111531347509248
halifaxnoise;2017-10-30 16:49;1;9;"from @jan_lapierre — "Secret" island surf, right in the middle of Halifax Harbour . Can you spot me down there? #vi … http:// ift.tt/2yYC5rH pic.twitter.com/0hDTlXPW25";;@jan_lapierre;#vi;"925087395627880448";https://twitter.com/halifaxnoise/status/925087395627880448
StrangeAdvDart;2017-10-29 14:41;0;0;"young Gromit and Halifax harbour #comicshopdogs https://www. instagram.com/p/Ba1zZVVjPp9/";;;#comicshopdogs;"924692666918432770";https://twitter.com/StrangeAdvDart/status/924692666918432770
supdudeyoga;2017-10-29 09:17;0;1;"Halifax harbour low tide no wind what is your report . Commented by Lance Moore at Oct 29, 9:13 AM https:// itunes.apple.com/us/app/upwells urf/id1114354401?ls=1&mt=8@haligonia@jcurry … pic.twitter.com/jCcMh4eBzt";;@haligonia @jcurry;;"924611051886432257";https://twitter.com/supdudeyoga/status/924611051886432257
freebigcommerce;2017-10-29 09:17;0;0;"Halifax harbour low tide no wind what is your report . Commented by Lance Moore at Oct 29, 9:13 AM https:// itunes.apple.com/us/app/upwells urf/id1114354401?ls=1&mt=8@haligonia@jcurry … pic.twitter.com/Uefa3m3Ygv";;@haligonia @jcurry;;"924611051773100032";https://twitter.com/freebigcommerce/status/924611051773100032
upwellsurf;2017-10-29 09:17;0;0;"Halifax harbour low tide no wind what is your report . Commented by Lance Moore at Oct 29, 9:13 AM https:// itunes.apple.com/us/app/upwells urf/id1114354401?ls=1&mt=8@haligonia@jcurry … pic.twitter.com/rIpQEd9Am5";;@haligonia @jcurry;;"924611050443608065";https://twitter.com/upwellsurf/status/924611050443608065
MS_Wellness;2017-10-29 00:25;0;0;"My harbour walk this morning. #halifax @Halifax Harbour Waterfront https://www. instagram.com/p/Ba0RcelAvqL/";;@Halifax;#halifax;"924477268050759680";https://twitter.com/MS_Wellness/status/924477268050759680
MS_Wellness;2017-10-29 00:21;0;0;"This is the original shot before I zoomed. #halifax @Halifax Harbour Waterfront https://www. instagram.com/p/Ba0RATiAbTj/";;@Halifax;#halifax;"924476307177656320";https://twitter.com/MS_Wellness/status/924476307177656320
MS_Wellness;2017-10-29 00:19;0;0;"Everyone was enjoying the sunshine today. #halifax #notanosprey @Halifax Harbour Waterfront https://www. instagram.com/p/Ba0QtWTAz6c/";;@Halifax;#halifax #notanosprey;"924475642694926336";https://twitter.com/MS_Wellness/status/924475642694926336
Ladyexpat;2017-10-28 22:07;0;0;"George’s Island in the Halifax Harbour . #halifax #halifaxharbour #novascotia #canada #weekend @… https://www. instagram.com/p/Ba0BmiOFo4i/";;@;#halifax #halifaxharbour #novascotia #canada #weekend;"924442421127081984";https://twitter.com/Ladyexpat/status/924442421127081984
vautren;2017-10-28 16:31;0;1;"On the Harbour Hopper!! @Halifax Harbour Waterfront https://www. instagram.com/p/BazbOB6jJEh/";;@Halifax;;"924358022419189760";https://twitter.com/vautren/status/924358022419189760
projetwizvox;2017-10-28 15:22;0;0;"Farr 30 and J/24 classes racing in the Halifax Harbour October 22nd, 2017 https:// youtu.be/eKOPVOcc_8M pic.twitter.com/08aYZF8GF6";;;;"924340586861039617";https://twitter.com/projetwizvox/status/924340586861039617
BirdHouseMusic;2017-10-28 11:01;1;1;"Man plunges into Halifax Harbour to rescue drowning bird http:// bit.ly/2z9jmwM pic.twitter.com/xCWW03xT9M";;;;"924274998977609729";https://twitter.com/BirdHouseMusic/status/924274998977609729
TwitCoast;2017-10-28 06:00;0;1;"Would you swim in Halifax Harbour ? Hillary Windsor has. http:// bit.ly/2kSis1e #longreads #fromthearchives pic.twitter.com/mfLAn69wOh";;;#longreads #fromthearchives;"924199300816662529";https://twitter.com/TwitCoast/status/924199300816662529
nswebcams;2017-10-27 21:53;6;8;"Tonight's sunset over the #HalifaxHarbour ! https://www. novascotiawebcams.com/en/webcams/mac donald-bridge/ … pic.twitter.com/rUPQSg5eQC";;;#HalifaxHarbour;"924076666124754946";https://twitter.com/nswebcams/status/924076666124754946
mapendo_samuel;2017-10-27 21:39;0;0;"#halifax @Halifax Harbour Waterfront https://www. instagram.com/p/BaxZn84nswa/";;@Halifax;#halifax;"924073049179205634";https://twitter.com/mapendo_samuel/status/924073049179205634
GabrieleRoy;2017-10-27 18:41;0;0;"Halloween vibes @Halifax Harbour Waterfront https://www. instagram.com/p/BaxFPbnF-RP/";;@Halifax;;"924028219627655170";https://twitter.com/GabrieleRoy/status/924028219627655170
teree_nola;2017-10-27 18:14;0;0;"Quick ferry ride across Halifax Harbour to Dartmouth @Dartmouth, Nova Scotia https://www. instagram.com/p/BaxCLuVDTTU/";;@Dartmouth;;"924021499157188609";https://twitter.com/teree_nola/status/924021499157188609
ericmiller191;2017-10-27 17:50;2;3;"#Halifax Harbour is big and beautiful. pic.twitter.com/7PNnVhRILZ – bei Halifax Harbour";;;#Halifax;"924015561364987904";https://twitter.com/ericmiller191/status/924015561364987904
BYLocalDart;2017-10-27 15:46;5;12;"Happy Friday Beautiful! #dartmouth from the #otherside #halifax #harbour #friday #tgif pic.twitter.com/QdCZs6dF8P";;;#dartmouth #otherside #halifax #harbour #friday #tgif;"923984206182715392";https://twitter.com/BYLocalDart/status/923984206182715392
srbradley33;2017-10-27 11:28;0;3;"Amazing shot of #Halifax Harbour! https:// twitter.com/portofhalifax/ status/923918330012069890 …";;;#Halifax;"923919401304383488";https://twitter.com/srbradley33/status/923919401304383488
NakedMeeple;2017-10-27 09:29;0;1;"It’s gorgeous. Old QC, Halifax harbour , old Montreal, and Kingston.";;;;"923889435594207239";https://twitter.com/NakedMeeple/status/923889435594207239
PaulBethel1;2017-10-27 09:21;0;2;"The last 4 mornings have been spectacular. 4 shades of #Halifax harbour Fall is the new summer. pic.twitter.com/lWFztcLQYl";;;#Halifax;"923887333631504384";https://twitter.com/PaulBethel1/status/923887333631504384
CanadianFishn;2017-10-27 09:17;0;0;"ParksCanada: Curious about the fort in the Halifax Harbour ? That’s Georges Island NHS! It’s part of the same defen… https:// twitter.com/i/web/status/9 23885825246597121 …";;;;"923886288369016832";https://twitter.com/CanadianFishn/status/923886288369016832
ParksCanada;2017-10-27 09:15;11;37;"Curious about the fort in the Halifax Harbour ? That’s Georges Island NHS! It’s part of the same defence complex as the Halifax Citadel NHS! pic.twitter.com/4De4HtzDOP";;;;"923885825246597121";https://twitter.com/ParksCanada/status/923885825246597121
CalgaryRealE;2017-10-27 03:57;0;0;"#RealEstate New Dartmouth trail to Halifax Harbour lookout opens briefly for dedication ceremony http:// ift.tt/2i8sI0W pic.twitter.com/ynWtBvmbJd";;;#RealEstate;"923805807409582080";https://twitter.com/CalgaryRealE/status/923805807409582080
HalifaxBlogs2;2017-10-27 01:05;0;0;"New Dartmouth trail to Halifax Harbour lookout opens briefly for dedication ceremony #Halifax #bhivecan http:// dld.bz/gqjNs";;;#Halifax #bhivecan;"923762567469780993";https://twitter.com/HalifaxBlogs2/status/923762567469780993
BeeHalifax;2017-10-27 00:33;0;0;"New Dartmouth trail to Halifax Harbour lookout opens briefly for dedication ceremony #Halifax #bhivelabs http:// dld.bz/gqjNs";;;#Halifax #bhivelabs;"923754457204166656";https://twitter.com/BeeHalifax/status/923754457204166656
feedingjoy;2017-10-26 22:16;0;1;"#Happiness : Man plunges into Halifax Harbour to rescue drowning bird https:// buff.ly/2yIj52H";;;#Happiness;"923719898693586944";https://twitter.com/feedingjoy/status/923719898693586944
HalifaxNSNews;2017-10-26 21:36;2;4;"New Dartmouth trail to Halifax Harbour lookout opens briefly for dedication ceremony - Globalnews.ca - https:// globalnews.ca/news/3827538/n ew-dartmouth-trail-to-halifax-harbour-lookout-opens-briefly-for-dedication-ceremony/ …";;;;"923709840949514240";https://twitter.com/HalifaxNSNews/status/923709840949514240
POLSEdmonton;2017-10-26 21:21;0;0;"New Dartmouth trail to Halifax Harbour lookout opens briefly for dedication ceremony: The company that owns the… http:// dlvr.it/PxnQQK pic.twitter.com/FDLSisZN2R";;;;"923706085835284483";https://twitter.com/POLSEdmonton/status/923706085835284483
PakistanNewsCA;2017-10-26 21:19;0;0;"#Pakistan #News #world #headline #CNN New Dartmouth trail to Halifax Harbour lookout opens briefly for dedicati... http:// ow.ly/dJDv50ePZ4I";;;#Pakistan #News #world #headline #CNN;"923705572989419521";https://twitter.com/PakistanNewsCA/status/923705572989419521
70hr_weekcanuck;2017-10-26 20:36;0;0;"@acoyne FYI Your bio is a little stale. Perhaps a "pitch slopping shipwright in Halifax harbour waiting on a good breeze"?";;@acoyne;;"923694795486240768";https://twitter.com/70hr_weekcanuck/status/923694795486240768
MRRollerDerby;2017-10-26 18:00;0;2;"#TBT Sham RockHer & Burn were SO READY to play defense during a Halifax Harbour Grudges' power jam! (Photo @RicLaf ) #MuddyRiverRollers pic.twitter.com/IIDIkBipfY";;@RicLaf;#TBT #MuddyRiverRollers;"923655666132234240";https://twitter.com/MRRollerDerby/status/923655666132234240
halifaxnoise;2017-10-26 17:48;4;8;"Shannon Park trail, Halifax Harbour lookout planned to open this fall https:// globalnews.ca/news/3410859/s hannon-park-trail-halifax-harbour-lookout-planned-to-open-this-fall/ …";;;;"923652639774183425";https://twitter.com/halifaxnoise/status/923652639774183425
paulalangille;2017-10-26 16:36;1;2;"New price! Wowzers! Gorgeous home with so much character, #Halifax harbour views and walk to Dockyard, Shipyard! http://www. youronlineagents.com/paulalangille/ viewlisting.php?id=18481586&board=52 …";;;#Halifax;"923634567948460034";https://twitter.com/paulalangille/status/923634567948460034
CCGAtlantic;2017-10-26 15:48;1;6;"#CCGSHIP EDWARD CORNWALLIS departing Halifax Harbour . 26-Oct-17. Photos by: Clarence Hemeon. @CCG_GCC Via https://www. facebook.com/groups/Shipspo ttingCanadaCCG/ … pic.twitter.com/z9zJ9PEMQr";;@CCG_GCC;#CCGSHIP;"923622417309863938";https://twitter.com/CCGAtlantic/status/923622417309863938
SteveCSilva;2017-10-26 15:30;9;4;"The view from #NorrisPoint on the #Canada150Trail . #Dartmouth #Halifax #HalifaxHarbour #MacKayBridge pic.twitter.com/TwNoDoIQoy";;;#NorrisPoint #Canada150Trail #Dartmouth #Halifax #HalifaxHarbour #MacKayBridge;"923617945116389376";https://twitter.com/SteveCSilva/status/923617945116389376
drdedalus;2017-10-26 14:25;0;0;"Current status, in lovely Halifax, NS! @Halifax Harbour Waterfront https://www. instagram.com/p/BauDBM3hew3P N8MwVNlDVfCG4DfYZk3FuTwAxY0/ …";;@Halifax;;"923601495928356864";https://twitter.com/drdedalus/status/923601495928356864
that_rachael;2017-10-26 13:46;0;1;"Love the way Maud Lewis creatively displayed in Halifax #discoverhalifax @Halifax Harbour … https://www. instagram.com/p/BarzOKhAEs5/";;@Halifax;#discoverhalifax;"923591795250008065";https://twitter.com/that_rachael/status/923591795250008065
chautauquaatl;2017-10-26 13:37;1;1;"How cool is this!! Students @SJAMschool involved in creating a mural to commemorate the Halifax Harbour Explosion. https:// twitter.com/Ms_Thornhill/s tatus/923545404679114754 …";;@SJAMschool;;"923589431747072000";https://twitter.com/chautauquaatl/status/923589431747072000
leeblybrown;2017-10-26 13:10;2;4;"Never gets old seeing the ships in the Halifax Harbour @My_Waterfront @HalifaxSeaport @hfxnovascotia pic.twitter.com/jxA5oHYodq";;@My_Waterfront @HalifaxSeaport @hfxnovascotia;;"923582742650150912";https://twitter.com/leeblybrown/status/923582742650150912
beakphoto;2017-10-26 12:54;0;2;"Leaving Fairview Cove, the container ship Malleco sailing out of #Halifax Harbour for Egypt with help of tug Atlantic Oak. pic.twitter.com/qKs7JGUclF";;;#Halifax;"923578561717526529";https://twitter.com/beakphoto/status/923578561717526529
SeasideFM;2017-10-26 07:43;0;1;"Sea State update for Halifax Harbour due to the southeasterlies https:// twitter.com/My_Waterfront/ status/923499908803514368 …";;;;"923500402846453760";https://twitter.com/SeasideFM/status/923500402846453760
petermorin123;2017-10-25 21:33;0;2;"CPF and her helo on deck in the Halifax harbour @RCN_MRC @RCN_MARLANT pic.twitter.com/jRneu2gvBY";;@RCN_MRC @RCN_MARLANT;;"923346879110418432";https://twitter.com/petermorin123/status/923346879110418432
plgrant_ns;2017-10-25 15:46;0;0;"Queen's Marque Oct 25, 2017 @Halifax Harbour Waterfront https://www. instagram.com/p/BarnqYXHm7D/";;@Halifax;;"923259496511700993";https://twitter.com/plgrant_ns/status/923259496511700993
garry_isaacs;2017-10-25 15:36;0;1;"Power Beats on listening to my favourite playlist running the boardwalks Halifax harbour pic.twitter.com/6eXWPkCwOb";;;;"923257056030789632";https://twitter.com/garry_isaacs/status/923257056030789632
BuyHalifaxHomes;2017-10-25 11:21;0;2;"Gorgeous views of the Halifax Harbour can be yours at 522-45 Vimy Ave in Hfx. http:// goem.me/1YVP For info visit http://www. thepikegroup.ca pic.twitter.com/xVRvpIUwPR";;;;"923192701448699904";https://twitter.com/BuyHalifaxHomes/status/923192701448699904
HomeinHalifax;2017-10-25 11:21;0;0;"Gorgeous views of the Halifax Harbour can be yours at 522-45 Vimy Ave in Hfx. http:// goem.me/1YVO For info visit http://www. thepikegroup.ca pic.twitter.com/qaPHASDM6i";;;;"923192695824240640";https://twitter.com/HomeinHalifax/status/923192695824240640
Moanique1967;2017-10-25 11:21;0;0;"Gorgeous views of the Halifax Harbour can be yours at 522-45 Vimy Ave in Hfx. http:// goem.me/1YVN For info visit http://www. thepikegroup.ca pic.twitter.com/vfJNl6IeDw";;;;"923192689495040000";https://twitter.com/Moanique1967/status/923192689495040000
slack_harrison;2017-10-25 11:21;0;0;"Gorgeous views of the Halifax Harbour can be yours at 522-45 Vimy Ave in Hfx. http:// goem.me/1YVM For info visit http://www. thepikegroup.ca pic.twitter.com/wRMS9DVfLV";;;;"923192682641526789";https://twitter.com/slack_harrison/status/923192682641526789
CCGAtlantic;2017-10-25 10:09;2;3;"#CCGSHIP SIR WILFRED GRENFELL entering Halifax Harbour , 25-Oct-17. Photos by: Clarence Hemeon. @CCG_GCC Via https://www. facebook.com/groups/Shipspo ttingCanadaCCG/ … pic.twitter.com/LlLpHLTpc4";;@CCG_GCC;#CCGSHIP;"923174681007575040";https://twitter.com/CCGAtlantic/status/923174681007575040
khwturner;2017-10-25 08:23;1;7;"Halifax harbour waking up! @infomorning @imagesofcanada cangeo@natgeo@visithalifax@halifaxtourism@tourismns pic.twitter.com/flYPOhYoL9";;@infomorning @imagesofcanada @natgeo @visithalifax @halifaxtourism @tourismns;;"923147988272386048";https://twitter.com/khwturner/status/923147988272386048
MKLamers;2017-10-24 18:40;0;0;"Just posted a photo @Halifax Harbour Waterfront https://www. instagram.com/p/BapWx_yBV-B/";;@Halifax;;"922940891572121601";https://twitter.com/MKLamers/status/922940891572121601
fryed;2017-10-24 18:37;0;2;"Evening in Halifax Harbour . http:// ift.tt/2gAroTS pic.twitter.com/Mbp3qSvzot";;;;"922940208848437248";https://twitter.com/fryed/status/922940208848437248
jcbartlett14;2017-10-24 14:41;0;0;"Still waiting for action on my brilliant idea: A marine 'drive-thru' in Halifax Harbour for recreational boaters. @TimHortons #hoistthesales";;@TimHortons;#hoistthesales;"922880801167040512";https://twitter.com/jcbartlett14/status/922880801167040512
NS_Naturalist86;2017-10-24 08:08;1;0;"The #halifaxharbour #seabridge at #sunrise . #halifax #urbandesign #explorens #novascotia @… https://www. instagram.com/p/BaoOeyMHZBH/";;@;#halifaxharbour #seabridge #sunrise #halifax #urbandesign #explorens #novascotia;"922781903941287936";https://twitter.com/NS_Naturalist86/status/922781903941287936
MeghanScott;2017-10-23 21:25;1;4;"Honey of a day on the #halifaxharbour #grateful #hrmferry #topdeck #thatviewthough http:// ift.tt/2iuhCHf pic.twitter.com/jtetTqrusg";;;#halifaxharbour #grateful #hrmferry #topdeck #thatviewthough;"922620129472602112";https://twitter.com/MeghanScott/status/922620129472602112
CompositionCKDU;2017-10-23 19:08;0;0;"if you change that to halifax harbour ferry, im there";;;;"922585540314128384";https://twitter.com/CompositionCKDU/status/922585540314128384
edgas;2017-10-23 17:19;0;6;"Halifax harbour pic.twitter.com/7evlaAcaw6";;;;"922558110979432448";https://twitter.com/edgas/status/922558110979432448
WestinNS;2017-10-23 12:38;0;0;"Enjoy beautiful views of the Halifax harbour from your room @WestinNS . http:// bit.ly/2nSESzk pic.twitter.com/9MQ8S3ZAkx";;@WestinNS;;"922487477989990400";https://twitter.com/WestinNS/status/922487477989990400
EricHolmez;2017-10-23 10:29;0;0;"boat party? boat party. @Halifax Harbour Waterfront https://www. instagram.com/p/Bal5x3Qg6aK/";;@Halifax;;"922454910733574144";https://twitter.com/EricHolmez/status/922454910733574144
northern_norton;2017-10-23 10:25;3;4;"Rapid City Planner computer model @DRDC_RDDC recreates 1917 Halifax harbour explosion, if occurred today. #CDNdrr pic.twitter.com/fX4XLU8zLt";;@DRDC_RDDC;#CDNdrr;"922453946781880320";https://twitter.com/northern_norton/status/922453946781880320
alexskaplan;2017-10-23 09:56;3;8;"Lessons in resilience. The 100th anniversary of the Halifax Harbour Explosion #CDNdrr pic.twitter.com/ApnE5oGc6D";;;#CDNdrr;"922446731782119425";https://twitter.com/alexskaplan/status/922446731782119425
HolisticEPR;2017-10-23 09:51;1;0;"Eighth Annual National Roundtable on DRR, Dr. Alan Ruffman, Commemorating 1917 Halifax Harbour Explosion, Reminder to us all pic.twitter.com/4J4eL7tE1f";;;;"922445429576527873";https://twitter.com/HolisticEPR/status/922445429576527873
GDDillon;2017-10-23 09:47;0;0;"Man plunges into Halifax Harbour to rescue drowning bird http:// fb.me/2sPDUil4m";;;;"922444474189524994";https://twitter.com/GDDillon/status/922444474189524994
AndyAnimalLover;2017-10-23 09:04;0;0;"Man plunges into Halifax Harbour to rescue drowning bird http://www. cbc.ca/1.4363154 . A TRUE Hero";;;;"922433512128442368";https://twitter.com/AndyAnimalLover/status/922433512128442368
davidpatecbc;2017-10-23 07:45;1;1;"Early morning cruise ship arrival in #Halifax Harbour https://www. instagram.com/p/BalnESXAq8A/";;;#Halifax;"922413750833033216";https://twitter.com/davidpatecbc/status/922413750833033216
AVRNEWS;2017-10-23 06:48;0;0;"A man saw a bird stuck in fishing line in the Halifax Harbour , so he jumped in, untangled it – and it has since... http:// fb.me/49NWJsdnJ";;;;"922399379557900288";https://twitter.com/AVRNEWS/status/922399379557900288
UnkelFred;2017-10-22 21:15;5;3;"Yeah,... uh, we could always put the Statue of Liberty in Halifax Harbour , if the U.S. isn't going to be using it anymore.";;;;"922255229302771712";https://twitter.com/UnkelFred/status/922255229302771712
ElaineNiddery;2017-10-22 19:47;0;0;"Man plunges into Halifax Harbour to rescue drowning bird http://www. cbc.ca/1.4363154";;;;"922232881199624197";https://twitter.com/ElaineNiddery/status/922232881199624197
davidpatecbc;2017-10-22 09:37;0;2;"A beautiful day for sailing in #Halifax Harbour https://www. instagram.com/p/BajPA97A0vI/";;;#Halifax;"922079389642297344";https://twitter.com/davidpatecbc/status/922079389642297344
CatCountryTruro;2017-10-22 07:17;0;0;"Man dives into #Halifax Harbour to save tangled seagull http:// bit.ly/2zGCpLG";;;#Halifax;"922044114664902657";https://twitter.com/CatCountryTruro/status/922044114664902657
BigDogTruro;2017-10-22 07:17;0;0;"Man dives into #Halifax Harbour to save tangled seagull http:// bit.ly/2zFHN1O";;;#Halifax;"922044107416944640";https://twitter.com/BigDogTruro/status/922044107416944640
CBCOttawa;2017-10-22 01:00;5;27;"Man plunges into Halifax Harbour to rescue drowning bird http://www. cbc.ca/1.4363154 pic.twitter.com/fwe3RFesaw";;;;"921949231241408512";https://twitter.com/CBCOttawa/status/921949231241408512
JolenePattison;2017-10-21 22:12;0;2;"Man plunges into Halifax Harbour to rescue drowning bird http://www. cbc.ca/1.4363154";;;;"921907195951841280";https://twitter.com/JolenePattison/status/921907195951841280
CarolyneA;2017-10-21 20:39;0;1;"Man leaps into Halifax Harbour to save seagull in distress http:// ctv.news/GtjM0lN";;;;"921883677080064001";https://twitter.com/CarolyneA/status/921883677080064001
oopsabird;2017-10-21 18:36;0;0;"u kno work was wild when u come home with half your body covered in salt water.... the left half. thank u Halifax Harbour , so much....";;;;"921852650932580352";https://twitter.com/oopsabird/status/921852650932580352
OccuWorld;2017-10-21 18:18;1;1;"Man plunges into Halifax Harbour to rescue drowning bird http://www. occuworld.org/news/3718836";;;;"921848244988272640";https://twitter.com/OccuWorld/status/921848244988272640
prntpsts;2017-10-21 17:11;0;0;"Man plunges into Halifax Harbour to rescue drowning bird - http:// ift.tt/2itvktN pic.twitter.com/gT9ubl5HIm";;;;"921831275723460608";https://twitter.com/prntpsts/status/921831275723460608
janeychill;2017-10-21 16:42;0;0;"Man plunges into Halifax Harbour to rescue drowning bird http:// ift.tt/2itvktN";;;;"921823983334559746";https://twitter.com/janeychill/status/921823983334559746
RadioMy;2017-10-21 16:37;0;0;"Man plunges into Halifax Harbour to rescue drowning bird via /r/UpliftingNews http:// ift.tt/2itvktN pic.twitter.com/VdheoJiSt0";;;;"921822842517360640";https://twitter.com/RadioMy/status/921822842517360640
BestVisionboard;2017-10-21 16:02;0;0;"Man plunges into Halifax Harbour to rescue drowning bird via /r/UpliftingNews http:// ift.tt/2itvktN pic.twitter.com/MqbeoVHLUy";;;;"921813920549101568";https://twitter.com/BestVisionboard/status/921813920549101568
HarrisonCantre3;2017-10-21 15:57;0;0;"Man plunges into Halifax Harbour to rescue drowning bird http:// ift.tt/2hVJiky";;;;"921812654456483840";https://twitter.com/HarrisonCantre3/status/921812654456483840
ScoopSquid;2017-10-21 15:42;0;1;"http:// ift.tt/2xX9dmM Man plunges into Halifax Harbour to rescue drowning bird #news";;;#news;"921808861157384193";https://twitter.com/ScoopSquid/status/921808861157384193
thepainterflynn;2017-10-21 15:35;2;1;"Today in 1910 HMS Niobe arrives in Halifax Harbour to become the first ship of the Royal Canadian Navy. pic.twitter.com/dqMmEer5a4";;;;"921807067333234689";https://twitter.com/thepainterflynn/status/921807067333234689
PhilcamLoren;2017-10-21 15:34;0;0;"#Lookingfornews #World #Reddit #Livebroadcasting Man plunges into Halifax Harbour to rescue drowning bird r/Uplift… https://www. reddit.com/r/UpliftingNew s/comments/77um7h/man_plunges_into_halifax_harbour_to_rescue/?utm_source=ifttt …";;;#Lookingfornews #World #Reddit #Livebroadcasting;"921806886806138885";https://twitter.com/PhilcamLoren/status/921806886806138885
upbeatstories;2017-10-21 15:33;0;0;"Man plunges into Halifax Harbour to rescue drowning bird via /r/UpliftingNews http:// ift.tt/2itvktN pic.twitter.com/CWOfn1b9Mw";;;;"921806650557849600";https://twitter.com/upbeatstories/status/921806650557849600
HappyJoyJoyCom;2017-10-21 15:32;0;0;"Man plunges into Halifax Harbour to rescue drowning bird http:// happyjoyjoy.com/2017/10/21/man -plunges-into-halifax-harbour-to-rescue-drowning-bird/ … pic.twitter.com/AN1kBcwC0v";;;;"921806466205536261";https://twitter.com/HappyJoyJoyCom/status/921806466205536261
shush7777;2017-10-21 15:20;0;1;"Man plunges into Halifax Harbour to rescue drowning bird http://www. cbc.ca/1.4363154";;;;"921803316308398080";https://twitter.com/shush7777/status/921803316308398080
brentoliver;2017-10-21 15:12;0;0;"Anna Whelan! Fearless GM of creativecity.ca. She’s the best. @Halifax Harbour Waterfront https://www. instagram.com/p/BahQlbdDwAy/";;@Halifax;;"921801374177914880";https://twitter.com/brentoliver/status/921801374177914880
feedingjoy;2017-10-21 14:43;0;0;"#Happiness : Man plunges into Halifax Harbour to rescue drowning bird http:// bit.ly/2yFVQV2 #inspiring";;;#Happiness #inspiring;"921794072406355970";https://twitter.com/feedingjoy/status/921794072406355970
sulsitodisimone;2017-10-21 14:43;0;0;"October 21 1910 HMS Niobe arrives in Halifax Harbour to become the first ship of the Royal Canadian Navy http://www. sulsitodisimone.altervista.org/almanac.html";;;;"921793958648299520";https://twitter.com/sulsitodisimone/status/921793958648299520
HppyNws;2017-10-21 14:38;0;0;"Man plunges into Halifax Harbour to rescue drowning bird http:// bit.ly/2zrKEue";;;;"921792733626404864";https://twitter.com/HppyNws/status/921792733626404864
aftente393;2017-10-21 14:25;0;0;"Man plunges into Halifax Harbour to rescue drowning bird http:// ift.tt/2hVJiky";;;;"921789480243224578";https://twitter.com/aftente393/status/921789480243224578
trendingshed;2017-10-21 14:24;0;0;"Man plunges into Halifax Harbour to rescue drowning bird http:// ift.tt/2xX9dmM";;;;"921789352719605760";https://twitter.com/trendingshed/status/921789352719605760
news_shed;2017-10-21 14:24;0;0;"Man plunges into Halifax Harbour to rescue drowning bird http:// ift.tt/2xX9dmM";;;;"921789341487259648";https://twitter.com/news_shed/status/921789341487259648
PositivityIsFun;2017-10-21 14:24;0;0;"Man plunges into Halifax Harbour to rescue drowning bird http:// ift.tt/2itvktN";;;;"921789290790649856";https://twitter.com/PositivityIsFun/status/921789290790649856
PositivityIsFun;2017-10-21 14:20;0;0;"Man plunges into Halifax Harbour to rescue drowning bird http:// ift.tt/2hVJiky";;;;"921788371319623681";https://twitter.com/PositivityIsFun/status/921788371319623681
BobbieShinjc25;2017-10-21 14:19;0;0;"Man plunges into Halifax Harbour to rescue drowning bird http:// ift.tt/2hVJiky";;;;"921788008290029568";https://twitter.com/BobbieShinjc25/status/921788008290029568
