username;date;retweets;favorites;text;geo;mentions;hashtags;id;permalink
GConradiSmith;2017-07-12 20:14;0;0;"Just posted a photo @Halifax Harbour Waterfront https://www. instagram.com/p/BWdu3PfhNLP/";;@Halifax;;"885276312306196480";https://twitter.com/GConradiSmith/status/885276312306196480
BeverlyBurke3;2017-07-12 19:47;0;0;"Assorted pics from Halifax Harbour";;;;"885269352085323777";https://twitter.com/BeverlyBurke3/status/885269352085323777
christina_HFX;2017-07-12 19:33;0;1;"On the Tall Ship Silvia enjoying Luckett's on the water wine tasting cruising the Halifax Harbour #wine #food and #awesome company";;;#wine #food #awesome;"885265992049463296";https://twitter.com/christina_HFX/status/885265992049463296
jendoestri;2017-07-12 18:32;0;2;"Starting off date night with a selection of oysters from the maritimes! @Halifax Harbour … https://www. instagram.com/p/BWdjLrYB-w0/";;@Halifax;;"885250521384312834";https://twitter.com/jendoestri/status/885250521384312834
ajlburke;2017-07-12 16:17;0;0;"Anchorface @Halifax Harbour Waterfront https://www. instagram.com/p/BWdTssLFYu8/";;@Halifax;;"885216464109797376";https://twitter.com/ajlburke/status/885216464109797376
jeffmacarthur;2017-07-12 16:14;0;0;"Riot Squad at #halifaxjazzfest #jazz #quintet @Halifax Harbour Waterfront https://www. instagram.com/p/BWdTabwBe1x/";;@Halifax;#halifaxjazzfest #jazz #quintet;"885215831927508993";https://twitter.com/jeffmacarthur/status/885215831927508993
BatMatt77;2017-07-12 15:31;0;2;"Just casually eating poutine and listening to live jazz on the Halifax harbour #NotBad #HalifaxJazzFest";;;#NotBad #HalifaxJazzFest;"885204875667288064";https://twitter.com/BatMatt77/status/885204875667288064
NateTWN;2017-07-12 13:00;15;43;"Check out this whale in the #Halifax harbour. Buddy tells me he saw it breaching earlier. Video courtesy Jodi Gray @weathernetwork pic.twitter.com/UlPLnyKU5q";;@weathernetwork;#Halifax;"885166887365201920";https://twitter.com/NateTWN/status/885166887365201920
paradoxaltwist;2017-07-12 12:08;0;0;"Are there any #Halifax Harbour boat tours that allow you to bring your own food / drink?";;;#Halifax;"885153894740918276";https://twitter.com/paradoxaltwist/status/885153894740918276
EleanorRenaud;2017-07-12 11:28;1;1;"I am on the board walk at Halifax harbour pic.twitter.com/Lhv8S5CADN";;;;"885143819980857344";https://twitter.com/EleanorRenaud/status/885143819980857344
matlantivex;2017-07-12 11:27;1;1;"This is how the professionals infill #Halifax Harbour (under MacDonald Bridge) pic.twitter.com/3ILQM3cbq8";;;#Halifax;"885143620537520128";https://twitter.com/matlantivex/status/885143620537520128
EleanorRenaud;2017-07-12 11:26;1;2;"Halifax harbour pic.twitter.com/831uqOOQoB";;;;"885143379511615489";https://twitter.com/EleanorRenaud/status/885143379511615489
CareWittich;2017-07-12 10:01;0;0;"'Since I can remember I have always wanted to take a trip to McNab's Island in Halifax Harbour .… https://www. instagram.com/p/BWa0gC5Fw22/";;;;"885121863315324928";https://twitter.com/CareWittich/status/885121863315324928
snowcat032;2017-07-12 08:21;1;2;"At the entry to Halifax Harbour . pic.twitter.com/EiEpTczGZj";;;;"885096897576407040";https://twitter.com/snowcat032/status/885096897576407040
HeatherRankinMe;2017-07-11 21:08;14;45;"Views from #Halifax #Harbour . @halifaxnoise @hfxnovascotia #Yhz #Hfx pic.twitter.com/HQZZP9eOBl";;@halifaxnoise @hfxnovascotia;#Halifax #Harbour #Yhz #Hfx;"884927510370275328";https://twitter.com/HeatherRankinMe/status/884927510370275328
LeeWinchester1;2017-07-11 17:26;0;4;"Cool! Harbour Hopper is out today. #HalifaxHarbour pic.twitter.com/j3QJVUJCTQ";;;#HalifaxHarbour;"884871414695768067";https://twitter.com/LeeWinchester1/status/884871414695768067
Regina86th;2017-07-11 15:58;0;6;"Halifax Harbour Tour. #Cj2017 pic.twitter.com/5IQ6UUCd1e";;;#Cj2017;"884849377474260992";https://twitter.com/Regina86th/status/884849377474260992
oceanriversport;2017-07-11 15:45;0;0;"In honor of #Canada150 #TriviaTuesday is Canada Themed. Which is the largest island in the Halifax Harbour ?";;;#Canada150 #TriviaTuesday;"884846063169015808";https://twitter.com/oceanriversport/status/884846063169015808
saltscapes;2017-07-11 15:36;1;1;"Ever been out to Deadman's Island, in Halifax Harbour ? There are stories about the place. http://www. saltscapes.com/roots-folks/20 51-hallowed-ground.html …";;;;"884843798869790721";https://twitter.com/saltscapes/status/884843798869790721
jfarwellsailing;2017-07-11 14:36;0;0;"Our newest crew member! @Halifax Harbour Waterfront https://www. instagram.com/p/BWajabUFF1I/";;@Halifax;;"884828804077805576";https://twitter.com/jfarwellsailing/status/884828804077805576
23rdgeohunters;2017-07-11 13:48;0;1;"Off for lunch !!! #ferryride #23rdcj #cj2017 tmisis @marcsworld1 @Halifax Harbour Waterfront https://www. instagram.com/p/BWad8GaD5nS/";;@marcsworld1 @Halifax;#ferryride #23rdcj #cj2017;"884816773828059136";https://twitter.com/23rdgeohunters/status/884816773828059136
TimJaques_Media;2017-07-11 12:54;0;0;"Throw him in as a lesson. As long as it isn't Halifax Harbour .";;;;"884803005937332224";https://twitter.com/TimJaques_Media/status/884803005937332224
acraw1234;2017-07-11 12:14;0;0;"Great walk after dinner. #discoveryhalifax @Halifax Harbour Waterfront https://www. instagram.com/p/BWaTKEvF-E4/";;@Halifax;#discoveryhalifax;"884793060319612928";https://twitter.com/acraw1234/status/884793060319612928
amberkaulbach;2017-07-11 09:27;1;7;"Just saw a whale swimming in the Halifax Harbour ! So cool!!";;;;"884751008869613568";https://twitter.com/amberkaulbach/status/884751008869613568
davidpatecbc;2017-07-11 07:15;0;0;"The car carrier Faust makes an early-morning arrival in #Halifax Harbour https://www. instagram.com/p/BWZw3cTgbEo/";;;#Halifax;"884717784416083969";https://twitter.com/davidpatecbc/status/884717784416083969
ronlawn;2017-07-10 22:28;0;10;"#cdnseed2017 #Halifaxharbour pic.twitter.com/I5EE5HxCYC";;;#cdnseed2017 #Halifaxharbour;"884585090503905281";https://twitter.com/ronlawn/status/884585090503905281
shaunmackenzie;2017-07-10 20:03;0;1;"Sea Bridge is now open #betterlatethannever #halifax #novascotia @Halifax Harbour Waterfront https://www. instagram.com/p/BWYj8VDnClS/";;@Halifax;#betterlatethannever #halifax #novascotia;"884548549542912000";https://twitter.com/shaunmackenzie/status/884548549542912000
CLLC_Canada;2017-07-10 19:29;0;1;"Canada! @CLLC_Canada #internationalfriends #studyabroad #summer #halifaxharbour cityofhalifax… https://www. instagram.com/p/BWYgJNxDLDV/";;@CLLC_Canada;#internationalfriends #studyabroad #summer #halifaxharbour;"884540149165457408";https://twitter.com/CLLC_Canada/status/884540149165457408
KendraRunsFast;2017-07-10 16:43;0;8;"Today I veered down to the #seabridgehfx to check it out. It's pretty neat! Love the new perspective of #HalifaxHarbour ! pic.twitter.com/esT2VKi8Tt";;;#seabridgehfx #HalifaxHarbour;"884498453140779008";https://twitter.com/KendraRunsFast/status/884498453140779008
Mannyacj;2017-07-10 16:39;0;0;"Just posted a photo @Halifax Harbour Waterfront https://www. instagram.com/p/BWYMrUggSDn/";;@Halifax;;"884497341260025856";https://twitter.com/Mannyacj/status/884497341260025856
DDowel;2017-07-10 16:07;0;0;"#novascotia #goals #iwannabelikethemwhenigrowup @Halifax Harbour … https://www. instagram.com/p/BWYI-KVgnGLv FpxC0WWAT_SQ7XBaxW7uQ3K2OI0/ …";;@Halifax;#novascotia #goals #iwannabelikethemwhenigrowup;"884489183275892738";https://twitter.com/DDowel/status/884489183275892738
DDowel;2017-07-10 16:06;0;0;"#novascotia #rum @Halifax Harbour Waterfront https://www. instagram.com/p/BWYI2eagJj6Y zWbmIxjEQGgnuor4zWtz_4JjTI0/ …";;@Halifax;#novascotia #rum;"884489084609208320";https://twitter.com/DDowel/status/884489084609208320
AnneInHfx;2017-07-10 14:41;0;1;"Yay for lunchtime strolls in the sunshine to visit friends :) @Halifax Harbour Waterfront https://www. instagram.com/p/BWX_MQuhMhM/";;@Halifax;;"884467677884018690";https://twitter.com/AnneInHfx/status/884467677884018690
3537Toronto;2017-07-10 13:06;1;7;"Enjoying the sights and sounds of Halifax harbour on this beautiful day! #CJ2017 pic.twitter.com/hvynF6HAGq";;;#CJ2017;"884443726168416257";https://twitter.com/3537Toronto/status/884443726168416257
DJProbableCause;2017-07-10 11:06;0;0;"Just posted a photo @Halifax Harbour Waterfront https://www. instagram.com/p/BWXmk5hHCpP/";;@Halifax;;"884413546909577216";https://twitter.com/DJProbableCause/status/884413546909577216
TheHardyBoyCats;2017-07-10 10:32;0;3;"Here we have "harbour hair". If you get too far from Halifax Harbour , it comes looking for you, in the form of fog";;;;"884404920354578432";https://twitter.com/TheHardyBoyCats/status/884404920354578432
Emma_macmullin;2017-07-10 09:11;0;0;"late night adventures @Halifax Harbour Waterfront https://www. instagram.com/p/BWXZZjYDWAR- l5brdMqVWkYkLQRLey6ZkdPeC80/ …";;@Halifax;;"884384578370195457";https://twitter.com/Emma_macmullin/status/884384578370195457
jasminecain__;2017-07-10 00:22;0;0;"went for a walk on this nice day @Halifax Harbour Waterfront https://www. instagram.com/p/BWWc6aQjlgV/";;@Halifax;;"884251560884043777";https://twitter.com/jasminecain__/status/884251560884043777
AnthonyMartinNS;2017-07-09 22:53;0;1;"Cool moon over Halifax Harbour tonight. @Gahan House Harbourfront https://www. instagram.com/p/BWWSo-BFJN5/";;@Gahan;;"884228968102187008";https://twitter.com/AnthonyMartinNS/status/884228968102187008
NaturallyAlexM;2017-07-09 22:13;0;1;"Half-sail in Hali-town. #TheFax #boat #sailing #water #port #lighthouse @Halifax Harbour … https://www. instagram.com/p/BWWOGjkh9Fj/";;@Halifax;#TheFax #boat #sailing #water #port #lighthouse;"884219001949351937";https://twitter.com/NaturallyAlexM/status/884219001949351937
Mannyacj;2017-07-09 21:57;0;0;"Just posted a photo @Halifax Harbour Waterfront https://www. instagram.com/p/BWWMOCIgFgl/";;@Halifax;;"884214848745353218";https://twitter.com/Mannyacj/status/884214848745353218
Mannyacj;2017-07-09 21:56;0;0;"Just posted a photo @Halifax Harbour Waterfront https://www. instagram.com/p/BWWMI6WAMmk/";;@Halifax;;"884214676527210496";https://twitter.com/Mannyacj/status/884214676527210496
WereSandra;2017-07-09 19:56;0;1;"Europa coming into Halifax Harbour Sunday July 9, 6 pm pic.twitter.com/pm2b6z3tFK";;;;"884184615660945408";https://twitter.com/WereSandra/status/884184615660945408
WereSandra;2017-07-09 17:51;0;0;"Coming into Halifax Harbour pic.twitter.com/cCeC63p5t6";;;;"884153134020521985";https://twitter.com/WereSandra/status/884153134020521985
Mannyacj;2017-07-09 16:58;0;0;"Just posted a photo @Halifax Harbour Waterfront https://www. instagram.com/p/BWVqFhVg6U8/";;@Halifax;;"884139795542188032";https://twitter.com/Mannyacj/status/884139795542188032
Mannyacj;2017-07-09 16:58;0;0;"Just posted a photo @Halifax Harbour Waterfront https://www. instagram.com/p/BWVqC4jgrWl/";;@Halifax;;"884139709571579904";https://twitter.com/Mannyacj/status/884139709571579904
Junction_56;2017-07-09 10:10;0;0;"About to explore the Halifax Harbour . Mr. Moonshine loves a good boardwalk! #mywaterfront #halifaxharbourwalk pic.twitter.com/N1I4IpNH1b";;;#mywaterfront #halifaxharbourwalk;"884036957801730048";https://twitter.com/Junction_56/status/884036957801730048
jonathanlegate;2017-07-09 07:59;0;2;"#seamist on #halifaxharbour . #halifax #sailing #tallships #summer #spooky #visit … https://www. instagram.com/p/BWUsWHoFMUL/";;;#seamist #halifaxharbour #halifax #sailing #tallships #summer #spooky #visit;"884004024147685376";https://twitter.com/jonathanlegate/status/884004024147685376
PaisajesIn;2017-07-09 02:41;0;0;"Halifax Harbour in the fog [4032x2268] from Thunder-Nugget via Paisajes Increibles. pic.twitter.com/QuOPgPKiHC";;;;"883924134702592000";https://twitter.com/PaisajesIn/status/883924134702592000
Lahiox;2017-07-09 02:09;0;0;"Halifax Harbour in the fog [4032x2268] http:// ift.tt/2tC8hig pic.twitter.com/UAtlbyKsbR";;;;"883915998138699776";https://twitter.com/Lahiox/status/883915998138699776
PorterEscapes;2017-07-08 17:30;1;5;"NEW PARTNER ALERT! Add a #Halifax harbour tour to your package online today or give us a call 855-372-1100 @MurphysHalifax pic.twitter.com/pZ7cvuRHZ9";;@MurphysHalifax;#Halifax;"883785286219595777";https://twitter.com/PorterEscapes/status/883785286219595777
skcourt82;2017-07-08 15:04;0;0;"Wow. This is #lifegoals . By the way my favourite commercial is the one about the Halifax Harbour Explosion. YouTube link in the story.... https:// twitter.com/CBCNews/status /883687328987926529 …";;;#lifegoals;"883748596717297665";https://twitter.com/skcourt82/status/883748596717297665
sara_napier;2017-07-08 14:23;5;14;"Stripes of #fog across the #Halifax Harbour. Beautiful #novascotia #SaturdayMorning #viewsfromdartmouth @portofhalifax @My_Waterfront pic.twitter.com/dkCQBMZEep";;@portofhalifax @My_Waterfront;#fog #Halifax #novascotia #SaturdayMorning #viewsfromdartmouth;"883738283183919104";https://twitter.com/sara_napier/status/883738283183919104
cbcemma;2017-07-08 12:43;0;3;"Just watching the Black Pearl roll in through the fog and into the Halifax harbour #PiratesoftheCaribbean #ghostship #arrrrrr pic.twitter.com/JImECaeSXD";;;#PiratesoftheCaribbean #ghostship #arrrrrr;"883713120274972673";https://twitter.com/cbcemma/status/883713120274972673
azuretan;2017-07-08 12:20;0;1;"Fog over Halifax Harbour @A. Murray MacKay Bridge https://www. instagram.com/p/BWSlb9ShJFH/";;@A;;"883707352872046597";https://twitter.com/azuretan/status/883707352872046597
CodiacSm;2017-07-08 11:34;0;4;"They are a sight to see! Toured on one around the Halifax harbour a few years ago. Pretty awesome!";;;;"883695810801782784";https://twitter.com/CodiacSm/status/883695810801782784
DOvsenny;2017-07-08 11:26;0;1;"Harbour Hopping in Halifax with Hubby #MurrayClan @Halifax Harbour … https://www. instagram.com/p/BWSfPziFc_nn i1HjliQ_QxIChebX5jsXGxjz0I0/ …";;@Halifax;#MurrayClan;"883693745979310080";https://twitter.com/DOvsenny/status/883693745979310080
halifaxca1;2017-07-08 04:33;0;0;"Operations Manager - Halifax Harbour Bridges - Halifax, NS https:// goo.gl/fb/nG9X6Y Job Halifax CA";;;;"883589954768703488";https://twitter.com/halifaxca1/status/883589954768703488
Lucidius134;2017-07-07 20:50;0;0;"@DojimaCoffee Halifax Harbour Halifax, NS https:// goo.gl/maps/NnGhoCAzr 8T2 …";;@DojimaCoffee;;"883473325707722753";https://twitter.com/Lucidius134/status/883473325707722753
rathbor;2017-07-07 19:34;0;2;"East Coast Daycare. . #Halifax #HalifaxHarbour #BabyBoats #NovaScotia #Canada #Canada150 … https://www. instagram.com/p/BWQyWXLFzGJ/";;;#Halifax #HalifaxHarbour #BabyBoats #NovaScotia #Canada #Canada150;"883454271294889985";https://twitter.com/rathbor/status/883454271294889985
UAV_news;2017-07-07 14:37;0;0;"Man who allegedly dove into Halifax Harbour to recover drone sparks concerns over safety - Globalnews.ca : http:// fat.ly/27s5d";;;;"883379528696872961";https://twitter.com/UAV_news/status/883379528696872961
halifaxnoise;2017-07-07 11:55;1;6;"From @sdphotog06 — Foggy mornings in the harbour. #novascotia #halifaxharbour #pilots #dartmouth #eastcoast #ignov … http:// ift.tt/2uyNU5F pic.twitter.com/Eqezn95xbl";;@sdphotog06;#novascotia #halifaxharbour #pilots #dartmouth #eastcoast #ignov;"883338747147939841";https://twitter.com/halifaxnoise/status/883338747147939841
AndreaGess;2017-07-07 11:55;0;0;"Check out this guy...mid air! #lovebirds #novascotia #canada #familycruise @Halifax Harbour … https://www. instagram.com/p/BWP9u3XFmUf/";;@Halifax;#lovebirds #novascotia #canada #familycruise;"883338565417132033";https://twitter.com/AndreaGess/status/883338565417132033
3hree6ix5ive_;2017-07-07 09:58;0;0;"Francophones from Montreal walking around the Halifax Harbour saying that the Old Port is way better, why do you travel? Fucking stay home.";;;;"883309205242949635";https://twitter.com/3hree6ix5ive_/status/883309205242949635
TamaraLNugent;2017-07-07 08:16;0;16;"Found Theodore the Tugboat in the Halifax harbour . Watched every episode when he was a little guy. #HereIAm #TimeFlies #childhoodmemories pic.twitter.com/KYe4RXcxxv";;;#HereIAm #TimeFlies #childhoodmemories;"883283636287680513";https://twitter.com/TamaraLNugent/status/883283636287680513
Sean_YYZ;2017-07-07 07:08;3;8;"Toronto's going to get one of the older Halifax Harbour ferries for Centre Island service. http://www. cbc.ca/news/canada/no va-scotia/dartmouth-iii-ferry-toronto-centre-island-1.4193295 …";;;;"883266388646916096";https://twitter.com/Sean_YYZ/status/883266388646916096
RickMcGuire6;2017-07-07 07:00;0;0;"Halifax Harbour Ferry Sold To The City of Toronto. http:// ow.ly/q5n730dpA70";;;;"883264503974170624";https://twitter.com/RickMcGuire6/status/883264503974170624
davidpatecbc;2017-07-07 06:15;0;0;"The car carrier Dorado Leader arrives in #Halifax Harbour https://www. instagram.com/p/BWPWybTAZDY/";;;#Halifax;"883253020754104321";https://twitter.com/davidpatecbc/status/883253020754104321
heyjammm;2017-07-07 03:18;0;0;"Ribfest @Halifax Harbour Waterfront https://www. instagram.com/p/BWPClShFB3u/";;@Halifax;;"883208499379011584";https://twitter.com/heyjammm/status/883208499379011584
HommedePaix1;2017-07-06 23:34;0;0;"Yep ah ah!! In front of a store in Halifax Harbour";;;;"883152097872678913";https://twitter.com/HommedePaix1/status/883152097872678913
TheDroneInsurer;2017-07-06 19:01;0;1;"Man who allegedly dove into Halifax Harbour to recover #drone sparks concerns over safety http:// hubs.ly/H07--Mz0 by @globalnews";;@globalnews;#drone;"883083384674803712";https://twitter.com/TheDroneInsurer/status/883083384674803712
davidpatecbc;2017-07-06 18:26;0;0;"Container ship George Washington leaves #Halifax Harbour https://www. instagram.com/p/BWOFqVAg8ED/";;;#Halifax;"883074616306151426";https://twitter.com/davidpatecbc/status/883074616306151426
DalHydro;2017-07-06 17:24;1;17;"Enjoying the views of Halifax harbour from my new @WaterStudies office and looking forward to a busy and productive summer pic.twitter.com/X4jaF90H6Z";;@WaterStudies;;"883059174300676096";https://twitter.com/DalHydro/status/883059174300676096
ashleypilkey;2017-07-06 15:29;0;0;"Checking out the new #wharfside #beergarden at #purdyswharf #halifaxharbour pic.twitter.com/o1mJ3GORoz";;;#wharfside #beergarden #purdyswharf #halifaxharbour;"883030252183859200";https://twitter.com/ashleypilkey/status/883030252183859200
mapleleafnavy;2017-07-06 12:45;3;4;"A new photo exhibit at the Nova Scotia Archives: 100,000 photos Halifax harbour watcher Mac Mackay in 51 years http:// ow.ly/AjYK30dorQj";;;;"882988849416286208";https://twitter.com/mapleleafnavy/status/882988849416286208
UASInsurance;2017-07-06 09:51;0;0;"Man who allegedly dove into Halifax Harbour to recover drone sparks concerns over safety - Updated Transport... http:// fb.me/zfnnCzGl";;;;"882945159075426308";https://twitter.com/UASInsurance/status/882945159075426308
ns_mma;2017-07-06 09:01;2;4;"TDIH: (1943) The tug Erg was rammed by a freighter and sank in #HalifaxHarbour . 19 lives were lost.";;;#HalifaxHarbour;"882932486132695043";https://twitter.com/ns_mma/status/882932486132695043
Report24CA;2017-07-06 08:10;0;0;"Man who allegedly dove into Halifax Harbour to recover drone sparks concerns over safety... https:// goo.gl/n8tfJr pic.twitter.com/VZaNENOJmj";;;;"882919747398111232";https://twitter.com/Report24CA/status/882919747398111232
davidpatecbc;2017-07-06 07:47;0;0;"The cruise ship Veendam arrives in #Halifax Harbour on a lovely morning https://www. instagram.com/p/BWM8mvwg6b8/";;;#Halifax;"882913966946648064";https://twitter.com/davidpatecbc/status/882913966946648064
MrsCrossmanbsch;2017-07-06 07:24;0;1;"Finally, an East Coast Sunrise! #HalifaxHarbour #SaintMarysUniversity pic.twitter.com/TW1VRKlncV";;;#HalifaxHarbour #SaintMarysUniversity;"882908046992736256";https://twitter.com/MrsCrossmanbsch/status/882908046992736256
Report24CA;2017-07-06 05:57;0;0;"Man who allegedly dove into Halifax Harbour to recover drone sparks concerns over safety #RT https:// goo.gl/n8tfJr pic.twitter.com/nZqWtZy8PT";;;#RT;"882886213421735936";https://twitter.com/Report24CA/status/882886213421735936
Report24CA;2017-07-06 04:12;0;0;"Man who allegedly dove into Halifax Harbour to recover drone sparks concerns over safety #TODAY https:// goo.gl/n8tfJr";;;#TODAY;"882859765575110657";https://twitter.com/Report24CA/status/882859765575110657
Report24CA;2017-07-06 02:00;0;0;"Man who allegedly dove into Halifax Harbour to recover drone sparks concerns over safety #D6 https:// goo.gl/n8tfJr pic.twitter.com/iIqXxI5EL9";;;#D6;"882826508590612480";https://twitter.com/Report24CA/status/882826508590612480
AndrewJames_85;2017-07-05 23:24;0;27;"#30x30DavidSuzukiChallenge #Halifax #Harbour Boardwalk #NovaScotia #Canada pic.twitter.com/KjrTtzkzbc";;;#30x30DavidSuzukiChallenge #Halifax #Harbour #NovaScotia #Canada;"882787281609871360";https://twitter.com/AndrewJames_85/status/882787281609871360
Report24CA;2017-07-05 23:16;0;0;"Man who allegedly dove into Halifax Harbour to recover drone sparks concerns over safety. https:// goo.gl/n8tfJr pic.twitter.com/q4kfJiimqt";;;;"882785340293083137";https://twitter.com/Report24CA/status/882785340293083137
Darrel_Mac;2017-07-05 22:03;0;0;"Man who allegedly dove into Halifax Harbour to recover drone sparks concerns over safety http:// globalnews.ca/news/3577464/m an-who-allegedly-dove-into-halifax-harbour-to-recover-drone-sparks-concerns-over-safety/ …";;;;"882766910164697089";https://twitter.com/Darrel_Mac/status/882766910164697089
halifaxnoise;2017-07-05 21:07;1;2;"Man who allegedly dove into Halifax Harbour to recover drone sparks concerns over safety http:// globalnews.ca/news/3577464/m an-who-allegedly-dove-into-halifax-harbour-to-recover-drone-sparks-concerns-over-safety/ …";;;;"882752944973778945";https://twitter.com/halifaxnoise/status/882752944973778945
AlexaMacLean902;2017-07-05 20:36;2;1;"Man who allegedly dove into Halifax Harbour to recover drone sparks concerns over safety http:// globalnews.ca/news/3577464/m an-who-allegedly-dove-into-halifax-harbour-to-recover-drone-sparks-concerns-over-safety/ …";;;;"882745111767109632";https://twitter.com/AlexaMacLean902/status/882745111767109632
GlobalNational;2017-07-05 20:28;0;0;"Man who allegedly dove into Halifax Harbour to recover drone sparks concerns over safety http:// globalnews.ca/news/3577464/m an-who-allegedly-dove-into-halifax-harbour-to-recover-drone-sparks-concerns-over-safety/ … pic.twitter.com/ipFbXonyCD";;;;"882742905743581184";https://twitter.com/GlobalNational/status/882742905743581184
globalnews;2017-07-05 20:28;0;1;"Man who allegedly dove into Halifax Harbour to recover drone sparks concerns over safety http:// globalnews.ca/news/3577464/m an-who-allegedly-dove-into-halifax-harbour-to-recover-drone-sparks-concerns-over-safety/ … pic.twitter.com/dvzMimvtzb";;;;"882742903914868736";https://twitter.com/globalnews/status/882742903914868736
DroneNewsFeed;2017-07-05 20:23;0;1;"Man who allegedly dove into Halifax Harbour to recover drone sparks concerns over safety - Halifax... http:// bit.ly/2tSq5IE #drone #uav";;;#drone #uav;"882741677466800128";https://twitter.com/DroneNewsFeed/status/882741677466800128
DroneFans;2017-07-05 20:09;2;3;"Man who allegedly dove into Halifax Harbour to recover #drone sparks concerns... http:// bit.ly/2sHZbDe #aerialphotography #dronenews #uav pic.twitter.com/gJqztABSIa";;;#drone #aerialphotography #dronenews #uav;"882738306064277504";https://twitter.com/DroneFans/status/882738306064277504
drone_school;2017-07-05 20:02;0;0;"Man who allegedly dove into Halifax Harbour to recover drone sparks concerns over safety - Globalnews.ca | DroneSchool - …";;;;"882736505848045568";https://twitter.com/drone_school/status/882736505848045568
droneblog;2017-07-05 20:01;1;0;"Man who allegedly dove into Halifax Harbour to recover drone sparks concerns over safety - Globalnews.ca | Droneblog - …";;;;"882736157032939520";https://twitter.com/droneblog/status/882736157032939520
drone_reviews;2017-07-05 19:58;0;0;"Man who allegedly dove into Halifax Harbour to recover drone sparks concerns over safety - Globalnews.ca | DroneReviews - …";;;;"882735439123279872";https://twitter.com/drone_reviews/status/882735439123279872
drone_sport;2017-07-05 19:58;0;0;"Man who allegedly dove into Halifax Harbour to recover drone sparks concerns over safety - Globalnews.ca | DroneSport - …";;;;"882735426129342464";https://twitter.com/drone_sport/status/882735426129342464
dronegamescom;2017-07-05 19:57;1;0;"Man who allegedly dove into Halifax Harbour to recover drone sparks concerns over safety - Globalnews.ca | DroneGames - …";;;;"882735187783815168";https://twitter.com/dronegamescom/status/882735187783815168
dronepilots;2017-07-05 19:56;0;0;"Man who allegedly dove into Halifax Harbour to recover drone sparks concerns over safety - Globalnews.ca | DronePilots - …";;;;"882734914977898497";https://twitter.com/dronepilots/status/882734914977898497
ProDronesNews;2017-07-05 19:38;0;0;"Man who allegedly dove into Halifax Harbour to recover drone sparks concerns over safety - Globalnews.ca http:// globalnews.ca/news/3577464/m an-who-allegedly-dove-into-halifax-harbour-to-recover-drone-sparks-concerns-over-safety/ …";;;;"882730351327662080";https://twitter.com/ProDronesNews/status/882730351327662080
HalifaxNSNews;2017-07-05 19:36;0;0;"Man who allegedly dove into Halifax Harbour to recover drone sparks concerns over safety - Globalnew - http:// globalnews.ca/news/3577464/m an-who-allegedly-dove-into-halifax-harbour-to-recover-drone-sparks-concerns-over-safety/ …";;;;"882729820420964352";https://twitter.com/HalifaxNSNews/status/882729820420964352
thinkusability;2017-07-05 19:20;0;1;"Birthdays on the water are #ClinicallyProven to be good for you. #HalifaxHarbour … https://www. instagram.com/p/BWLnKimA8gK/";;;#ClinicallyProven #HalifaxHarbour;"882725992258609153";https://twitter.com/thinkusability/status/882725992258609153
