username;date;retweets;favorites;text;geo;mentions;hashtags;id;permalink
HayleyClarke_1;2017-08-01 15:14;1;4;"A busy day in Halifax Harbour ! #tallships2017 #paradeofsail #rdv2017 @Halifax Harbour … https://www. instagram.com/p/BXQr8e-Avd9/";;@Halifax;#tallships2017 #paradeofsail #rdv2017;"892448472116453377";https://twitter.com/HayleyClarke_1/status/892448472116453377
AllanAprilCTV;2017-08-01 15:10;2;1;"Halifax Harbour Bridges are considering moving to a cashless tolling and mail billing system. pic.twitter.com/dJ8nUwH6J6 – bei Angus L Macdonald Bridge Toll Booth";;;;"892447476644446209";https://twitter.com/AllanAprilCTV/status/892447476644446209
ToddLandon_;2017-08-01 15:07;0;1;"Big crowds in #Dartmouth to watch the Bluenose II lead the 2017 Tall Ships Parade of Sail out of the #Halifax Harbour. pic.twitter.com/E3DBdqw2Vy";;;#Dartmouth #Halifax;"892446773880524800";https://twitter.com/ToddLandon_/status/892446773880524800
NavyWW1;2017-08-01 15:00;0;0;"While entering Halifax Harbour in dense fog hospital ship HMHS Letitia runs aground and is wrecked on Portuguese Cove pic.twitter.com/tBCt4frxg2";;;;"892444825277964288";https://twitter.com/NavyWW1/status/892444825277964288
campydave;2017-08-01 14:58;0;0;"Boats. #tallships #rdv2017 #sailpast #halifax #whywelivehere #officelunch @Halifax Harbour … https://www. instagram.com/p/BXQqlSGF12M/";;@Halifax;#tallships #rdv2017 #sailpast #halifax #whywelivehere #officelunch;"892444407554646016";https://twitter.com/campydave/status/892444407554646016
SeasideFM;2017-08-01 14:39;0;0;"Reports of a man overboard in Halifax Harbour .....";;;;"892439534700548096";https://twitter.com/SeasideFM/status/892439534700548096
halifaxnoise;2017-08-01 14:29;5;13;"From @peaseacb — Quiet day here in the Halifax Harbour #tallshipparade2017 #halifax #waterfront #tallships #… http:// ift.tt/2vg1DkZ pic.twitter.com/u3iTgIGQYR";;@peaseacb;#tallshipparade2017 #halifax #waterfront #tallships #;"892437168433635330";https://twitter.com/halifaxnoise/status/892437168433635330
rolliecangolf;2017-08-01 14:08;2;9;"Great #tallships2017 #ParadeOfSail today in Halifax Harbour ! pic.twitter.com/3DwWhkHhM2";;;#tallships2017 #ParadeOfSail;"892431946265092096";https://twitter.com/rolliecangolf/status/892431946265092096
mydebtfix;2017-08-01 14:06;0;0;"Beautiful day for #tallshipsfestival2017 . #halifax #free #funinthesun @Halifax Harbour Waterfront https://www. instagram.com/p/BXQkpKqlYBy/";;@Halifax;#tallshipsfestival2017 #halifax #free #funinthesun;"892431478851809283";https://twitter.com/mydebtfix/status/892431478851809283
RoamingDaWorld;2017-08-01 14:05;0;0;"As the tall ships pull out of the Halifax Harbour , we're also getting ready to ship off after spending a great mon… http:// ift.tt/2wi1SJ4 pic.twitter.com/QnS0WPP56R";;;;"892431017503543297";https://twitter.com/RoamingDaWorld/status/892431017503543297
TurnerDrakeLtd;2017-08-01 14:03;0;0;"#NS "Cross now, pay later? @Halifax Harbour Bridges considering move to cashless tolling" http://www. metronews.ca/news/halifax/2 017/07/31/cross-now-pay-later-halifax-harbour-bridges-considering-move-to-cashless-tolling.html … via @metrohalifax";;@Halifax @metrohalifax;#NS;"892430663990874117";https://twitter.com/TurnerDrakeLtd/status/892430663990874117
SeaBirdScience;2017-08-01 14:00;0;0;"The Halifax office was treated to a rare spectacle today. The #tallships #ParadeofSail was viewable from our pier on #Halifax Harbour. pic.twitter.com/7VsJiDGlOK";;;#tallships #ParadeofSail #Halifax;"892429859649204225";https://twitter.com/SeaBirdScience/status/892429859649204225
law_dcl;2017-08-01 13:59;1;5;"Great day on the Halifax Harbour with @FCT_Canada #setsailwithFCT pic.twitter.com/y6pbeVbWUQ";;@FCT_Canada;#setsailwithFCT;"892429550608674816";https://twitter.com/law_dcl/status/892429550608674816
Fraser_history;2017-08-01 13:53;0;1;"17 years ago @poog47 and I watched #tallshipsns sail into Halifax harbour . Now living here, and seeing the sail out. Fair winds @2017RDV !";;@poog47 @2017RDV;#tallshipsns;"892428205847662593";https://twitter.com/Fraser_history/status/892428205847662593
edsteeves;2017-08-01 13:42;0;2;"@SailBluenoseII leading the pack of @2017RDV Tall Ships out of Halifax Harbour this afternoon. What a Day! pic.twitter.com/GvjK6zgi4N";;@SailBluenoseII @2017RDV;;"892425241636589568";https://twitter.com/edsteeves/status/892425241636589568
LiquidAssetsNS;2017-08-01 13:37;0;2;"#farewelltonovascotia @Halifax Harbour Waterfront https://www. instagram.com/p/BXQhVWyBaFK/";;@Halifax;#farewelltonovascotia;"892424112555085825";https://twitter.com/LiquidAssetsNS/status/892424112555085825
Global_NB;2017-08-01 13:34;0;0;"There was only one fatality as the vessel floundered on the rocks off Halifax Harbour http:// glbn.ca/dyiSaq";;;;"892423218677592064";https://twitter.com/Global_NB/status/892423218677592064
globalhalifax;2017-08-01 13:33;1;2;"There was only one fatality as the vessel floundered on the rocks off Halifax Harbour http:// glbn.ca/bmEO0H";;;;"892423158787080193";https://twitter.com/globalhalifax/status/892423158787080193
UnfussyWine;2017-08-01 13:31;0;0;"2017 Parade of Sail in #halifaxharbour . #tallships #waycoolerinside #working #halifax @Halifax… https://www. instagram.com/p/BXQgnd-gYkq/";;@Halifax;#halifaxharbour #tallships #waycoolerinside #working #halifax;"892422478173261824";https://twitter.com/UnfussyWine/status/892422478173261824
loureilacap;2017-08-01 13:29;0;0;"U. S Coast Guard! #tallships @Halifax Harbour Waterfront https://www. instagram.com/p/BXQgbUag8mC/";;@Halifax;#tallships;"892422142813495298";https://twitter.com/loureilacap/status/892422142813495298
kminteriors2063;2017-08-01 13:28;0;0;"Dutch delicious #tallships #paradeofsail #halifax dutchdeliciouss @Halifax Harbour Waterfront https://www. instagram.com/p/BXQgVnIl-Kq/";;@Halifax;#tallships #paradeofsail #halifax;"892421867327369216";https://twitter.com/kminteriors2063/status/892421867327369216
CANADAMET;2017-08-01 13:22;0;0;"The Bluenose leading the tall ships out of Halifax Harbour on this beautiful hot summer day pic.twitter.com/S9OAi00uB2 – bei Waterfront Boardwalk";;;;"892420341666107394";https://twitter.com/CANADAMET/status/892420341666107394
TallShipsRaces;2017-08-01 13:18;2;5;"Crowds are settled in along the shore to salute the tall ships as they leave Halifax Harbour .… https://www. instagram.com/p/BXQfJ7sj4ZJ/";;;;"892419264384249856";https://twitter.com/TallShipsRaces/status/892419264384249856
kminteriors2063;2017-08-01 13:17;0;0;"#paradeofsail #tallships #halifax #stubborngoatbeergarden @Halifax Harbour Waterfront https://www. instagram.com/p/BXQe_YzlBqi/";;@Halifax;#paradeofsail #tallships #halifax #stubborngoatbeergarden;"892418914499547136";https://twitter.com/kminteriors2063/status/892418914499547136
jones902;2017-08-01 13:16;0;0;"Parade of sail #HalifaxHarbour pic.twitter.com/3g0AWtPoEs";;;#HalifaxHarbour;"892418694856495104";https://twitter.com/jones902/status/892418694856495104
jones902;2017-08-01 13:10;0;0;"Alexander Von Humbolt II #halifaxharbour parade of sail pic.twitter.com/InVV4Tcj9V";;;#halifaxharbour;"892417201378136064";https://twitter.com/jones902/status/892417201378136064
jones902;2017-08-01 13:07;0;0;"Parade of sail in #HalifaxHarbour American coastguard pic.twitter.com/tYfk5ektOz";;;#HalifaxHarbour;"892416559817379841";https://twitter.com/jones902/status/892416559817379841
halifaxhomes;2017-08-01 13:04;0;0;"To be in Halifax Harbour right now. Stunning afternoon watching the Tall Ships Sail Past from Kings Wharf Dartmouth side of the harbour. pic.twitter.com/zzP8TVrX6o";;;;"892415781824278531";https://twitter.com/halifaxhomes/status/892415781824278531
AndyFillmoreHFX;2017-08-01 13:04;14;48;"Tall Ship #Larinda heads out of #HalifaxHarbour with a cry of "THANK YOU HALIFAX!" #RDV2017 #tallships2017 #canada150 pic.twitter.com/KULXutaopl";;;#Larinda #HalifaxHarbour #RDV2017 #tallships2017 #canada150;"892415758147473410";https://twitter.com/AndyFillmoreHFX/status/892415758147473410
scott_belton;2017-08-01 12:52;0;13;"#BlueNoseII leading the Parade of Sail through #Halifax Harbour with the green-sailed… https://www. instagram.com/p/BXQcLGwBUoz/";;;#BlueNoseII #Halifax;"892412707630010369";https://twitter.com/scott_belton/status/892412707630010369
HeatherR_TD;2017-08-01 12:52;0;12;"How is one to work this afternoon with an office view like this? #tallships #BlueNoseII #halifaxharbour pic.twitter.com/CG87MTBJfZ";;;#tallships #BlueNoseII #halifaxharbour;"892412627317657600";https://twitter.com/HeatherR_TD/status/892412627317657600
TimothyDMorse;2017-08-01 12:49;0;0;"Just posted a video @Halifax Harbour Waterfront https://www. instagram.com/p/BXQby6FH4m3/";;@Halifax;;"892411919243595776";https://twitter.com/TimothyDMorse/status/892411919243595776
Dartmouth_Tim;2017-08-01 12:44;2;15;"Nova Scotia's Sailing ambassador Bluenose II leading the Parade of Sail on Halifax Harbour viewed from @DT_Dartmouth pic.twitter.com/rI1lZ3Guq3";;@DT_Dartmouth;;"892410731609690112";https://twitter.com/Dartmouth_Tim/status/892410731609690112
PokerDave04;2017-08-01 12:44;0;0;"Nice view during lunch. #halifax #tallships #lunch #waterfront #halifaxharbour #paradeofsail … https://www. instagram.com/p/BXQbQU4luUk/";;;#halifax #tallships #lunch #waterfront #halifaxharbour #paradeofsail;"892410687758114818";https://twitter.com/PokerDave04/status/892410687758114818
jones902;2017-08-01 12:42;0;0;"#paradeofsails in Halifax harbour @SailBluenoseII pic.twitter.com/wiXVIxTMMr";;@SailBluenoseII;#paradeofsails;"892410337559031811";https://twitter.com/jones902/status/892410337559031811
kg1989_karen;2017-08-01 12:39;0;1;"#halifaxharbour is busy today. Hard to work with all these distractions. #tallshipsns #paradeofsail pic.twitter.com/AdsVukOhXp";;;#halifaxharbour #tallshipsns #paradeofsail;"892409553941401600";https://twitter.com/kg1989_karen/status/892409553941401600
DarrylCSnyder;2017-08-01 12:25;0;2;"IMP Solutions Tall Ships Cruise in Halifax Harbour with our friends from… https://www. instagram.com/p/BXQZD4uDbrF/";;;;"892405868259627008";https://twitter.com/DarrylCSnyder/status/892405868259627008
FramDinshaw;2017-08-01 12:17;0;0;"The first #tallships sail past in #Halifax Harbour. pic.twitter.com/uxEZlbLrcW";;;#tallships #Halifax;"892403844252127232";https://twitter.com/FramDinshaw/status/892403844252127232
thestarhalifax;2017-08-01 12:11;0;0;"ICYMI: Halifax Harbour Bridges considers move to cashless tolling, mail billing http:// ow.ly/koGz30e3zlw pic.twitter.com/EXTDT0QY5G";;;;"892402360101867524";https://twitter.com/thestarhalifax/status/892402360101867524
scott_belton;2017-08-01 12:10;3;38;"Parade of Sail underway in #Halifax Harbour!! @My_Waterfront pic.twitter.com/b4PWZPpOgJ";;@My_Waterfront;#Halifax;"892402083625938944";https://twitter.com/scott_belton/status/892402083625938944
ClutterbugClean;2017-08-01 12:00;0;0;"Tall Ships in Halifax Harbour , Nova Scotia http:// modo.ly/2vfaNhE http:// fb.me/7t0FCjG8K";;;;"892399520532885504";https://twitter.com/ClutterbugClean/status/892399520532885504
mylesmundle;2017-08-01 11:54;0;0;"Amazing, this ship is it, from Spain @Halifax Harbour Waterfront https://www. instagram.com/p/BXQVka8lcsL/";;@Halifax;;"892398189055062016";https://twitter.com/mylesmundle/status/892398189055062016
meggroff;2017-08-01 11:45;1;0;"A very crowded #Halifax harbour waits for the Parade of Sail to start pic.twitter.com/wHOWw1e1FJ";;;#Halifax;"892395869319901185";https://twitter.com/meggroff/status/892395869319901185
TimothyDMorse;2017-08-01 11:43;0;0;"Current conditions @Halifax Harbour Waterfront https://www. instagram.com/p/BXQUSyVngC5/";;@Halifax;;"892395402917367808";https://twitter.com/TimothyDMorse/status/892395402917367808
FramDinshaw;2017-08-01 11:41;1;3;"The #tallshipsns sailpast will start at noon in #Halifax harbour. pic.twitter.com/1eMyB9T8PM";;;#tallshipsns #Halifax;"892394791589359617";https://twitter.com/FramDinshaw/status/892394791589359617
mylesmundle;2017-08-01 11:34;0;0;"Tall Ships, pretty damn cool @Halifax Harbour Waterfront https://www. instagram.com/p/BXQTNEzFPkA/";;@Halifax;;"892393043449581568";https://twitter.com/mylesmundle/status/892393043449581568
DarrylCSnyder;2017-08-01 11:13;0;0;"Beautiful day in Halifax Harbour watching the #tallships with @impsolutions and guest.… https://www. instagram.com/p/BXQQzYrD9mv/";;@impsolutions;#tallships;"892387711931252736";https://twitter.com/DarrylCSnyder/status/892387711931252736
PinkPantherLiz;2017-08-01 11:11;0;0;"The Spanish Galeon preparing for the #tallships sail past #Halifax @Halifax Harbour Waterfront https://www. instagram.com/p/BXQQoQ4lRy1/";;@Halifax;#tallships #Halifax;"892387328278310913";https://twitter.com/PinkPantherLiz/status/892387328278310913
MuseumsManitoba;2017-08-01 11:02;0;0;"A diary about life on board a ship and mention of the explosion in Halifax harbour , a remarkable piece of history... http:// fb.me/3O2PE9LO5";;;;"892384933603364865";https://twitter.com/MuseumsManitoba/status/892384933603364865
TylerNewton1;2017-08-01 10:58;0;0;"31ft vessel taking on water in Bedford basin. Emergency crews alongside. RCMP HRP CG on scene #Halifax #halifaxharbour";;;#Halifax #halifaxharbour;"892384166695903232";https://twitter.com/TylerNewton1/status/892384166695903232
sewah_kram;2017-08-01 10:43;0;0;"And they are getting ready... #paradeofsails2017 @Halifax Harbour Waterfront https://www. instagram.com/p/BXQNaiflVE3/";;@Halifax;#paradeofsails2017;"892380254244933632";https://twitter.com/sewah_kram/status/892380254244933632
BruceFriskoCTV;2017-08-01 10:06;7;15;"Ships lining up for Parade of Sail in Halifax Harbour . Complete coverage tonight @CTV_Liveat5 & @CTVAtlantic 6:00! pic.twitter.com/GmOMJxl8dk";;@CTV_Liveat5 @CTVAtlantic;;"892370962041196544";https://twitter.com/BruceFriskoCTV/status/892370962041196544
SteveCSilva;2017-08-01 09:58;0;0;"Cross now, pay later? Halifax Harbour Bridges considering move to cashless tolling http://www. metronews.ca/news/halifax/2 017/07/31/cross-now-pay-later-halifax-harbour-bridges-considering-move-to-cashless-tolling.html …";;;;"892368906677096448";https://twitter.com/SteveCSilva/status/892368906677096448
NovaScotiaLive;2017-08-01 09:54;0;0;"Cross now, pay later? Halifax Harbour Bridges considering move to cashless tolling http://www. metronews.ca/news/halifax/2 017/07/31/cross-now-pay-later-halifax-harbour-bridges-considering-move-to-cashless-tolling.html … via @metrohalifax";;@metrohalifax;;"892367858839289856";https://twitter.com/NovaScotiaLive/status/892367858839289856
REALTOR_Jacqui;2017-08-01 09:37;2;11;"The fireworks from last night @My_Waterfront in the #Halifax harbour were fantastic! #LoveThisCity #TallShipsFestival #Summer2017 pic.twitter.com/8XR1MdlvcQ – bei Waterfront Boardwalk";;@My_Waterfront;#Halifax #LoveThisCity #TallShipsFestival #Summer2017;"892363748765204481";https://twitter.com/REALTOR_Jacqui/status/892363748765204481
SylliboyJohnR;2017-08-01 09:18;0;11;"Yesterday was a mini reward day after submitting 2nd thesis chapter by spending time with pals boating in our Halifax Harbour @MSVU_Halifax pic.twitter.com/6IOloD56EM";;@MSVU_Halifax;;"892358947218259970";https://twitter.com/SylliboyJohnR/status/892358947218259970
ernestcadegan;2017-08-01 09:15;0;0;"Doing Hali. #landscapeandlife #halifax #halifaxwaterfront #watertaxi #halifaxharbour … https://www. instagram.com/p/BXQDXaCFyyH/";;;#landscapeandlife #halifax #halifaxwaterfront #watertaxi #halifaxharbour;"892358158223650816";https://twitter.com/ernestcadegan/status/892358158223650816
SeasideFM;2017-08-01 08:41;0;0;"105.9 SEASIDE-FM News - Cross now, pay later? Halifax Harbour Bridges considering move to cashless tolling.... http:// fb.me/1fMlEg9HC";;;;"892349519463141376";https://twitter.com/SeasideFM/status/892349519463141376
SeasideFM;2017-08-01 08:33;1;0;"105.9 SEASIDE-FM Tall ships flashback - 1984 in Halifax Harbour from then ATV, with broadcaster Dave Wright. http:// fb.me/1d0fJN1s0";;;;"892347657859084288";https://twitter.com/SeasideFM/status/892347657859084288
CatCountryTruro;2017-08-01 08:32;0;0;"Tall Ships Festival wraps up in Halifax harbour on Tuesday. http:// bit.ly/2w1DLz2";;;;"892347418783744000";https://twitter.com/CatCountryTruro/status/892347418783744000
BigDogTruro;2017-08-01 08:32;0;0;"Tall Ships Festival wraps up in Halifax harbour on Tuesday. http:// bit.ly/2f4U8Xr";;;;"892347241498890243";https://twitter.com/BigDogTruro/status/892347241498890243
SylliboyJohnR;2017-08-01 07:37;2;7;"Night time boating in the Halifax Harbour with some friends...and our reward was a close up of pic.twitter.com/bkvXOOg8a9 – bei Halifax Harbour";;;;"892333485960179712";https://twitter.com/SylliboyJohnR/status/892333485960179712
FFMedia68;2017-08-01 07:32;2;3;"#Helicopter flies past the Tall Ships in #Halifax @Halifax Harbour Waterfront https://www. instagram.com/p/BXP3iTsl14t/";;@Halifax;#Helicopter #Halifax;"892332144403636224";https://twitter.com/FFMedia68/status/892332144403636224
Silverinhfx;2017-08-01 07:25;0;0;"Cross now, pay later? Halifax Harbour Bridges considering move to cashless tolling http://www. metronews.ca/news/halifax/2 017/07/31/cross-now-pay-later-halifax-harbour-bridges-considering-move-to-cashless-tolling.html …";;;;"892330376877797376";https://twitter.com/Silverinhfx/status/892330376877797376
phonepicshfx;2017-08-01 07:25;0;0;"#tallships you are so photogenic @Halifax Harbour Waterfront https://www. instagram.com/p/BXP2tloAQBt/";;@Halifax;#tallships;"892330334959923200";https://twitter.com/phonepicshfx/status/892330334959923200
thestarhalifax;2017-08-01 07:00;0;3;"Cross now, pay later? Halifax Harbour Bridges considers move to cashless tolling, mail billing http:// ow.ly/koGz30e3zlw pic.twitter.com/EXTDT0QY5G";;;;"892324262085787651";https://twitter.com/thestarhalifax/status/892324262085787651
Jer_Godfrey;2017-08-01 06:20;0;0;"Cross now, pay later? Halifax Harbour Bridges considering move to cashless tolling http://www. metronews.ca/news/halifax/2 017/07/31/cross-now-pay-later-halifax-harbour-bridges-considering-move-to-cashless-tolling.html …";;;;"892314048787820544";https://twitter.com/Jer_Godfrey/status/892314048787820544
CenturyAgoToday;2017-08-01 06:05;4;11;"British hostpital ship HMHS Letitia runs aground in Halifax Harbour , causing one death: pic.twitter.com/vjBRea5MpX";;;;"892310209615585281";https://twitter.com/CenturyAgoToday/status/892310209615585281
rey_reymarie;2017-08-01 00:19;0;0;"I'm on a enjoying the #halifax #harbour #tallships and #fireworks @discoverhalifax … https://www. instagram.com/p/BXPF-UwgP95/";;@discoverhalifax;#halifax #harbour #tallships #fireworks;"892223157452644354";https://twitter.com/rey_reymarie/status/892223157452644354
REALTOR_Jacqui;2017-07-31 23:17;3;19;"So worth the trip downtown and the traffic to get back home for @My_Waterfront #Fireworks #TallShipsFestival #HalifaxHarbour #Halifax pic.twitter.com/T6L2lM4qxp – bei Halifax Harbour";;@My_Waterfront;#Fireworks #TallShipsFestival #HalifaxHarbour #Halifax;"892207602175795200";https://twitter.com/REALTOR_Jacqui/status/892207602175795200
Q104Halifax;2017-07-31 22:37;1;2;"Adam: Beautiful shot from tonight's fireworks display on Halifax Harbour . http:// ow.ly/8kEO30e40qU";;;;"892197562769440770";https://twitter.com/Q104Halifax/status/892197562769440770
sebastian_ferns;2017-07-31 22:33;0;0;"Heard the first two were good.... #notdissapointed #fireworks #tallshipshfx @Halifax Harbour … https://www. instagram.com/p/BXO503-ljUM/";;@Halifax;#notdissapointed #fireworks #tallshipshfx;"892196466831360000";https://twitter.com/sebastian_ferns/status/892196466831360000
LandLopers;2017-07-31 22:25;1;1;"Tall Ships in Halifax Harbour , Nova Scotia [PHOTO] https:// landlopers.com/2017/07/30/pho to-ships-halifax … #VisitNovaScotia #ExploreCanada #VisitHalifax #Canada";;;#VisitNovaScotia #ExploreCanada #VisitHalifax #Canada;"892194442580566017";https://twitter.com/LandLopers/status/892194442580566017
Andrew_SV_Matth;2017-07-31 22:06;0;0;"Saw the fireworks on the #ferry #Halifax @Halifax Harbour Waterfront https://www. instagram.com/p/BXO2wGUh_kK/";;@Halifax;#ferry #Halifax;"892189749145870336";https://twitter.com/Andrew_SV_Matth/status/892189749145870336
Andrew_SV_Matth;2017-07-31 22:06;0;0;"Saw the fireworks on the #ferry #Halifax @Halifax Harbour Waterfront https://www. instagram.com/p/BXO2wGUh_kK/";;@Halifax;#ferry #Halifax;"892189691520397312";https://twitter.com/Andrew_SV_Matth/status/892189691520397312
trott_d;2017-07-31 21:50;0;0;"We spent a second day exploring the tall ships in Halifax harbour today. #halifax #tallships … https://www. instagram.com/p/BXO0-ZHB32o/";;;#halifax #tallships;"892185802251407360";https://twitter.com/trott_d/status/892185802251407360
brightreddesign;2017-07-31 21:39;4;11;"Tall Ships Festival in the Halifax harbour . #2017tallshipsregatta #bluenose #bluenoseii #tallships pic.twitter.com/T75tCPrbe7";;;#2017tallshipsregatta #bluenose #bluenoseii #tallships;"892183090252189699";https://twitter.com/brightreddesign/status/892183090252189699
itaalianaa;2017-07-31 21:37;0;0;"Nothing like a view of my beautiful city #halifax #dartmouth #tallships @Halifax Harbour … https://www. instagram.com/p/BXOzbdgl_ly/";;@Halifax;#halifax #dartmouth #tallships;"892182406907674624";https://twitter.com/itaalianaa/status/892182406907674624
mail_mohamed;2017-07-31 21:37;1;0;"Pirates of Halifax @Halifax Harbour Waterfront https://www. instagram.com/p/BXOzZlaDb3u/";;@Halifax;;"892182361089114121";https://twitter.com/mail_mohamed/status/892182361089114121
FFMedia68;2017-07-31 21:11;1;0;"My favourite of the Tall Ships in #Halifax Spanish Galleon @Halifax Harbour Waterfront https://www. instagram.com/p/BXOwibDleRP/";;@Halifax;#Halifax;"892176024687063041";https://twitter.com/FFMedia68/status/892176024687063041
AllTravelPosts;2017-07-31 21:10;0;0;"Tall Ships in Halifax Harbour , Nova Scotia http:// alltravelposts.com/tall-ships-in- halifax-harbour-nova-scotia/ …";;;;"892175716795723776";https://twitter.com/AllTravelPosts/status/892175716795723776
Darrel_Mac;2017-07-31 21:05;0;0;"Cross now, pay later? Halifax Harbour Bridges considering move to cashless tolling http://www. metronews.ca/news/halifax/2 017/07/31/cross-now-pay-later-halifax-harbour-bridges-considering-move-to-cashless-tolling.html … via @metrohalifax";;@metrohalifax;;"892174315185197056";https://twitter.com/Darrel_Mac/status/892174315185197056
FFMedia68;2017-07-31 21:04;0;0;"Just posted a photo @Halifax Harbour Waterfront https://www. instagram.com/p/BXOvs9Glemt/";;@Halifax;;"892174173337919488";https://twitter.com/FFMedia68/status/892174173337919488
FFMedia68;2017-07-31 20:34;0;0;"USCG Vessel "Eagle" #TallShips @Halifax Harbour Waterfront https://www. instagram.com/p/BXOsSvSldfH/";;@Halifax;#TallShips;"892166687931252736";https://twitter.com/FFMedia68/status/892166687931252736
Scott_FFM;2017-07-31 19:40;1;2;"Fantastic trip around #Halifax Harbour via the Halifax Water #Taxi ! @halifaxnoise @halifaxnoiseVid @DowntownHalifax pic.twitter.com/8mzNX2pDfo";;@halifaxnoise @halifaxnoiseVid @DowntownHalifax;#Halifax #Taxi;"892152959496224770";https://twitter.com/Scott_FFM/status/892152959496224770
FFMedia68;2017-07-31 19:32;0;0;"Fantastic trip around #Halifax Harbour via the Halifax Water Taxi! @halifaxnoise @halifaxnoise … https://www. instagram.com/p/BXOlKjAFFSk/";;@halifaxnoise @halifaxnoise;#Halifax;"892151010814181376";https://twitter.com/FFMedia68/status/892151010814181376
knuf1985;2017-07-31 19:21;0;0;"Cross now, pay later? Halifax Harbour Bridges considering move to cashless tolling http://www. metronews.ca/news/halifax/2 017/07/31/cross-now-pay-later-halifax-harbour-bridges-considering-move-to-cashless-tolling.html … via @metrohalifax";;@metrohalifax;;"892148167092961280";https://twitter.com/knuf1985/status/892148167092961280
Bill_Zebedee;2017-07-31 19:13;0;0;"Do they know that's Halifax Harbour ?";;;;"892146305069350913";https://twitter.com/Bill_Zebedee/status/892146305069350913
thestarhalifax;2017-07-31 19:00;5;6;"Cross now, pay later? Halifax Harbour Bridges considers move to cashless tolling, mail billing http:// ow.ly/koGz30e3zlw pic.twitter.com/94RwreSm1E";;;;"892142990088704000";https://twitter.com/thestarhalifax/status/892142990088704000
BadHairSpray;2017-07-31 18:25;0;0;"Halifax is a mini version of San Francisco. #halifax @Halifax Harbour Waterfront https://www. instagram.com/p/BXOdhBilwyw/";;@Halifax;#halifax;"892134197070090240";https://twitter.com/BadHairSpray/status/892134197070090240
LandLopers;2017-07-31 18:25;2;2;"Tall Ships in Halifax Harbour , Nova Scotia [PHOTO] https:// landlopers.com/2017/07/30/pho to-ships-halifax … #VisitNovaScotia #ExploreCanada";;;#VisitNovaScotia #ExploreCanada;"892134060344176642";https://twitter.com/LandLopers/status/892134060344176642
itsmeSHARD;2017-07-31 17:37;0;0;"2017 Tall Ships Regatta. @Halifax Harbour Waterfront https://www. instagram.com/p/BXOYBZWAyEl/";;@Halifax;;"892122112642691072";https://twitter.com/itsmeSHARD/status/892122112642691072
EddieBrat;2017-07-31 17:16;0;0;"Saw Seal today in #halifax #harbour #novascotia @NovaScotia411 pic.twitter.com/QR2sp9sqBE";;@NovaScotia411;#halifax #harbour #novascotia;"892116692377194496";https://twitter.com/EddieBrat/status/892116692377194496
LIBBYDOE;2017-07-31 16:59;0;0;"Fireworks on a beautiful Halifornian night. @Halifax Harbour Waterfront https://www. instagram.com/p/BXOTpaYjdWY/";;@Halifax;;"892112499042025472";https://twitter.com/LIBBYDOE/status/892112499042025472
offtotravelling;2017-07-31 16:54;0;0;"Tall Ships in Halifax Harbour , Nova Scotia http:// ift.tt/2vbD5cG pic.twitter.com/EQYC8y8r7q";;;;"892111171897221121";https://twitter.com/offtotravelling/status/892111171897221121
SeasideFM;2017-07-31 16:36;0;0;"105.9 SEASIDE-FM - It's going to be another great evening for more fireworks in Halifax Harbour at 10:00!! Please... http:// fb.me/2vnhLvFuf";;;;"892106589712396288";https://twitter.com/SeasideFM/status/892106589712396288
