username;date;retweets;favorites;text;geo;mentions;hashtags;id;permalink
Art1274Hollis;2017-04-29 15:02;0;0;"Art in the Garden. Colleen Underwood will be painting Plein Air the summer in the Halifax Public Gardens . Stay... http:// fb.me/3P7X4nZjq";;;;"858380959812657152";https://twitter.com/Art1274Hollis/status/858380959812657152
OracleAlbert;2017-04-27 16:39;0;1;"This thing blooms for a short time only - I was lucky I caught it when I shot the Halifax Public Gardens last year... pic.twitter.com/bY9CnJj9Cu";;;;"857680612525834240";https://twitter.com/OracleAlbert/status/857680612525834240
DSRAnews;2017-04-27 16:30;0;0;"#tbt 196-, from the Halifax Municipal Archives. Horticulture Hall at the #halifax Public Gardens. pic.twitter.com/qKEKRbve5S";;;#tbt #halifax;"857678459497218048";https://twitter.com/DSRAnews/status/857678459497218048
KatNicLeoid;2017-04-27 13:13;0;8;"Misty walk through the Halifax Public Gardens at lunchtime today. pic.twitter.com/8VQcwQgpWE";;;;"857628677835804672";https://twitter.com/KatNicLeoid/status/857628677835804672
whatasite_com;2017-04-27 10:24;2;7;"A moody day at the Halifax Public Gardens #Halifax #novascotia After an @DoorsOpenHfx launch. @Hope_Cottage is taking part this year. pic.twitter.com/1LLFB2s4xu";;@DoorsOpenHfx @Hope_Cottage;#Halifax #novascotia;"857586365210517504";https://twitter.com/whatasite_com/status/857586365210517504
2JimiAlan;2017-04-25 23:15;1;1;"Just posted a photo @Halifax Public Gardens https://www. instagram.com/p/BTVNmdQFej5/";;@Halifax;;"857055550370177024";https://twitter.com/2JimiAlan/status/857055550370177024
Karlee0220Kerr;2017-04-24 19:06;0;0;"Check out my new design for many fashions. Halifax Public Gardens https://www. redbubble.com/people/karlee0 220/works/26182682-halifax-public-gardens?asc=t&p=a-line-dress … via @redbubble";;@redbubble;;"856630454845308930";https://twitter.com/Karlee0220Kerr/status/856630454845308930
Kuztoff;2017-04-24 14:40;0;0;"Fitzgerald Bridge in Halifax Public Gardens . A memorial to Francis Joseph Fitzgerald, my… https://www. instagram.com/p/BTRt4DHgX37/";;;;"856563581399293952";https://twitter.com/Kuztoff/status/856563581399293952
OracleAlbert;2017-04-24 01:43;1;2;"From a shoot at the Halifax Public Gardens last summer.... pic.twitter.com/8YJwKtsf4e";;;;"856367913502224386";https://twitter.com/OracleAlbert/status/856367913502224386
OracleAlbert;2017-04-24 01:40;4;5;"From a shoot at the Halifax Public Gardens last summer..... pic.twitter.com/jrWA9bwC0U";;;;"856367092525826048";https://twitter.com/OracleAlbert/status/856367092525826048
OracleAlbert;2017-04-24 01:38;1;4;"From a shoot at the Halifax Public Gardens last summer.... pic.twitter.com/X2cQdVlGrT";;;;"856366677243695105";https://twitter.com/OracleAlbert/status/856366677243695105
JohnCooke1994;2017-04-17 15:39;0;0;"#birds @Halifax Public Gardens https://www. instagram.com/p/BS_y_mvh0L2/";;@Halifax;#birds;"854041549465821184";https://twitter.com/JohnCooke1994/status/854041549465821184
OneMRKT;2017-04-17 12:10;0;3;"Here we are at the Halifax Public Gardens sharing the excitement over OneMRKT's upcoming launch! @HfxPublicGarden #halifaxbusiness pic.twitter.com/6sYLYMxjQc";;@HfxPublicGarden;#halifaxbusiness;"853989000058634241";https://twitter.com/OneMRKT/status/853989000058634241
HfxPublicGarden;2017-04-16 22:22;0;3;"Pretty purples in Halifax Public Gardens . The crocuses are so colourful. Come stroll through and enjoy them. http:// fb.me/17xQzi2rB";;;;"853780746653372416";https://twitter.com/HfxPublicGarden/status/853780746653372416
hehhehhyohyo;2017-04-16 19:28;0;3;"#Halifax public gardens. It's compact and neat. pic.twitter.com/D3EnxqqWxR";;;#Halifax;"853736982169743360";https://twitter.com/hehhehhyohyo/status/853736982169743360
itsmeSHARD;2017-04-16 18:44;0;0;"Just posted a photo @Halifax Public Gardens https://www. instagram.com/p/BS9jY9ZACGm/";;@Halifax;;"853725758065389568";https://twitter.com/itsmeSHARD/status/853725758065389568
itsmeSHARD;2017-04-16 18:27;0;0;"#Halifax #ShardInCanada @Halifax Public Gardens https://www. instagram.com/p/BS9heO1AyAA/";;@Halifax;#Halifax #ShardInCanada;"853721545981784065";https://twitter.com/itsmeSHARD/status/853721545981784065
EllenJSim;2017-04-16 14:06;0;1;"Nice walk taken with @BradofHFX in the Halifax Public Gardens . pic.twitter.com/H6DfC50bP4";;@BradofHFX;;"853655948866596867";https://twitter.com/EllenJSim/status/853655948866596867
EllenJSim;2017-04-16 14:05;0;2;"Alien crop circle found in the Halifax Public Gardens pic.twitter.com/5prtkUvyEK";;;;"853655497756553217";https://twitter.com/EllenJSim/status/853655497756553217
groovin1974;2017-04-14 16:04;0;1;"Reflections of spring. #halifaxpublicgardens @discoverhalifax @visitnovascotia … https://www. instagram.com/p/BS4Hh20jzL8/";;@discoverhalifax @visitnovascotia;#halifaxpublicgardens;"852960804584529921";https://twitter.com/groovin1974/status/852960804584529921
groovin1974;2017-04-14 16:01;0;1;"Hello Gardens, my old friend. I've come to talk to you again. #springday #halifaxpublicgardens … https://www. instagram.com/p/BS4HMl5DOwO/";;;#springday #halifaxpublicgardens;"852960077006999552";https://twitter.com/groovin1974/status/852960077006999552
chronicleherald;2017-04-14 14:45;0;0;"Halifax public gardens set to open on Good Friday http:// herald.ca/HLz";;;;"852940769002258432";https://twitter.com/chronicleherald/status/852940769002258432
azuretan;2017-04-14 12:26;0;1;"I'm at Halifax Public Gardens in Halifax, NS https://www. swarmapp.com/c/6Rzl13aXD0f pic.twitter.com/GJmzBZ7za5";;;;"852906029725741057";https://twitter.com/azuretan/status/852906029725741057
SeasideFM;2017-04-14 10:54;0;1;"Retweeted Cory McGraw ( @McgrawCory ): The #Halifax Public Gardens now open for the season. @globalhalifax ... http:// fb.me/26KJDa2Gy";;@McgrawCory @globalhalifax;#Halifax;"852882842627391488";https://twitter.com/SeasideFM/status/852882842627391488
McgrawCory;2017-04-14 10:52;19;38;"The #Halifax Public Gardens now open for the season. @globalhalifax pic.twitter.com/adRh4uyxrH";;@globalhalifax;#Halifax;"852882262131712000";https://twitter.com/McgrawCory/status/852882262131712000
familyfunyhz;2017-04-14 10:21;4;1;"The Halifax Public Gardens are Open for the Season! http:// ow.ly/vtQl30aRh7m";;;;"852874564245782529";https://twitter.com/familyfunyhz/status/852874564245782529
SeasideFM;2017-04-13 07:46;3;2;"Rise&Shine THe Halifax Public Gardens will open tomorrow Good Friday at 8:00 a.m.";;;;"852472947981914112";https://twitter.com/SeasideFM/status/852472947981914112
haligonia;2017-04-13 07:18;1;0;"Headlines | Halifax Public Gardens set for spring opening https:// haligonia.ca/halifax-public -gardens-set-for-spring-opening-188548/?utm_source=dlvr.it&utm_medium=twitter&utm_campaign=haligonia …";;;;"852466031436079104";https://twitter.com/haligonia/status/852466031436079104
haligonia;2017-04-12 19:18;0;2;"Headlines | Halifax Public Gardens set for spring opening https:// haligonia.ca/halifax-public -gardens-set-for-spring-opening-188548/?utm_source=dlvr.it&utm_medium=twitter&utm_campaign=haligonia …";;;;"852284746298146816";https://twitter.com/haligonia/status/852284746298146816
bwalsh125;2017-04-12 17:04;0;2;"Halifax public gardens set to open on Good Friday | via the @chronicleherald app http:// thechronicleherald.ca/metro/1459091- halifax-public-gardens-set-to-open-on-good-friday …";;@chronicleherald;;"852251154562068480";https://twitter.com/bwalsh125/status/852251154562068480
HalifaxNSNews;2017-04-12 16:36;2;2;"Halifax public gardens set to open on Good Friday - TheChronicleHerald.ca - http:// bit.ly/2p71Bsz";;;;"852243937494540289";https://twitter.com/HalifaxNSNews/status/852243937494540289
lokolHalifax;2017-04-12 14:13;0;0;"Halifax Public Gardens set for spring opening https:// halifax.lokol.me/s/halifax-publ ic-gardens-set-for-spring-opening-125700 … #lokol #halifax pic.twitter.com/UPbb4D2RfF";;;#lokol #halifax;"852208096067932160";https://twitter.com/lokolHalifax/status/852208096067932160
BeeHalifax;2017-04-12 12:33;0;1;"Halifax public gardens set to open on Good Friday #Halifax #bhivelabs http:// dld.bz/fAZDj";;;#Halifax #bhivelabs;"852182856197693441";https://twitter.com/BeeHalifax/status/852182856197693441
hfxgov;2017-04-12 09:57;18;50;"One of the first signs of spring! The Halifax Public Gardens officially opens for the season on Friday! http:// ow.ly/Boje30aNsV3 pic.twitter.com/6mzhMmOCvr";;;;"852143695310843904";https://twitter.com/hfxgov/status/852143695310843904
4hmosher;2017-04-11 13:22;0;0;"April 11 Halifax public gardens . #watchingspringcome pic.twitter.com/NDZGgZo7O7";;;#watchingspringcome;"851832959392940035";https://twitter.com/4hmosher/status/851832959392940035
BigJimRockola;2017-04-05 08:22;0;0;"Happy and proud to announce performances at the Halifax Public Gardens June & July. Come relax in the summer sun. Dates to follow.";;;;"849582958973509634";https://twitter.com/BigJimRockola/status/849582958973509634
james_rockola;2017-04-05 08:19;0;0;"Happy and proud to announce performances at the Halifax Public Gardens June and July. Come relax in the summer sun and have some fun with me";;;;"849582248169000960";https://twitter.com/james_rockola/status/849582248169000960
HfxPublicGarden;2017-04-02 20:53;0;2;"Thinking and looking forward to green and our charming Halifax Public Gardens . http:// fb.me/7xiXtqZKH";;;;"848684844313956352";https://twitter.com/HfxPublicGarden/status/848684844313956352
TamiChristina;2017-03-27 11:06;1;3;"http:// tammieforest.wordpress.com Halifax public gardens N.S Canada #Canada #novascotia #Halifax #photography#plants pic.twitter.com/HkiuGuxImP";;;#Canada #novascotia #Halifax #photography #plants;"846362715753009154";https://twitter.com/TamiChristina/status/846362715753009154
TamiChristina;2017-03-25 14:41;0;1;"https:// tammieforest.wordpress.com Halifax public gardens N.S Canada #Canada #novascotia #Halifax #photography pic.twitter.com/kX7WkxkOrc";;;#Canada #novascotia #Halifax #photography;"845692207092961281";https://twitter.com/TamiChristina/status/845692207092961281
joeysisco;2017-03-21 13:52;0;0;"Agreed. Its just odd that basically a decade ago we were all chilling in Halifax Public Gardens . Small world.";;;;"844230189202751489";https://twitter.com/joeysisco/status/844230189202751489
katherine1710;2017-03-19 20:34;0;0;"Tormenta para despedir el ultimo día del invierno @Halifax Public Gardens https://www. instagram.com/p/BR1ps3bl4AG/";;@Halifax;;"843606545854353409";https://twitter.com/katherine1710/status/843606545854353409
NS_Procure;2017-03-15 15:40;0;0;"Concession License Opportunity- Halifax Public Gardens | Halifax Regional Municipality (HRM) #nsmash https:// goo.gl/jM4Ehs";;;#nsmash;"842083022119792642";https://twitter.com/NS_Procure/status/842083022119792642
jschelleman;2017-03-14 22:42;0;0;"Happy Birthday bro #butter #teamthickness @Halifax Public Gardens https://www. instagram.com/p/BRpAY01FBXWb bCymK5EG6HHocGKybR6VrJAOHI0/ …";;@Halifax;#butter #teamthickness;"841826850720645122";https://twitter.com/jschelleman/status/841826850720645122
kathleenlgroves;2017-03-14 07:51;0;4;"Yesterday I found out that the #HalifaxPublicGardens hosts a Victoria Day Victorian tea party and I've never been so excited @katiepaige02";;@katiepaige02;#HalifaxPublicGardens;"841602804728922112";https://twitter.com/kathleenlgroves/status/841602804728922112
nyfoodiefamily;2017-02-23 16:14;0;0;"TBT to our October cruise when we saw this beautiful fountain in the #halifax public gardens!… https://www. instagram.com/p/BQ3fv6cFgSx/";;;#halifax;"834858938533298181";https://twitter.com/nyfoodiefamily/status/834858938533298181
Valentina_Kenny;2017-02-17 14:47;2;2;"Halifax Public Gardens captured again in my new painting Dahlias in Bloom. @HfxPublicGarden #lovegardens #HalifaxNS pic.twitter.com/zLhZA8iYs9";;@HfxPublicGarden;#lovegardens #HalifaxNS;"832662707065221121";https://twitter.com/Valentina_Kenny/status/832662707065221121
canada_agent;2017-02-16 10:22;0;0;"The Beautiful Halifax Public Gardens . #Canada150 #Travel http:// ift.tt/2lW1afr #canada";;;#Canada150 #Travel #canada;"832233641396801536";https://twitter.com/canada_agent/status/832233641396801536
RedDoorRealty;2017-02-14 07:46;0;0;"Another $330K set aside for historic building near #Halifax Public Gardens http://www. cbc.ca/1.3980000";;;#Halifax;"831469695958208513";https://twitter.com/RedDoorRealty/status/831469695958208513
GTB12;2017-02-13 07:10;1;2;"Welcome to Monday Morning at Halifax Public Gardens . #NSStorm pic.twitter.com/0H8G2BLHvb";;;#NSStorm;"831098269652627457";https://twitter.com/GTB12/status/831098269652627457
Bernardine;2017-02-02 21:43;1;2;"Halifax Public Gardens ! Watch out for the geese! http://www. halifaxpublicgardens.ca / #KidsnParksChat";;;#KidsnParksChat;"827331528606760965";https://twitter.com/Bernardine/status/827331528606760965
jaimekelley94;2017-01-30 19:16;0;0;"#lovethisdirtyoltown summer, i'm waiting for you @Halifax Public Gardens https://www. instagram.com/p/BP6BlBIAWe0/";;@Halifax;#lovethisdirtyoltown;"826207598407974912";https://twitter.com/jaimekelley94/status/826207598407974912
Geewhit;2017-01-24 19:35;0;0;"A hugely underutilized public space. I support this idea @SEA_Hfx in fact it should connect to #Halifax public gardens via foot bridge. https:// twitter.com/chronicleheral d/status/823870732585340929 …";;@SEA_Hfx;#Halifax;"824037899939250178";https://twitter.com/Geewhit/status/824037899939250178
HfxPublicGarden;2017-01-23 17:52;0;3;"It's Halifax Public Gardens . Tried to capture the wonderful curved affect. This is on the Spring Garden side. http:// fb.me/8t2egiasV";;;;"823649718932819969";https://twitter.com/HfxPublicGarden/status/823649718932819969
EllenJSim;2017-01-21 15:06;0;2;"The Halifax Public Gardens are lonesome for some company. pic.twitter.com/ocWGmJ9gvV";;;;"822883018054496256";https://twitter.com/EllenJSim/status/822883018054496256
danieltowsey;2017-01-20 03:49;0;0;"Fukushima Radiation Diseased Tree at Halifax Public Gardens https:// youtu.be/iNmryjScfr8 via @YouTube";;@YouTube;;"822350419355648000";https://twitter.com/danieltowsey/status/822350419355648000
Ron_George;2016-12-21 18:30;1;2;"#Halifax Public Gardens • Victorian era 1867 Confederation @YinkaVidal @JoeBabaian @Colin_Hung @nickisnpdx @drnic1 @CancerGeek @MaramMPH";;@YinkaVidal @JoeBabaian @Colin_Hung @nickisnpdx @drnic1 @CancerGeek @MaramMPH;#Halifax;"811700323077259265";https://twitter.com/Ron_George/status/811700323077259265
LeamanMarleigh;2016-12-20 21:43;0;0;"#day348of366 . The beautiful 1890's ornate iron gates to the Halifax Public Gardens . Designated a… https://www. instagram.com/p/BN9gitSgRW2/";;;#day348of366;"811386521093869568";https://twitter.com/LeamanMarleigh/status/811386521093869568
pkameka;2016-12-17 12:40;0;0;"Undisturbed snowfall - #snowscene #halifax @Halifax Public Gardens https://www. instagram.com/p/BOIBSjUjolK/";;@Halifax;#snowscene #halifax;"810162887037714433";https://twitter.com/pkameka/status/810162887037714433
br_myers;2016-12-15 16:59;0;1;"#Halifax Public Gardens look dreamy and magical today! http:// fb.me/3OWe2IiOb";;;#Halifax;"809503253952135168";https://twitter.com/br_myers/status/809503253952135168
br_myers;2016-12-15 16:52;0;0;"Closed for the season and covered in blankets of untouched snow, the #Halifax Public Gardens… https://www. instagram.com/p/BODUejOBUTd/";;;#Halifax;"809501395678154752";https://twitter.com/br_myers/status/809501395678154752
VisitNovaScotia;2016-12-13 11:47;16;37;"Those beautiful 1890's ornate iron gates to the Halifax Public Gardens are decorated for the season.|| Photo by @marleigh60 @ExploreCanada pic.twitter.com/DmzrmlPyTe";;@marleigh60 @ExploreCanada;;"808699952243310592";https://twitter.com/VisitNovaScotia/status/808699952243310592
TheZombiePunk;2016-12-10 22:52;0;0;"Just posted a photo @Halifax Public Gardens https://www. instagram.com/p/BN3DloxBqRW/";;@Halifax;;"807780021406285824";https://twitter.com/TheZombiePunk/status/807780021406285824
jvangurp;2016-12-08 21:55;0;1;"Could this be the vestige of Freshwater Brook? #hrm #Halifax #halifaxpublicgardens pic.twitter.com/TqjJi4CPGI";;;#hrm #Halifax #halifaxpublicgardens;"807040832335450112";https://twitter.com/jvangurp/status/807040832335450112
HomesInHalifax1;2016-12-05 15:40;0;0;"Live in style at Pavilion at South Park, overlooking the beautiful Halifax Public Gardens ! Contact us for more info #homesinhalifax https:// twitter.com/HfxPublicGarde n/status/805844049504698368 …";;;#homesinhalifax;"805859400246296576";https://twitter.com/HomesInHalifax1/status/805859400246296576
Call_YourMom;2016-12-03 13:13;0;0;"Halifax Public Gardens ... #halifax #beautiful @Halifax Public Gardens https://www. instagram.com/p/BNkB6F8hZ7-/";;@Halifax;#halifax #beautiful;"805097699146014720";https://twitter.com/Call_YourMom/status/805097699146014720
leilarobynxo;2016-11-30 22:22;0;0;"Miss seeing my bff everyday #pram @Halifax Public Gardens https://www. instagram.com/p/BNdST5EBGVLv TcAAQEFrTEL55CLdKtSdUCqzTk0/ …";;@Halifax;#pram;"804148614486331392";https://twitter.com/leilarobynxo/status/804148614486331392
NovaBrunswick;2016-11-29 10:55;0;0;"The Halifax Public Gardens in Halifax, Nova Scotia http:// pinterest.com/pin/2894970822 81929744/ …";;;;"803613412353785856";https://twitter.com/NovaBrunswick/status/803613412353785856
bambrosephoto;2016-11-27 11:00;0;0;"FALL IN HALIFAX PUBLIC GARDENS | NOVEMBER 2016 | Halifax, Nova Scotia https:// tmblr.co/ZiKHCw2FB4LiE";;;;"802889860847726592";https://twitter.com/bambrosephoto/status/802889860847726592
azuretan;2016-11-26 11:47;0;0;"I'm at Halifax Public Gardens in Halifax, NS https://www. swarmapp.com/c/h1ECpNv3G43 pic.twitter.com/DOq8bmrjst";;;;"802539368804012033";https://twitter.com/azuretan/status/802539368804012033
_Tosin;2016-11-26 06:14;0;0;"Halifax Public Gardens (Looking like a Romantic Place in this Photo). http:// fb.me/10IFwxZnK";;;;"802455388163477504";https://twitter.com/_Tosin/status/802455388163477504
_Tosin;2016-11-26 05:00;0;0;"Springtime @the Halifax Public Gardens . http:// fb.me/48wL7xMM1";;@the;;"802436845229539328";https://twitter.com/_Tosin/status/802436845229539328
EBreitbarth;2016-11-25 16:08;0;0;"hello halifax! #ohcanada @Halifax Public Gardens https://www. instagram.com/p/BNPvkbUDZciI ySAtDUPeaHbK_AFObfofrr-fWY0/ …";;@Halifax;#ohcanada;"802242619577368578";https://twitter.com/EBreitbarth/status/802242619577368578
TerryRudderham;2016-11-24 12:52;0;0;"I walked through the Halifax Public Gardens this morning. This tree, which I posted a photo of a… https://www. instagram.com/p/BNM0SWWDcRr/";;;;"801830780339097600";https://twitter.com/TerryRudderham/status/801830780339097600
TerryRudderham;2016-11-22 23:01;0;0;"This is the first in a row of trees by the Halifax Public Gardens that always keep their leaves… https://www. instagram.com/p/BNIwZqNjMdP/";;;;"801259286437515264";https://twitter.com/TerryRudderham/status/801259286437515264
GabeSotomayor;2016-11-20 14:58;0;0;"Halifax, Nova Scotia, Canada @Halifax Public Gardens https://www. instagram.com/p/BNCvhFhBELT/";;@Halifax;;"800412921687785472";https://twitter.com/GabeSotomayor/status/800412921687785472
EricEdmeades;2016-11-19 11:00;0;1;"Time is definitely relative.... @Halifax Public Gardens http:// ln.is/www.instagram. com/p/hxr83 …";;@Halifax;;"799990690448977920";https://twitter.com/EricEdmeades/status/799990690448977920
Miami_Water;2016-11-19 08:46;0;0;"The Halifax Public Gardens where all the trees are sick and dying.. I was zoomed into a flower doing a... http:// youtu.be/Iwonn8X4BF8?a";;;;"799956937706192896";https://twitter.com/Miami_Water/status/799956937706192896
DGinDC;2016-11-17 18:45;0;1;"#November #halifaxpublicgardens #FallFoliage pic.twitter.com/DNhAc15AsS";;;#November #halifaxpublicgardens #FallFoliage;"799383014497255428";https://twitter.com/DGinDC/status/799383014497255428
photosocool;2016-11-10 11:07;0;0;"Halifax public Gardens . pic.twitter.com/opEhIPBtte";;;;"796730952168902656";https://twitter.com/photosocool/status/796730952168902656
jaydoertl;2016-11-09 20:42;0;0;"Halifax public Gardens . via /r/photocritique https://www. reddit.com/r/photocritiqu e/comments/5c4u0s/halifax_public_gardens/?utm_source=ifttt … pic.twitter.com/bDmV8JBXTC";;;;"796513263181766656";https://twitter.com/jaydoertl/status/796513263181766656
LMBoutilier;2016-11-08 16:39;0;1;"Crisp fall walk through public gardens today! #fall #outdoor #lunchout @Halifax Public Gardens https://www. instagram.com/p/BMkBoMhgyqb/";;@Halifax;#fall #outdoor #lunchout;"796089880912822272";https://twitter.com/LMBoutilier/status/796089880912822272
The_Fuzz74;2016-11-07 14:24;0;2;"Just a beautiful day in #Halifax @Halifax Public Gardens https://www. instagram.com/p/BMhNUfhjg9L/";;@Halifax;#Halifax;"795693382270128128";https://twitter.com/The_Fuzz74/status/795693382270128128
IndigoWayworth;2016-11-07 14:17;0;1;"Pull up the anchor, ride the wheel plenty for all that it's worth @Halifax Public Gardens https://www. instagram.com/p/BMhMi_Rh_9B/";;@Halifax;;"795691683119665152";https://twitter.com/IndigoWayworth/status/795691683119665152
Delphis_S;2016-11-05 20:09;0;0;"The Family! Mama, Papa & Baby @Halifax Public Gardens https://www. instagram.com/p/BMcG4W_ADGV/";;@Halifax;;"795040468560179200";https://twitter.com/Delphis_S/status/795040468560179200
halifaxnoise;2016-11-05 16:00;1;1;"The Halifax Public Gardens will close for the 2016 season at dusk Saturday ( TONIGHT ) . T… http:// ift.tt/2fOGXZL pic.twitter.com/XyH8nmsDTh";;;;"794977669012189184";https://twitter.com/halifaxnoise/status/794977669012189184
mcisaac12;2016-11-05 15:56;0;0;"Went to the Public Gardens for the first time today @Halifax Public Gardens https://www. instagram.com/p/BMcHYHTAd5r/";;@Halifax;;"794976622810120193";https://twitter.com/mcisaac12/status/794976622810120193
HalifaxNSNews;2016-11-05 15:36;0;0;"Halifax Public Gardens closing for the season - CBC.ca - http:// bit.ly/2fGoEXt";;;;"794971553196900355";https://twitter.com/HalifaxNSNews/status/794971553196900355
halifaxnews;2016-11-05 13:36;3;2;"Halifax Public Gardens closing for the season tonight at dusk http:// dld.bz/fdASS";;;;"794941527118188544";https://twitter.com/halifaxnews/status/794941527118188544
CBCNS;2016-11-05 13:35;2;2;"Halifax Public Gardens closing for the season tonight at dusk http:// ift.tt/2fmSdtB pic.twitter.com/y0CNIYXVDy";;;;"794941156006227969";https://twitter.com/CBCNS/status/794941156006227969
BreakingNSNews;2016-11-05 13:20;2;0;"Halifax Public Gardens closing for the season tonight at dusk: The gardens may open by chance during winter if… http:// m.tbnn.it/Mbm06f";;;;"794937331211849728";https://twitter.com/BreakingNSNews/status/794937331211849728
jeffsmeltzer12;2016-11-05 12:15;0;0;"The last day for the Public Gardens in #halifax #novascotiainfall @Halifax Public Gardens https://www. instagram.com/p/BMbuH46jHtE/";;@Halifax;#halifax #novascotiainfall;"794921090980126720";https://twitter.com/jeffsmeltzer12/status/794921090980126720
azuretan;2016-11-05 09:01;0;0;"I'm at Halifax Public Gardens in Halifax, NS https://www. swarmapp.com/c/iZEiKc7HBiQ";;;;"794872177355067392";https://twitter.com/azuretan/status/794872177355067392
haligonia;2016-11-04 07:59;1;0;"Headlines | Halifax Public Gardens closing this weekend for the 2016 season https:// haligonia.ca/halifax-public -gardens-closing-this-weekend-for-the-2016-season-170450/?utm_source=dlvr.it&utm_medium=twitter&utm_campaign=haligonia …";;;;"794494174624038912";https://twitter.com/haligonia/status/794494174624038912
FX1019;2016-11-04 07:30;0;0;"I've often wondered why we close the Halifax Public Gardens ...considering it can be gorgeous in winter too.... http:// fb.me/5bgEmvzfz";;;;"794486869949980672";https://twitter.com/FX1019/status/794486869949980672
Jer_Godfrey;2016-11-04 06:39;0;0;"The Halifax Public Gardens close tomorrow at dusk. #halifax #winteriscoming";;;#halifax #winteriscoming;"794474198064304128";https://twitter.com/Jer_Godfrey/status/794474198064304128
haligonia;2016-11-03 19:59;1;0;"Headlines | Halifax Public Gardens closing this weekend for the 2016 season https:// haligonia.ca/halifax-public -gardens-closing-this-weekend-for-the-2016-season-170450/?utm_source=dlvr.it&utm_medium=twitter&utm_campaign=haligonia …";;;;"794312990547771392";https://twitter.com/haligonia/status/794312990547771392
TopHalifaxNow;2016-11-03 11:27;0;0;"Halifax Public Gardens will close for the season @dusk on Saturday. could be open on fair weather days through the… http:// toplocalnow.com/ca/halifax";;@dusk;;"794184121480118273";https://twitter.com/TopHalifaxNow/status/794184121480118273
thestarhalifax;2016-11-03 10:51;5;3;"A sure sign winter is coming: Halifax Public Gardens to close for the season this weekend http:// ow.ly/3awZ305OD7H pic.twitter.com/Zd1refu0pQ";;;;"794175282508951552";https://twitter.com/thestarhalifax/status/794175282508951552
SandySmithCBC;2016-11-03 10:19;5;1;"#Halifax Public Gardens will close for the season @dusk on Saturday. could be open on fair weather days through the winter, as usual.";;@dusk;#Halifax;"794167023169310720";https://twitter.com/SandySmithCBC/status/794167023169310720
hfxcivicevents;2016-11-02 15:19;3;2;"The Halifax Public Gardens will close for the season on Saturday, November 5, 2016. Open by chance throughout the... http:// fb.me/1CjwUDWFF";;;;"793880204510842880";https://twitter.com/hfxcivicevents/status/793880204510842880