username;date;retweets;favorites;text;geo;mentions;hashtags;id;permalink
hfxgov;2018-04-27 13:25;22;71;"Our Agave has been planted and is enjoying the beautiful weather. Visit the Halifax Public Gardens today! pic.twitter.com/Yfq7jWSoin";;;;"989903346097061889";https://twitter.com/hfxgov/status/989903346097061889
hfxgov;2018-04-27 09:42;1;1;"One of the entrance gates to the Halifax Public Gardens (corner of Spring Garden Rd, and South Park St,) will be closed for the day. All other entrances will be maintained https:// bit.ly/2I2NwmV";;;;"989847152250773505";https://twitter.com/hfxgov/status/989847152250773505
HalifaxNSNews;2018-04-26 15:36;0;0;"Halifax Public Gardens ' agave hanging in there, despite less than ideal weather for desert plant - T - https://www. thestar.com/halifax/2018/0 4/26/halifax-public-gardens-agave-hanging-in-there-despite-less-than-ideal-weather-for-desert-plant.html …";;;;"989573841201516544";https://twitter.com/HalifaxNSNews/status/989573841201516544
phonepicshfx;2018-04-23 07:45;2;10;"#halifaxpublicgardens yesterday. Sitting on a park bench in the warm sun with Mrs. Phonepics warms the heart. pic.twitter.com/ogsU3fF4Pd";;;#halifaxpublicgardens;"988368233983070210";https://twitter.com/phonepicshfx/status/988368233983070210
kkingrscj;2018-04-22 16:50;0;0;"Consider the Lilies: Earth Day Cathedral http:// bit.ly/riotousglory . #WeAreSacredHeart #EarthDay2018 #RSCJ #HalifaxPublicGardens";;;#WeAreSacredHeart #EarthDay2018 #RSCJ #HalifaxPublicGardens;"988143138945601536";https://twitter.com/kkingrscj/status/988143138945601536
anetto;2018-04-20 14:01;0;0;"Easy to find interesting places in walking distance. Like the Halifax Public Gardens . Saw the giant agave plant growing 15 cm per day. #Halifax pic.twitter.com/krtJ53i4IP";;;#Halifax;"987375710867279872";https://twitter.com/anetto/status/987375710867279872
virginiamwhite;2018-04-19 14:24;0;0;"Stalk of plant at Halifax Public Gardens could reach 40 feet tall (3 photos) https://www. halifaxtoday.ca/local-news/sta lk-of-plant-at-halifax-public-gardens-could-reach-40-feet-tall-3-photos-897824 … via @HalifaxToday";;@HalifaxToday;;"987019184768012290";https://twitter.com/virginiamwhite/status/987019184768012290
StooMetz;2018-04-19 10:43;0;0;"One of the Halifax Public Gardens ' Agave americana, commonly known as the century plant, sent out its reproductive stalk — or mast — last week and continues to grow at a staggering rate of more than 15 centimetres a day. http://www. cbc.ca/news/canada/no va-scotia/agave-public-gardens-plant-1.4624913 …";;;;"986963589264281600";https://twitter.com/StooMetz/status/986963589264281600
NikiJabbour;2018-04-19 07:25;1;6;"Stalk of plant at Halifax Public Gardens could reach 40 feet tall (3 photos) https://www. halifaxtoday.ca/local-news/sta lk-of-plant-at-halifax-public-gardens-could-reach-40-feet-tall-3-photos-897824 … via @HalifaxToday";;@HalifaxToday;;"986913561602592769";https://twitter.com/NikiJabbour/status/986913561602592769
rj_audiman;2018-04-18 20:34;1;3;"Maybe put a camera on it for the record #timelapse #agave #halifaxpublicgardens";;;#timelapse #agave #halifaxpublicgardens;"986749725654376448";https://twitter.com/rj_audiman/status/986749725654376448
valentino_nora;2018-04-18 18:44;0;0;"A peek at what? Something at the @HalifaxPublicGardens ?";;@HalifaxPublicGardens;;"986722041821724672";https://twitter.com/valentino_nora/status/986722041821724672
NEWS957;2018-04-18 18:00;3;4;"Stalk of plant at Halifax Public Gardens could reach 40 feet tall https://www. halifaxtoday.ca/local-news/sta lk-of-plant-at-halifax-public-gardens-could-reach-40-feet-tall-3-photos-897824 …";;;;"986710975163191296";https://twitter.com/NEWS957/status/986710975163191296
HalifaxToday;2018-04-18 17:16;0;0;"Stalk of plant at Halifax Public Gardens could reach 40 feet tall (3 photos) https://www. halifaxtoday.ca/local-news/sta lk-of-plant-at-halifax-public-gardens-could-reach-40-feet-tall-3-photos-897824?utm_source=dlvr.it&utm_medium=twitter … pic.twitter.com/J4IGcBqdEG";;;;"986700025148334080";https://twitter.com/HalifaxToday/status/986700025148334080
lokolHalifax;2018-04-18 13:00;0;0;"Halifax Public Gardens Agave plant beginning to flower https:// halifax.lokol.me/s/halifax-publ ic-gardens-agave-plant-beginning-to-flower-47626-1335219 … #lokol #halifax";;;#lokol #halifax;"986635698492067845";https://twitter.com/lokolHalifax/status/986635698492067845
OtizJ;2018-04-18 12:29;0;0;"Retweeted hfxgov ( @hfxgov ): Residents are invited to visit the Halifax Public Gardens to witness the blooming process of one of our largest Agave plants - a moment we've been waiting more than two decade for! https:// bit.ly/2HwKadS pic.twitter.com/CRQDEADC0k";;@hfxgov;;"986627701216772096";https://twitter.com/OtizJ/status/986627701216772096
hfxgov;2018-04-18 11:43;110;183;"Residents are invited to visit the Halifax Public Gardens to witness the blooming process of one of our largest Agave plants - a moment we've been waiting more than two decade for! https:// bit.ly/2HwKadS pic.twitter.com/3TzIF6sObo";;;;"986616289526509573";https://twitter.com/hfxgov/status/986616289526509573
hfxgov;2018-04-17 14:00;0;1;"The Halifax Public Gardens will be closed for the rest of the day due to weather and pathway conditions";;;;"986288327816081410";https://twitter.com/hfxgov/status/986288327816081410
NikiJabbour;2018-04-17 07:32;3;8;"Have you ever seen an agave plant flower? If you're in Halifax, you'll want to check out the 25 year old specimen about to bloom at the Halifax Public Gardens . Details below. https://www. facebook.com/NikiJabbour/po sts/1924652797576973 …";;;;"986190757978624000";https://twitter.com/NikiJabbour/status/986190757978624000
SallyMeadows;2018-04-16 13:55;0;0;"Halifax, Nova Scotia is one of my favourite cities to visit. Check out my most recent blog about the #HalifaxPublicGardens https:// sallymeadows.com/home/blog/hali fax-public-gardens-18-gorgeous-photos … @ExploreCanada @ExploreHalifax @TourismNS #Halifax #NovaScotia #gardens #discoverhalifax #halifaxtourism";;@ExploreCanada @ExploreHalifax @TourismNS;#HalifaxPublicGardens #Halifax #NovaScotia #gardens #discoverhalifax #halifaxtourism;"985924734310277120";https://twitter.com/SallyMeadows/status/985924734310277120
HalifaxEditor;2018-04-16 08:49;2;3;"Researcher Claire Halstead explores what the Halifax Public Gardens mean to the city. @Suzanne_Rent reports for @HalifaxMagazine . http:// halifaxmag.com/cityscape/cele brating-the-heart-of-halifax/ … pic.twitter.com/wjLuj5wGlh";;@Suzanne_Rent @HalifaxMagazine;;"985847578981031936";https://twitter.com/HalifaxEditor/status/985847578981031936
marliesharting;2018-04-06 20:39;0;0;"Colorful Public Garden at Halifax @Halifax Public Gardens https://www. instagram.com/p/BhP2vTeg2Mo/";;@Halifax;;"982402394557263872";https://twitter.com/marliesharting/status/982402394557263872
AFHalifax;2018-04-06 17:23;0;0;"ILS NOUS FONT CONFIANCE Nous sommes heureux d'ajouter @DowntownHalifax la liste de nos sponsors et des lieux de concerts pour l'organisation de Make Music Day 2018! Music Day venues so far are: The Hydrostone area Halifax Public Gardens . Stay tuned, share the event pic.twitter.com/JDAsdRlCmG";;@DowntownHalifax;;"982353019240157184";https://twitter.com/AFHalifax/status/982353019240157184
HalifaxMagazine;2018-04-04 11:30;3;4;"Researcher @ClaireLHalstead explores what the Halifax Public Gardens mean to the city. @Suzanne_Rent reports for #HalifaxMagazine . http:// halifaxmag.com/cityscape/cele brating-the-heart-of-halifax/ … pic.twitter.com/RCPkiRh72j";;@ClaireLHalstead @Suzanne_Rent;#HalifaxMagazine;"981539539943677952";https://twitter.com/HalifaxMagazine/status/981539539943677952
brianm564;2018-03-30 07:11;0;1;"Visiting United Empire Loyalist plaque and tree in Halifax Public Gardens #unitedempireloyalists #halifax #novascotia https:// youtu.be/QfBu9l0c9k4";;;#unitedempireloyalists #halifax #novascotia;"979662448516091904";https://twitter.com/brianm564/status/979662448516091904
brianm564;2018-03-30 07:07;0;2;"United Empire Loyalist Plaque underneath tree in Halifax Public Gardens in recognition of Loyalist Bicentennial (1783 - 1983) #unitedempireloyalists #halifax #novascotia pic.twitter.com/BANTJ5RhH5";;;#unitedempireloyalists #halifax #novascotia;"979661418357194752";https://twitter.com/brianm564/status/979661418357194752
chronicleherald;2018-03-29 07:18;2;0;"John DeMont column: The de-pooping of the Halifax Public Gardens pond http:// herald.ca/ZcLV @CH_coalblackhrt";;@CH_coalblackhrt;;"979301874456285184";https://twitter.com/chronicleherald/status/979301874456285184
SojournTravel;2018-03-28 17:28;1;2;"CANADA Nova Scotia. Halifax Public Gardens http://www. halifaxpublicgardens.ca / #Canada pic.twitter.com/G3H5jxjA9x";;;#Canada;"979092936410456064";https://twitter.com/SojournTravel/status/979092936410456064
SouthDixieTires;2018-03-28 16:15;0;0;"I liked a @YouTube video http:// youtu.be/lsD5Hm71boI?a Halifax Public Gardens | 2017 | Nova Scotia | Canada";;@YouTube;;"979074628328067072";https://twitter.com/SouthDixieTires/status/979074628328067072
AlanBrown470;2018-03-27 19:06;0;0;"Just posted a photo @Halifax Public Gardens https://www. instagram.com/p/Bg18H6BlH7i/";;@Halifax;;"978755046677663746";https://twitter.com/AlanBrown470/status/978755046677663746
DalPres;2018-03-27 17:55;0;24;"Great to see flower beds springing back to life in the Halifax Public Gardens pic.twitter.com/UDS6oXiRny";;;;"978737205177913346";https://twitter.com/DalPres/status/978737205177913346
AlanBrown470;2018-03-26 21:18;0;0;"Isn't it pretty #public #garden #tree #state #underthewillow #halifax @Halifax Public Gardens https://www. instagram.com/p/BgzmeIgFjcF/";;@Halifax;#public #garden #tree #state #underthewillow #halifax;"978425966811852801";https://twitter.com/AlanBrown470/status/978425966811852801
LakelandPlants;2018-03-26 08:55;0;4;"Quick poll! Who else is SUPER EXCITED to see the Halifax Public Gardens in full bloom soon? pic.twitter.com/P53Cp9QpHn";;;;"978238910873653248";https://twitter.com/LakelandPlants/status/978238910873653248
AlanBrown470;2018-03-25 13:05;0;0;"Just posted a photo @Halifax Public Gardens https://www. instagram.com/p/BgwJS4NFkPh/";;@Halifax;;"977939596490113024";https://twitter.com/AlanBrown470/status/977939596490113024
AlanBrown470;2018-03-23 17:33;0;0;"Went for a walk @Halifax Public Gardens https://www. instagram.com/p/BgreWEHFeDr/";;@Halifax;;"977282200180686850";https://twitter.com/AlanBrown470/status/977282200180686850
SojournTravel;2018-03-22 16:30;2;2;"Halifax Public Gardens http://www. halifaxpublicgardens.ca / Nova Scotia, Canada #spring pic.twitter.com/7yz5ws3juU";;;#spring;"976904021284999170";https://twitter.com/SojournTravel/status/976904021284999170
RedDoorRealty;2018-03-22 07:40;0;4;"#TBT Good morning! It's springtime (officially at least) in Nova Scotia. Any guesses when this Nova Scotia Archives photo of a couple enjoying the Halifax Public Gardens may have been taken? Stay warm, everyone! pic.twitter.com/jtyUhV8tdQ";;;#TBT;"976770551699165184";https://twitter.com/RedDoorRealty/status/976770551699165184
bedbugbusterhfx;2018-03-18 20:48;0;0;"Halifax Public Gardens https:// tmblr.co/ZUCywi2WCsQ_h";;;;"975519455768915968";https://twitter.com/bedbugbusterhfx/status/975519455768915968
ButchartSales;2018-03-14 12:43;2;4;"We can't wait to visit the other side of @GardensCanada Garden Route - the Halifax Public Gardens ! #RVC2018 #GardenTourism https:// twitter.com/Rendez_VousCAN /status/973940242683236352 …";;@GardensCanada;#RVC2018 #GardenTourism;"973947646481022979";https://twitter.com/ButchartSales/status/973947646481022979
haligonia;2018-03-14 09:26;0;2;"RT @hfxgov : The Halifax Public Gardens will remain closed today due to high winds and poor pathway conditions";;@hfxgov;;"973898102150189056";https://twitter.com/haligonia/status/973898102150189056
hfxgov;2018-03-14 09:23;2;0;"The Halifax Public Gardens will remain closed today due to high winds and poor pathway conditions";;;;"973897296818724864";https://twitter.com/hfxgov/status/973897296818724864
NatashaPace;2018-03-13 15:43;1;2;". @hfxgov says the #Halifax Public Gardens will remain closed tomorrow morning due to inclement weather #nsstorm";;@hfxgov;#Halifax #nsstorm;"973630708743901184";https://twitter.com/NatashaPace/status/973630708743901184
hfxgov;2018-03-13 15:41;3;1;"The Halifax Public Gardens will remain closed tomorrow morning due to inclement weather";;;;"973630229754335232";https://twitter.com/hfxgov/status/973630229754335232
KerwinHynes;2018-03-10 19:08;0;0;"I liked a @YouTube video http:// youtu.be/9jBnlxX9uv8?a Halifax Public Gardens during the winter";;@YouTube;;"972610173310308354";https://twitter.com/KerwinHynes/status/972610173310308354
bedbugbusterhfx;2018-03-09 23:03;0;0;"Halifax Public Gardens Fountain https:// tmblr.co/ZUCywi2VwqbCm";;;;"972306870932303873";https://twitter.com/bedbugbusterhfx/status/972306870932303873
bedbugbusterhfx;2018-03-09 22:45;0;0;"Halifax Public Gardens - Located in the heart of Halifax. https:// tmblr.co/ZUCywi2Vwor_K";;;;"972302341822205952";https://twitter.com/bedbugbusterhfx/status/972302341822205952
bedbugbusterhfx;2018-03-09 22:42;0;0;"Public Gardens in Halifax - Public gardens in Halifax. https:// tmblr.co/ZUCywi2Vwoc20";;;;"972301674361573376";https://twitter.com/bedbugbusterhfx/status/972301674361573376
bedbugbusterhfx;2018-03-09 22:32;0;0;"Halifax Public Gardens Fountain - Kelly Mercer is a photographer that lives in Halifax. https:// tmblr.co/ZUCywi2Vwncc5";;;;"972299093136629760";https://twitter.com/bedbugbusterhfx/status/972299093136629760
halifaxnoise;2018-03-09 08:05;3;19;"Yesterday, from @layucif — Beautiful spring day brought to you from Halifax , NS . . . . . #halifaxpublicgardens #victoriangardens #publicgarden #halifax #halifaxnoise http:// ift.tt/2DgSetq pic.twitter.com/gxKF4Xvzdm";;@layucif;#halifaxpublicgardens #victoriangardens #publicgarden #halifax #halifaxnoise;"972080964984885250";https://twitter.com/halifaxnoise/status/972080964984885250
jardino3;2018-03-06 15:27;0;1;"Dredging the droppings has begun! @Halifax Public Gardens https://www. instagram.com/p/Bf_lUUWFUOR/";;@Halifax;;"971105075472068608";https://twitter.com/jardino3/status/971105075472068608
CBCDavid;2018-03-06 10:29;0;0;"Poop-filled pond at Halifax Public Gardens gets drained today http://www. cbc.ca/news/canada/no va-scotia/halifax-public-garden-griffins-pond-cleanup-starts-1.4561761 …";;;;"971029973338243072";https://twitter.com/CBCDavid/status/971029973338243072
CBCNS;2018-03-05 18:00;1;8;"Poop-filled pond at Halifax Public Gardens gets drained today https:// buff.ly/2tiwTjt pic.twitter.com/bFXMgwIrjz";;;;"970781010513354752";https://twitter.com/CBCNS/status/970781010513354752
CanadaNews777;2018-03-05 17:25;0;0;"Poop-filled pond at Halifax Public Gardens gets drained today http:// tinyurl.com/ya4oo9e2 :Auto pickup by wikyou";;;;"970772203837911040";https://twitter.com/CanadaNews777/status/970772203837911040
summedupcanada;2018-03-05 16:55;0;0;"Poop-filled pond at Halifax Public Gardens gets drained today http://www. newssummedup.com/a/v6wwy1";;;;"970764773632630784";https://twitter.com/summedupcanada/status/970764773632630784
halifaxnoise;2018-03-05 11:13;0;0;"Ew .. Poop-filled pond at Halifax Public Gardens gets flushed today http://www. cbc.ca/news/canada/no va-scotia/halifax-public-garden-griffins-pond-cleanup-starts-1.4561761 …";;;;"970678606765621249";https://twitter.com/halifaxnoise/status/970678606765621249
CanGeographers;2018-03-05 11:08;1;4;"Poop-filled pond at Halifax Public Gardens gets flushed today https://www. cbc.ca/1.4561761 pic.twitter.com/CHp4qzFs9e";;;;"970677411061760000";https://twitter.com/CanGeographers/status/970677411061760000
LM_Campbell;2018-03-05 08:44;1;2;"The Halifax Public Gardens Duck Pond gets another flushing. I wonder if daylighting Freshwater Brook might help with this issue? Would like to learn more. http://www. cbc.ca/news/canada/no va-scotia/halifax-public-garden-griffins-pond-cleanup-starts-1.4561761 …";;;;"970641117464203264";https://twitter.com/LM_Campbell/status/970641117464203264
chasmalloy;2018-03-05 08:16;0;0;"Poop-filled pond at Halifax Public Gardens gets flushed today http://www. cbc.ca/1.4561761";;;;"970634057083219968";https://twitter.com/chasmalloy/status/970634057083219968
TrafficNS;2018-03-05 07:54;2;5;"Traffic disruptions expected near the Halifax Public Gardens starting today. The reason? Crews removing 1-metre thick layer of duck poop, left to accumulate in Griffins Pond for decades. Story: http://www. cbc.ca/news/canada/no va-scotia/halifax-public-garden-griffins-pond-cleanup-starts-1.4561761 … pic.twitter.com/rN85xcjHeZ (via @Brett_CBC )";;@Brett_CBC;;"970628522157817856";https://twitter.com/TrafficNS/status/970628522157817856
Brett_CBC;2018-03-05 07:48;16;35;"Traffic disruptions expected near the Halifax Public Gardens starting today. The reason? Crews removing 1-metre thick layer of duck poop, left to accumulate in Griffins Pond for decades. Story: http://www. cbc.ca/news/canada/no va-scotia/halifax-public-garden-griffins-pond-cleanup-starts-1.4561761 … pic.twitter.com/kS8PlLJruY";;;;"970627087827656704";https://twitter.com/Brett_CBC/status/970627087827656704
HalifaxNSNews;2018-03-05 07:36;2;2;"Poop-filled pond at Halifax Public Gardens gets flushed today - http:// CBC.ca - http://www. cbc.ca/news/canada/no va-scotia/halifax-public-garden-griffins-pond-cleanup-starts-1.4561761 …";;;;"970623970973118465";https://twitter.com/HalifaxNSNews/status/970623970973118465
halifaxnews;2018-03-05 07:32;2;8;"Poop-filled pond at Halifax Public Gardens gets flushed today http:// dld.bz/gETGa";;;;"970622967632814082";https://twitter.com/halifaxnews/status/970622967632814082
CBCNS;2018-03-05 07:12;2;7;"Poop-filled pond at Halifax Public Gardens gets flushed today https:// buff.ly/2D0ufyc pic.twitter.com/oJKoG7I6d2";;;;"970617927316725760";https://twitter.com/CBCNS/status/970617927316725760
citylifesue;2018-03-04 18:32;3;20;"Hard to believe that they used to keep the Halifax Public Gardens closed all winter. I had a lovely stroll through today. pic.twitter.com/dn0YH3IdT4";;;;"970426752945348608";https://twitter.com/citylifesue/status/970426752945348608
SandCastleTO;2018-03-02 19:13;0;0;"Just posted a photo @Halifax Public Gardens https://www. instagram.com/p/Bf1r_A1BRe7/";;@Halifax;;"969712368690384896";https://twitter.com/SandCastleTO/status/969712368690384896
bbundale;2018-03-02 17:03;0;1;". @fwillick this made me think of you: HRM to start the dirty job of removing "sediment" from Griffins Pond in the Halifax Public Gardens next week. #Halifax pic.twitter.com/UNmm9LnXKa";;@fwillick;#Halifax;"969679624501424128";https://twitter.com/bbundale/status/969679624501424128
ExploreNova;2018-03-01 21:38;0;1;"#TBT - Summer sites and sounds from the Halifax Public Gardens . #NovaScotia pic.twitter.com/6DqmQA3lC6";;;#TBT #NovaScotia;"969386552047661057";https://twitter.com/ExploreNova/status/969386552047661057
beakphoto;2018-02-28 02:18;0;0;"Horticultural Hall, Halifax Public Gardens . #leica #mp #ferrania #p30 #filmferrania … https://www. instagram.com/p/BfuuOEZBU7v/";;;#leica #mp #ferrania #p30 #filmferrania;"968732127092191233";https://twitter.com/beakphoto/status/968732127092191233
birdiebent;2018-02-27 08:48;0;1;"Gorgeous morning in the the gardens @Halifax Public Gardens https://www. instagram.com/p/Bfs2CDsBMJXb 1zbo4k3g7yY5x41VCdcX8bzWbI0/ …";;@Halifax;;"968467816709058561";https://twitter.com/birdiebent/status/968467816709058561
NocturneHalifax;2018-02-23 16:46;0;0;"This series of paintings reminded us (among other things) of TFW Robyn Moody's Overview: Experiment 3 transported us from the Halifax Public Gardens into outer space for #NocHFX17 #NocHFX Editor Pick: “Public Views” by Artist Mary Henderson https:// buff.ly/2Guwkoc pic.twitter.com/1ieJpWWzj7";;;#NocHFX17 #NocHFX;"967138505070608384";https://twitter.com/NocturneHalifax/status/967138505070608384
isans_ca;2018-02-20 11:56;1;2;"Here’s a look at last week’s City Walk: a chance for newcomers to explore the city by public transit. Stops included the #Halifax Public Gardens, the Central Library and the #Dartmouth Farmers' Market. @HfxPublicGarden @hfxpublib @AlderneyLanding pic.twitter.com/k3AndXn0Zl";;@HfxPublicGarden @hfxpublib @AlderneyLanding;#Halifax #Dartmouth;"965978351604240384";https://twitter.com/isans_ca/status/965978351604240384
CraigP_Morrison;2018-02-20 08:14;0;1;"At the Halifax Public Gardens . @HfxPublicGarden #Halifax #exploreNovaScotia #photography #photograph #art pic.twitter.com/Hp1mcSXohy";;@HfxPublicGarden;#Halifax #exploreNovaScotia #photography #photograph #art;"965922709753532416";https://twitter.com/CraigP_Morrison/status/965922709753532416
hayleybethadams;2018-02-18 18:13;0;0;"Seems I was a little optimistic with the sun.. @Halifax Public Gardens https://www. instagram.com/p/BfWrgpLl6vS/";;@Halifax;;"965348463834812418";https://twitter.com/hayleybethadams/status/965348463834812418
Rouroulo;2018-02-15 16:07;2;4;"Wanderlust Journal 20 - Halifax Public Gardens https:// rourouonline.com/2018/02/15/wan derlust-journal-20-halifax-public-gardens/ … #amwriting #WriteThurs #MyStory #journaling #photography";;;#amwriting #WriteThurs #MyStory #journaling #photography;"964229698573291520";https://twitter.com/Rouroulo/status/964229698573291520
the_xplaura;2018-02-13 22:42;0;0;"To all my Galentines out there. Lovely roses courtesy of the Halifax Public Gardens … https://www. instagram.com/p/BfKSYweBa2Q/";;;;"963604373011013632";https://twitter.com/the_xplaura/status/963604373011013632
moviesoutnoworg;2018-02-12 20:02;0;0;"#fitnesstracker Nice Women Jogging photos - A few nice women jogging images I found: 2013 Underwear Affair Calgary Image by Sangudo Cool Morning Run Image by Iguanasan A couple out for a morning run near the Halifax Public Gardens Studio57clinic team ... http:// ow.ly/SCLu50gtchZ";;;#fitnesstracker;"963201607851827202";https://twitter.com/moviesoutnoworg/status/963201607851827202
SpringGardenRd;2018-02-02 10:12;4;5;"#ShubenacadieSam seems to think we’re in for an early spring! We’ve decided to believe him. Happy Friday! #groundhogday #halifaxpublicgardens #springgardenarea #halifax #tgif pic.twitter.com/OSkp43N7pS";;;#ShubenacadieSam #groundhogday #halifaxpublicgardens #springgardenarea #halifax #tgif;"959429213660090371";https://twitter.com/SpringGardenRd/status/959429213660090371
David_Hendsbee;2018-02-01 16:01;1;4;"PUBLIC GARDENS WINTER WONDERLAND The Halifax Public Gardens will be open year-round, starting this winter from 8 AM to 4 PM throughout the winter months as weather permits. The Public Gardens always look splendid regardless of what season it is. pic.twitter.com/xvqOkpBc4k";;;;"959154809487155200";https://twitter.com/David_Hendsbee/status/959154809487155200
SeasideFM;2018-01-30 06:35;0;1;"Retweeted hfxgov ( @hfxgov ): The #Halifax Public Gardens will not open on Tuesday due to the impending bad weather.";;@hfxgov;#Halifax;"958287645246935041";https://twitter.com/SeasideFM/status/958287645246935041
hfxgov;2018-01-29 15:42;8;8;"The #Halifax Public Gardens will not open on Tuesday due to the impending bad weather.";;;#Halifax;"958062821560012800";https://twitter.com/hfxgov/status/958062821560012800
quiltingyogi;2018-01-26 20:02;0;0;"Hanging out at the Public Gardens #publicgardenshalifax @Halifax Public Gardens https://www. instagram.com/p/Bebpx-nlt6T/";;@Halifax;#publicgardenshalifax;"957041148001910784";https://twitter.com/quiltingyogi/status/957041148001910784
quiltingyogi;2018-01-26 19:58;0;0;"Hanging out at the Public Gardens #publicgardenshalifax @Halifax Public Gardens https://www. instagram.com/p/BebpQgJFwjc/";;@Halifax;#publicgardenshalifax;"957039997105967104";https://twitter.com/quiltingyogi/status/957039997105967104
TourismNS;2018-01-26 15:43;0;0;"Hi Curtis, great to hear you'll be paying Nova Scotia a visit! The Halifax Public Gardens are beautiful in May, and so is our waterfront - which has many stroller-friendly areas. Point Pleasant Park also has some paved paths along the water. What do you think @VisitNovaScotia ?";;@VisitNovaScotia;;"956975971743264768";https://twitter.com/TourismNS/status/956975971743264768
NS_Procure;2018-01-26 13:30;1;0;"Griffins Pond Sediment Removal - Halifax Public Gardens | HRM #nsmash https:// goo.gl/9WGUVS";;;#nsmash;"956942476518002689";https://twitter.com/NS_Procure/status/956942476518002689
DrRob_Thacker;2018-01-21 14:06;2;16;"Can't resist (sorry!) posting just a few more pics from the #Halifax public gardens. Oh and should say, @LM_Campbell must have some amazing infrared pics! pic.twitter.com/dzkR8RRh9k";;@LM_Campbell;#Halifax;"955139568386396160";https://twitter.com/DrRob_Thacker/status/955139568386396160
DrRob_Thacker;2018-01-21 13:45;0;12;"Fun with shadows at the #Halifax public gardens. Beautiful sunny Sunday, but be warned the paths are very icy. pic.twitter.com/862SRtvrQZ";;;#Halifax;"955134327523770369";https://twitter.com/DrRob_Thacker/status/955134327523770369
azuretan;2018-01-20 10:42;0;0;"I'm at Halifax Public Gardens in Halifax, NS https://www. swarmapp.com/c/6E6X76qB8tz pic.twitter.com/iwLFWzRTmo";;;;"954725786409488385";https://twitter.com/azuretan/status/954725786409488385
VisitNovaScotia;2018-01-18 15:18;12;52;"The Halifax Public Gardens is a beautiful place to admire some freshly fallen snow and this year it's open to the public during winter. : @timbophoto via Instagram. #VisitNovaScotia @ExploreCanada pic.twitter.com/0UPh07g4Ay";;@timbophoto @ExploreCanada;#VisitNovaScotia;"954070487948197888";https://twitter.com/VisitNovaScotia/status/954070487948197888
MarcusTran14;2018-01-18 13:33;0;0;"Just posted a photo @Halifax Public Gardens https://www. instagram.com/p/BeGW2D7lvt3f _ahvhk6EqjRjYaKR8EafDZfOSU0/ …";;@Halifax;;"954044017578299392";https://twitter.com/MarcusTran14/status/954044017578299392
